563353,22636,CHILDS BREAKFAST SET CIRCUS PARADE,4,2011-08-15 14:32:00,8.5,15480.0
563353,23172,REGENCY TEA PLATE PINK,12,2011-08-15 14:32:00,1.65,15480.0
563353,23170,REGENCY TEA PLATE ROSES,12,2011-08-15 14:32:00,1.65,15480.0
563353,23171,REGENCY TEA PLATE GREEN,12,2011-08-15 14:32:00,1.65,15480.0
563353,84817,DANISH ROSE DECORATIVE PLATE,6,2011-08-15 14:32:00,2.1,15480.0
563353,22698,PINK REGENCY TEACUP AND SAUCER,6,2011-08-15 14:32:00,2.95,15480.0
563353,22699,ROSES REGENCY TEACUP AND SAUCER,6,2011-08-15 14:32:00,2.95,15480.0
563353,22697,GREEN REGENCY TEACUP AND SAUCER,6,2011-08-15 14:32:00,2.95,15480.0
563353,84997D,CHILDRENS CUTLERY POLKADOT PINK,4,2011-08-15 14:32:00,4.15,15480.0
563353,23255,CHILDRENS CUTLERY CIRCUS PARADE,4,2011-08-15 14:32:00,4.15,15480.0
563353,23256,CHILDRENS CUTLERY SPACEBOY,4,2011-08-15 14:32:00,4.15,15480.0
563353,23254,CHILDRENS CUTLERY DOLLY GIRL,4,2011-08-15 14:32:00,4.15,15480.0
563353,23173,REGENCY TEAPOT ROSES,8,2011-08-15 14:32:00,9.95,15480.0
563353,23243,SET OF TEA COFFEE SUGAR TINS PANTRY,4,2011-08-15 14:32:00,4.95,15480.0
563353,20998,ROSE DU SUD OVEN GLOVE,6,2011-08-15 14:32:00,2.95,15480.0
563353,84820,DANISH ROSE TRINKET TRAYS,2,2011-08-15 14:32:00,5.95,15480.0
563353,22720,SET OF 3 CAKE TINS PANTRY DESIGN,3,2011-08-15 14:32:00,4.95,15480.0
563353,22723,SET OF 6 HERB TINS SKETCHBOOK,4,2011-08-15 14:32:00,3.95,15480.0
563353,22112,CHOCOLATE HOT WATER BOTTLE,3,2011-08-15 14:32:00,4.95,15480.0
563353,22111,SCOTTIE DOG HOT WATER BOTTLE,3,2011-08-15 14:32:00,4.95,15480.0
563353,84030E,ENGLISH ROSE HOT WATER BOTTLE,4,2011-08-15 14:32:00,4.25,15480.0
563353,22983,CARD BILLBOARD FONT,12,2011-08-15 14:32:00,0.42,15480.0
563353,22984,CARD GINGHAM ROSE,12,2011-08-15 14:32:00,0.42,15480.0
563353,84251B,"GREETING CARD, STICKY GORDON",12,2011-08-15 14:32:00,0.19,15480.0
563353,22960,JAM MAKING SET WITH JARS,6,2011-08-15 14:32:00,4.25,15480.0
563353,22742,MAKE YOUR OWN PLAYTIME CARD KIT,6,2011-08-15 14:32:00,2.95,15480.0
563353,22405,MONEY BOX POCKET MONEY DESIGN,12,2011-08-15 14:32:00,1.25,15480.0
563353,22138,BAKING SET 9 PIECE RETROSPOT,3,2011-08-15 14:32:00,4.95,15480.0
563353,22617,BAKING SET SPACEBOY DESIGN,3,2011-08-15 14:32:00,4.95,15480.0
563353,22969,HOMEMADE JAM SCENTED CANDLES,12,2011-08-15 14:32:00,1.45,15480.0
563353,37495,FAIRY CAKE BIRTHDAY CANDLE SET,4,2011-08-15 14:32:00,3.75,15480.0
563353,22687,DOORMAT CHRISTMAS VILLAGE,2,2011-08-15 14:32:00,7.95,15480.0
563353,22689,DOORMAT MERRY CHRISTMAS RED,2,2011-08-15 14:32:00,7.95,15480.0
563353,22959,WRAP CHRISTMAS VILLAGE,25,2011-08-15 14:32:00,0.42,15480.0
563353,22818,CARD CHRISTMAS VILLAGE,12,2011-08-15 14:32:00,0.42,15480.0
563353,23245,SET OF 3 REGENCY CAKE TINS,8,2011-08-15 14:32:00,4.95,15480.0
563353,23290,SPACEBOY CHILDRENS BOWL,8,2011-08-15 14:32:00,1.25,15480.0
563353,23291,DOLLY GIRL CHILDRENS CUP,8,2011-08-15 14:32:00,1.25,15480.0
563353,23289,DOLLY GIRL CHILDRENS BOWL,8,2011-08-15 14:32:00,1.25,15480.0
563353,23292,SPACEBOY CHILDRENS CUP,8,2011-08-15 14:32:00,1.25,15480.0
563353,23174,REGENCY SUGAR BOWL GREEN,8,2011-08-15 14:32:00,4.15,15480.0
563353,22423,REGENCY CAKESTAND 3 TIER,7,2011-08-15 14:32:00,12.75,15480.0
563353,23253,16 PIECE CUTLERY SET PANTRY DESIGN,2,2011-08-15 14:32:00,15.95,15480.0
563353,22634,CHILDS BREAKFAST SET SPACEBOY,2,2011-08-15 14:32:00,9.95,15480.0
563353,22635,CHILDS BREAKFAST SET DOLLY GIRL,4,2011-08-15 14:32:00,9.95,15480.0
563936,72807B,SET/3 OCEAN SCENT CANDLE JEWEL BOX,4,2011-08-22 09:03:00,4.25,17828.0
563936,72807A,SET/3 ROSE CANDLE IN JEWELLED BOX,4,2011-08-22 09:03:00,4.25,17828.0
563936,72741,GRAND CHOCOLATECANDLE,18,2011-08-22 09:03:00,1.45,17828.0
563936,POST,POSTAGE,1,2011-08-22 09:03:00,40.0,17828.0
563936,22766,PHOTO FRAME CORNICE,8,2011-08-22 09:03:00,2.95,17828.0
563936,23269,SET OF 2 CERAMIC CHRISTMAS TREES,12,2011-08-22 09:03:00,1.45,17828.0
563936,21695,SMALL SILVER FLOWER CANDLE POT,6,2011-08-22 09:03:00,2.95,17828.0
563936,22065,CHRISTMAS PUDDING TRINKET POT,12,2011-08-22 09:03:00,1.45,17828.0
563936,22768,FAMILY PHOTO FRAME CORNICE,2,2011-08-22 09:03:00,9.95,17828.0
563936,23268,SET OF 2 CERAMIC CHRISTMAS REINDEER,12,2011-08-22 09:03:00,1.45,17828.0
C564751,22065,CHRISTMAS PUDDING TRINKET POT,-4,2011-08-30 10:06:00,1.45,17828.0
C564751,22768,FAMILY PHOTO FRAME CORNICE,-1,2011-08-30 10:06:00,9.95,17828.0
