536944,22383,LUNCH BAG SUKI  DESIGN,70,2010-12-03 12:20:00,1.65,12557.0
536944,22384,LUNCH BAG PINK POLKADOT,100,2010-12-03 12:20:00,1.45,12557.0
536944,20727,LUNCH BAG  BLACK SKULL.,60,2010-12-03 12:20:00,1.65,12557.0
536944,20725,LUNCH BAG RED RETROSPOT,70,2010-12-03 12:20:00,1.65,12557.0
536944,20728,LUNCH BAG CARS BLUE,100,2010-12-03 12:20:00,1.45,12557.0
538095,22504,CABIN BAG VINTAGE RETROSPOT,1,2010-12-09 14:55:00,29.95,17097.0
538095,22212,FOUR HOOK  WHITE LOVEBIRDS,1,2010-12-09 14:55:00,2.1,17097.0
538095,22953,BIRTHDAY PARTY CORDON BARRIER TAPE,1,2010-12-09 14:55:00,1.25,17097.0
538095,84818,DANISH ROSE PHOTO FRAME,1,2010-12-09 14:55:00,2.55,17097.0
538095,21114,LAVENDER SCENTED FABRIC HEART,5,2010-12-09 14:55:00,1.25,17097.0
538095,84692,BOX OF 24 COCKTAIL PARASOLS,1,2010-12-09 14:55:00,0.42,17097.0
538095,22796,PHOTO FRAME 3 CLASSIC HANGING,2,2010-12-09 14:55:00,9.95,17097.0
538095,40001,WHITE BAMBOO RIBS LAMPSHADE,1,2010-12-09 14:55:00,0.85,17097.0
538095,22646,CERAMIC STRAWBERRY CAKE MONEY BANK,1,2010-12-09 14:55:00,1.45,17097.0
538095,21883,STARS GIFT TAPE,2,2010-12-09 14:55:00,0.65,17097.0
538095,21879,HEARTS GIFT TAPE,2,2010-12-09 14:55:00,0.65,17097.0
538095,22494,EMERGENCY FIRST AID TIN,2,2010-12-09 14:55:00,1.25,17097.0
538095,47566,PARTY BUNTING,1,2010-12-09 14:55:00,4.65,17097.0
538095,85123A,WHITE HANGING HEART T-LIGHT HOLDER,1,2010-12-09 14:55:00,2.95,17097.0
538095,21430,SET/3 RED GINGHAM ROSE STORAGE BOX,1,2010-12-09 14:55:00,3.75,17097.0
538095,22914,BLUE COAT RACK PARIS FASHION,1,2010-12-09 14:55:00,4.95,17097.0
538095,22913,RED COAT RACK PARIS FASHION,1,2010-12-09 14:55:00,4.95,17097.0
538095,22912,YELLOW COAT RACK PARIS FASHION,1,2010-12-09 14:55:00,4.95,17097.0
538095,22631,CIRCUS PARADE LUNCH BOX,1,2010-12-09 14:55:00,1.95,17097.0
538095,22497,SET OF 2 TINS VINTAGE BATHROOM,2,2010-12-09 14:55:00,4.25,17097.0
538095,22909,SET OF 20 VINTAGE CHRISTMAS NAPKINS,2,2010-12-09 14:55:00,0.85,17097.0
538095,22862,LOVE HEART NAPKIN BOX,1,2010-12-09 14:55:00,4.25,17097.0
538095,22726,ALARM CLOCK BAKELIKE GREEN,2,2010-12-09 14:55:00,3.75,17097.0
538095,20828,GLITTER BUTTERFLY CLIPS,1,2010-12-09 14:55:00,2.55,17097.0
538095,20829,GLITTER HANGING BUTTERFLY STRING,1,2010-12-09 14:55:00,2.1,17097.0
538095,72819,CUPID DESIGN SCENTED CANDLES,1,2010-12-09 14:55:00,2.55,17097.0
538095,22500,SET OF 2 TINS JARDIN DE PROVENCE,2,2010-12-09 14:55:00,4.95,17097.0
538095,22577,WOODEN HEART CHRISTMAS SCANDINAVIAN,3,2010-12-09 14:55:00,0.85,17097.0
538095,22579,WOODEN TREE CHRISTMAS SCANDINAVIAN,3,2010-12-09 14:55:00,0.85,17097.0
538095,22571,ROCKING HORSE RED CHRISTMAS,3,2010-12-09 14:55:00,0.85,17097.0
538095,22572,ROCKING HORSE GREEN CHRISTMAS,3,2010-12-09 14:55:00,0.85,17097.0
538095,22338,STAR DECORATION PAINTED ZINC,2,2010-12-09 14:55:00,0.65,17097.0
538095,22335,HEART DECORATION PAINTED ZINC,2,2010-12-09 14:55:00,0.65,17097.0
538095,22573,STAR WOODEN CHRISTMAS DECORATION,3,2010-12-09 14:55:00,0.85,17097.0
538095,35958,FOLKART ZINC STAR CHRISTMAS DEC,2,2010-12-09 14:55:00,0.85,17097.0
538095,35961,FOLKART ZINC HEART CHRISTMAS DEC,2,2010-12-09 14:55:00,0.85,17097.0
538095,22469,HEART OF WICKER SMALL,1,2010-12-09 14:55:00,1.65,17097.0
538095,22695,WICKER WREATH SMALL,1,2010-12-09 14:55:00,1.45,17097.0
538095,21217,RED RETROSPOT ROUND CAKE TINS,1,2010-12-09 14:55:00,9.95,17097.0
538095,22809,SET OF 6 T-LIGHTS SANTA,2,2010-12-09 14:55:00,2.95,17097.0
538525,84347,ROTATING SILVER ANGELS T-LIGHT HLDR,36,2010-12-13 09:39:00,2.55,12540.0
538525,21164,HOME SWEET HOME METAL SIGN,12,2010-12-13 09:39:00,2.95,12540.0
538525,21506,"FANCY FONT BIRTHDAY CARD,",24,2010-12-13 09:39:00,0.42,12540.0
538525,22023,EMPIRE BIRTHDAY CARD,12,2010-12-13 09:39:00,0.42,12540.0
538525,22819,"BIRTHDAY CARD, RETRO SPOT",12,2010-12-13 09:39:00,0.42,12540.0
538525,21519,GIN & TONIC DIET GREETING CARD,12,2010-12-13 09:39:00,0.42,12540.0
538525,22030,SWALLOWS GREETING CARD,12,2010-12-13 09:39:00,0.42,12540.0
538525,22620,4 TRADITIONAL SPINNING TOPS,12,2010-12-13 09:39:00,1.25,12540.0
538525,84077,WORLD WAR 2 GLIDERS ASSTD DESIGNS,48,2010-12-13 09:39:00,0.29,12540.0
538525,22553,PLASTERS IN TIN SKULLS,24,2010-12-13 09:39:00,1.65,12540.0
538525,22556,PLASTERS IN TIN CIRCUS PARADE,24,2010-12-13 09:39:00,1.65,12540.0
538525,22423,REGENCY CAKESTAND 3 TIER,10,2010-12-13 09:39:00,12.75,12540.0
538525,22120,WELCOME  WOODEN BLOCK LETTERS,6,2010-12-13 09:39:00,9.95,12540.0
538525,21754,HOME BUILDING BLOCK WORD,6,2010-12-13 09:39:00,5.95,12540.0
538525,21755,LOVE BUILDING BLOCK WORD,9,2010-12-13 09:39:00,5.95,12540.0
538525,21340,CLASSIC METAL BIRDCAGE PLANT HOLDER,8,2010-12-13 09:39:00,9.95,12540.0
538525,POST,POSTAGE,5,2010-12-13 09:39:00,28.0,12540.0
538525,21479,WHITE SKULL HOT WATER BOTTLE,4,2010-12-13 09:39:00,3.75,12540.0
538525,84029E,RED WOOLLY HOTTIE WHITE HEART.,8,2010-12-13 09:39:00,3.75,12540.0
538525,22837,HOT WATER BOTTLE BABUSHKA,16,2010-12-13 09:39:00,4.65,12540.0
539351,85099C,JUMBO  BAG BAROQUE BLACK WHITE,10,2010-12-17 11:23:00,1.95,12551.0
539351,85099B,JUMBO BAG RED RETROSPOT,10,2010-12-17 11:23:00,1.95,12551.0
539351,22386,JUMBO BAG PINK POLKADOT,10,2010-12-17 11:23:00,1.95,12551.0
539351,21928,JUMBO BAG SCANDINAVIAN PAISLEY,10,2010-12-17 11:23:00,1.95,12551.0
539351,20712,JUMBO BAG WOODLAND ANIMALS,10,2010-12-17 11:23:00,1.95,12551.0
539351,20716,PARTY FOOD SHOPPER BAG,10,2010-12-17 11:23:00,1.25,12551.0
539351,20717,STRAWBERRY SHOPPER BAG,10,2010-12-17 11:23:00,1.25,12551.0
539351,20718,RED RETROSPOT SHOPPER BAG,10,2010-12-17 11:23:00,1.25,12551.0
539351,21934,SKULL SHOULDER BAG,10,2010-12-17 11:23:00,1.65,12551.0
539351,21935,SUKI  SHOULDER BAG,10,2010-12-17 11:23:00,1.65,12551.0
C540271,M,Manual,-1,2011-01-06 11:51:00,1126.0,12503.0
540469,POST,POSTAGE,4,2011-01-07 14:04:00,28.0,12484.0
540469,22814,CARD PARTY GAMES,12,2011-01-07 14:04:00,0.42,12484.0
540469,21500,PINK POLKADOT WRAP,25,2011-01-07 14:04:00,0.42,12484.0
540469,22045,SPACEBOY GIFT WRAP,25,2011-01-07 14:04:00,0.42,12484.0
540469,22711,WRAP CIRCUS PARADE,25,2011-01-07 14:04:00,0.42,12484.0
540469,22047,EMPIRE GIFT WRAP,25,2011-01-07 14:04:00,0.42,12484.0
540469,84251B,"GREETING CARD, STICKY GORDON",12,2011-01-07 14:04:00,0.19,12484.0
540469,84251C,"GREETING CARD, TWO SISTERS.",12,2011-01-07 14:04:00,0.19,12484.0
540469,22023,EMPIRE BIRTHDAY CARD,12,2011-01-07 14:04:00,0.42,12484.0
540469,22716,CARD CIRCUS PARADE,12,2011-01-07 14:04:00,0.42,12484.0
540469,22029,SPACEBOY BIRTHDAY CARD,12,2011-01-07 14:04:00,0.42,12484.0
540469,22820,GIFT BAG BIRTHDAY,12,2011-01-07 14:04:00,0.65,12484.0
540469,21544,SKULLS  WATER TRANSFER TATTOOS,10,2011-01-07 14:04:00,0.85,12484.0
540469,21679,SKULLS  STICKERS,6,2011-01-07 14:04:00,0.85,12484.0
540469,21677,HEARTS  STICKERS,6,2011-01-07 14:04:00,0.85,12484.0
540469,22745,POPPY'S PLAYHOUSE BEDROOM,3,2011-01-07 14:04:00,2.1,12484.0
540469,22746,POPPY'S PLAYHOUSE LIVINGROOM,3,2011-01-07 14:04:00,2.1,12484.0
540469,22748,POPPY'S PLAYHOUSE KITCHEN,3,2011-01-07 14:04:00,2.1,12484.0
540469,22548,HEADS AND TAILS SPORTING FUN,4,2011-01-07 14:04:00,1.25,12484.0
540469,21912,VINTAGE SNAKES & LADDERS,3,2011-01-07 14:04:00,3.75,12484.0
540469,22550,HOLIDAY FUN LUDO,3,2011-01-07 14:04:00,3.75,12484.0
540469,84898F,YELLOW FLOWERS FELT HANDBAG KIT,4,2011-01-07 14:04:00,2.1,12484.0
540469,22148,EASTER CRAFT 4 CHICKS,4,2011-01-07 14:04:00,1.95,12484.0
540469,22750,FELTCRAFT PRINCESS LOLA DOLL,2,2011-01-07 14:04:00,3.75,12484.0
540469,22751,FELTCRAFT PRINCESS OLIVIA DOLL,2,2011-01-07 14:04:00,3.75,12484.0
540469,22749,FELTCRAFT PRINCESS CHARLOTTE DOLL,2,2011-01-07 14:04:00,3.75,12484.0
540469,20971,PINK BLUE FELT CRAFT TRINKET BOX,3,2011-01-07 14:04:00,1.25,12484.0
540469,20972,PINK CREAM FELT CRAFT TRINKET BOX,3,2011-01-07 14:04:00,1.25,12484.0
540469,47590A,BLUE HAPPY BIRTHDAY BUNTING,4,2011-01-07 14:04:00,5.45,12484.0
540469,47590B,PINK HAPPY BIRTHDAY BUNTING,5,2011-01-07 14:04:00,5.45,12484.0
540469,47566B,TEA TIME PARTY BUNTING,4,2011-01-07 14:04:00,4.65,12484.0
540469,48138,DOORMAT UNION FLAG,1,2011-01-07 14:04:00,7.95,12484.0
540469,48111,DOORMAT 3 SMILEY CATS,1,2011-01-07 14:04:00,7.95,12484.0
540469,48129,DOORMAT TOPIARY,1,2011-01-07 14:04:00,7.95,12484.0
540469,21955,DOORMAT UNION JACK GUNS AND ROSES,1,2011-01-07 14:04:00,7.95,12484.0
540469,22646,CERAMIC STRAWBERRY CAKE MONEY BANK,4,2011-01-07 14:04:00,1.45,12484.0
540469,22505,MEMO BOARD COTTAGE DESIGN,4,2011-01-07 14:04:00,4.95,12484.0
540469,22507,MEMO BOARD RETROSPOT  DESIGN,2,2011-01-07 14:04:00,4.95,12484.0
540469,20978,36 PENCILS TUBE SKULLS,6,2011-01-07 14:04:00,1.25,12484.0
540469,22693,GROW A FLYTRAP OR SUNFLOWER IN TIN,24,2011-01-07 14:04:00,1.25,12484.0
540469,20970,PINK FLORAL FELTCRAFT SHOULDER BAG,3,2011-01-07 14:04:00,3.75,12484.0
540469,20967,GREY FLORAL FELTCRAFT SHOULDER BAG,3,2011-01-07 14:04:00,3.75,12484.0
540469,22382,LUNCH BAG SPACEBOY DESIGN,6,2011-01-07 14:04:00,1.65,12484.0
540469,20727,LUNCH BAG  BLACK SKULL.,6,2011-01-07 14:04:00,1.65,12484.0
540469,22384,LUNCH BAG PINK POLKADOT,6,2011-01-07 14:04:00,1.65,12484.0
540469,20725,LUNCH BAG RED RETROSPOT,4,2011-01-07 14:04:00,1.65,12484.0
540469,20728,LUNCH BAG CARS BLUE,5,2011-01-07 14:04:00,1.65,12484.0
540469,84755,COLOUR GLASS T-LIGHT HOLDER HANGING,8,2011-01-07 14:04:00,0.65,12484.0
540469,22561,WOODEN SCHOOL COLOURING SET,6,2011-01-07 14:04:00,1.65,12484.0
540469,22804,CANDLEHOLDER PINK HANGING HEART,6,2011-01-07 14:04:00,2.95,12484.0
540469,85123A,WHITE HANGING HEART T-LIGHT HOLDER,6,2011-01-07 14:04:00,2.95,12484.0
540469,22197,SMALL POPCORN HOLDER,12,2011-01-07 14:04:00,0.85,12484.0
540469,22189,CREAM HEART CARD HOLDER,4,2011-01-07 14:04:00,3.95,12484.0
540469,22492,MINI PAINT SET VINTAGE,36,2011-01-07 14:04:00,0.65,12484.0
540469,22891,TEA FOR ONE POLKADOT,6,2011-01-07 14:04:00,4.25,12484.0
540469,21062,PARTY INVITES SPACEMAN,10,2011-01-07 14:04:00,0.85,12484.0
540469,21063,PARTY INVITES JAZZ HEARTS,12,2011-01-07 14:04:00,0.85,12484.0
540469,22969,HOMEMADE JAM SCENTED CANDLES,12,2011-01-07 14:04:00,1.45,12484.0
540469,75013B,"STRING OF 8 BUTTERFLIES,PINK",6,2011-01-07 14:04:00,1.65,12484.0
540469,20752,BLUE POLKADOT WASHING UP GLOVES,2,2011-01-07 14:04:00,2.1,12484.0
540469,20754,RETROSPOT RED WASHING UP GLOVES,2,2011-01-07 14:04:00,2.1,12484.0
540469,20751,FUNKY WASHING UP GLOVES ASSORTED,4,2011-01-07 14:04:00,2.1,12484.0
540469,21479,WHITE SKULL HOT WATER BOTTLE,2,2011-01-07 14:04:00,3.75,12484.0
540469,22111,SCOTTIE DOG HOT WATER BOTTLE,2,2011-01-07 14:04:00,4.95,12484.0
540469,22112,CHOCOLATE HOT WATER BOTTLE,2,2011-01-07 14:04:00,4.95,12484.0
540469,22835,HOT WATER BOTTLE I AM SO POORLY,2,2011-01-07 14:04:00,4.65,12484.0
540469,21485,RETROSPOT HEART HOT WATER BOTTLE,2,2011-01-07 14:04:00,4.95,12484.0
540469,22113,GREY HEART HOT WATER BOTTLE,2,2011-01-07 14:04:00,3.75,12484.0
540469,51014L,"FEATHER PEN,LIGHT PINK",12,2011-01-07 14:04:00,0.85,12484.0
540469,51014A,"FEATHER PEN,HOT PINK",12,2011-01-07 14:04:00,0.85,12484.0
540469,22900,SET 2 TEA TOWELS I LOVE LONDON,8,2011-01-07 14:04:00,2.95,12484.0
540469,22109,FULL ENGLISH BREAKFAST PLATE,2,2011-01-07 14:04:00,3.75,12484.0
540469,22629,SPACEBOY LUNCH BOX,5,2011-01-07 14:04:00,1.95,12484.0
540469,21559,STRAWBERRY LUNCH BOX WITH CUTLERY,6,2011-01-07 14:04:00,2.55,12484.0
540469,22196,SMALL HEART MEASURING SPOONS,4,2011-01-07 14:04:00,0.85,12484.0
540469,22195,LARGE HEART MEASURING SPOONS,4,2011-01-07 14:04:00,1.65,12484.0
540469,22966,GINGERBREAD MAN COOKIE CUTTER,3,2011-01-07 14:04:00,1.25,12484.0
540469,37482P,CUBIC MUG PINK POLKADOT,6,2011-01-07 14:04:00,2.55,12484.0
540469,22423,REGENCY CAKESTAND 3 TIER,3,2011-01-07 14:04:00,12.75,12484.0
540469,22964,3 PIECE SPACEBOY COOKIE CUTTER SET,4,2011-01-07 14:04:00,2.1,12484.0
540469,21232,STRAWBERRY CERAMIC TRINKET BOX,4,2011-01-07 14:04:00,1.25,12484.0
540469,37343,POLKADOT MUG PINK,6,2011-01-07 14:04:00,1.65,12484.0
540469,22636,CHILDS BREAKFAST SET CIRCUS PARADE,4,2011-01-07 14:04:00,8.5,12484.0
540469,22090,PAPER BUNTING RETROSPOT,3,2011-01-07 14:04:00,2.95,12484.0
540469,22083,PAPER CHAIN KIT RETROSPOT,6,2011-01-07 14:04:00,2.95,12484.0
540469,21289,LARGE STRIPES CHOCOLATE GIFT BAG,16,2011-01-07 14:04:00,1.25,12484.0
540469,20828,GLITTER BUTTERFLY CLIPS,6,2011-01-07 14:04:00,2.55,12484.0
540469,22862,LOVE HEART NAPKIN BOX,4,2011-01-07 14:04:00,4.25,12484.0
540469,84378,SET OF 3 HEART COOKIE CUTTERS,4,2011-01-07 14:04:00,1.25,12484.0
540469,84380,SET OF 3 BUTTERFLY COOKIE CUTTERS,4,2011-01-07 14:04:00,1.25,12484.0
540469,22236,CAKE STAND 3 TIER MAGIC GARDEN,3,2011-01-07 14:04:00,12.75,12484.0
540469,21355,TOAST ITS - I LOVE YOU,3,2011-01-07 14:04:00,1.25,12484.0
540469,21358,TOAST ITS - HAPPY BIRTHDAY,3,2011-01-07 14:04:00,1.25,12484.0
540469,35965,FOLKART HEART NAPKIN RINGS,4,2011-01-07 14:04:00,2.95,12484.0
540469,21210,SET OF 72 RETROSPOT PAPER  DOILIES,2,2011-01-07 14:04:00,1.45,12484.0
540469,21974,SET OF 36 PAISLEY FLOWER DOILIES,2,2011-01-07 14:04:00,1.45,12484.0
540469,21973,SET OF 36 MUSHROOM PAPER DOILIES,2,2011-01-07 14:04:00,1.45,12484.0
540469,84987,SET OF 36 TEATIME PAPER DOILIES,2,2011-01-07 14:04:00,1.45,12484.0
540550,22962,JAM JAR WITH PINK LID,12,2011-01-10 09:11:00,0.85,12539.0
540550,22961,JAM MAKING SET PRINTED,12,2011-01-10 09:11:00,1.45,12539.0
540550,22960,JAM MAKING SET WITH JARS,6,2011-01-10 09:11:00,4.25,12539.0
540550,22430,ENAMEL WATERING CAN CREAM,4,2011-01-10 09:11:00,4.95,12539.0
540550,21547,CERAMIC BIRDHOUSE CRESTED TIT SMALL,6,2011-01-10 09:11:00,2.95,12539.0
540550,21944,KITTENS DESIGN FLANNEL,12,2011-01-10 09:11:00,0.85,12539.0
540550,21121,SET/10 RED POLKADOT PARTY CANDLES,24,2011-01-10 09:11:00,1.25,12539.0
540550,21123,SET/10 IVORY POLKADOT PARTY CANDLES,24,2011-01-10 09:11:00,1.25,12539.0
540550,21122,SET/10 PINK POLKADOT PARTY CANDLES,24,2011-01-10 09:11:00,1.25,12539.0
540550,21126,SET OF 6 GIRLS CELEBRATION CANDLES,12,2011-01-10 09:11:00,1.25,12539.0
540550,21125,SET 6 FOOTBALL CELEBRATION CANDLES,12,2011-01-10 09:11:00,1.25,12539.0
540550,62094B,TURQ ICE CREAM BUM BAG,6,2011-01-10 09:11:00,2.55,12539.0
540550,21929,JUMBO BAG PINK VINTAGE PAISLEY,10,2011-01-10 09:11:00,1.95,12539.0
540550,47594B,SCOTTIES DESIGN WASHBAG,6,2011-01-10 09:11:00,1.95,12539.0
540550,84912B,GREEN ROSE WASHBAG,4,2011-01-10 09:11:00,3.75,12539.0
540550,84032A,CHARLIE+LOLA PINK HOT WATER BOTTLE,6,2011-01-10 09:11:00,2.95,12539.0
540550,22111,SCOTTIE DOG HOT WATER BOTTLE,3,2011-01-10 09:11:00,4.95,12539.0
540550,22690,DOORMAT HOME SWEET HOME BLUE,2,2011-01-10 09:11:00,7.95,12539.0
540550,21710,FOLDING UMBRELLA PINKWHITE POLKADOT,4,2011-01-10 09:11:00,4.95,12539.0
540550,84050,PINK HEART SHAPE EGG FRYING PAN,6,2011-01-10 09:11:00,1.65,12539.0
540550,21977,PACK OF 60 PINK PAISLEY CAKE CASES,24,2011-01-10 09:11:00,0.55,12539.0
540550,22956,36 FOIL HEART CAKE CASES,6,2011-01-10 09:11:00,2.1,12539.0
540550,35810A,ENAMEL PINK COFFEE CONTAINER,6,2011-01-10 09:11:00,2.1,12539.0
540550,35809A,ENAMEL PINK TEA CONTAINER,6,2011-01-10 09:11:00,2.1,12539.0
540550,22358,KINGS CHOICE TEA CADDY,6,2011-01-10 09:11:00,2.95,12539.0
540550,22659,LUNCH BOX I LOVE LONDON,12,2011-01-10 09:11:00,1.95,12539.0
540550,22629,SPACEBOY LUNCH BOX,12,2011-01-10 09:11:00,1.95,12539.0
540550,22630,DOLLY GIRL LUNCH BOX,12,2011-01-10 09:11:00,1.95,12539.0
540550,21561,DINOSAUR LUNCH BOX WITH CUTLERY,6,2011-01-10 09:11:00,2.55,12539.0
540550,21559,STRAWBERRY LUNCH BOX WITH CUTLERY,6,2011-01-10 09:11:00,2.55,12539.0
540550,22702,BLACK AND WHITE CAT BOWL,6,2011-01-10 09:11:00,2.1,12539.0
540550,22700,BLACK AND WHITE DOG BOWL,6,2011-01-10 09:11:00,2.95,12539.0
540550,22845,VINTAGE CREAM CAT FOOD CONTAINER,2,2011-01-10 09:11:00,6.35,12539.0
540550,22844,VINTAGE CREAM DOG FOOD CONTAINER,2,2011-01-10 09:11:00,8.5,12539.0
540550,22899,CHILDREN'S APRON DOLLY GIRL,6,2011-01-10 09:11:00,2.1,12539.0
540550,21625,VINTAGE UNION JACK APRON,3,2011-01-10 09:11:00,6.95,12539.0
540550,21042,RED RETROSPOT APRON,3,2011-01-10 09:11:00,5.95,12539.0
540550,22720,SET OF 3 CAKE TINS PANTRY DESIGN,3,2011-01-10 09:11:00,4.95,12539.0
540550,85132B,CHARLIE AND LOLA TABLE TINS,1,2011-01-10 09:11:00,9.95,12539.0
540550,22838,3 TIER CAKE TIN RED AND CREAM,1,2011-01-10 09:11:00,14.95,12539.0
540550,35241,ENAMEL BLUE RIM BISCUIT BIN,3,2011-01-10 09:11:00,4.95,12539.0
540550,22357,KINGS CHOICE BISCUIT TIN,4,2011-01-10 09:11:00,4.25,12539.0
540550,22849,BREAD BIN DINER STYLE MINT,1,2011-01-10 09:11:00,16.95,12539.0
540550,22847,BREAD BIN DINER STYLE IVORY,1,2011-01-10 09:11:00,16.95,12539.0
540550,85144,JARDIN ETCHED GLASS CHEESE DISH,2,2011-01-10 09:11:00,7.25,12539.0
540550,21657,MILK BOTTLE WITH GLASS STOPPER,3,2011-01-10 09:11:00,6.95,12539.0
540550,37444C,PINK BREAKFAST CUP AND SAUCER,4,2011-01-10 09:11:00,2.95,12539.0
540550,21530,DAIRY MAID TOASTRACK,6,2011-01-10 09:11:00,2.95,12539.0
540550,22107,PIZZA PLATE IN BOX,4,2011-01-10 09:11:00,3.75,12539.0
540550,84817,DANISH ROSE DECORATIVE PLATE,6,2011-01-10 09:11:00,2.1,12539.0
540550,20914,SET/5 RED RETROSPOT LID GLASS BOWLS,6,2011-01-10 09:11:00,2.95,12539.0
540550,22834,HAND WARMER BABUSHKA DESIGN,12,2011-01-10 09:11:00,2.1,12539.0
540550,21731,RED TOADSTOOL LED NIGHT LIGHT,12,2011-01-10 09:11:00,1.65,12539.0
540550,85232D,SET/3 DECOUPAGE STACKING TINS,3,2011-01-10 09:11:00,4.95,12539.0
540550,21622,VINTAGE UNION JACK CUSHION COVER,4,2011-01-10 09:11:00,4.95,12539.0
540550,22785,SQUARECUSHION COVER PINK UNION FLAG,2,2011-01-10 09:11:00,6.75,12539.0
540550,22675,FRENCH KITCHEN SIGN BLUE METAL,12,2011-01-10 09:11:00,1.25,12539.0
540550,22670,FRENCH WC SIGN BLUE METAL,12,2011-01-10 09:11:00,1.25,12539.0
540550,22674,FRENCH TOILET SIGN BLUE METAL,12,2011-01-10 09:11:00,1.25,12539.0
540550,84638,SMALL KITCHEN FLOWER POTS PLAQUE,2,2011-01-10 09:11:00,6.95,12539.0
540550,84637,KITCHEN FLOWER POTS WALL PLAQUE,3,2011-01-10 09:11:00,5.95,12539.0
540550,84631,FRUIT TREE AND BIRDS WALL PLAQUE,2,2011-01-10 09:11:00,7.95,12539.0
540550,22511,RETROSPOT BABUSHKA DOORSTOP,4,2011-01-10 09:11:00,3.75,12539.0
540550,47566,PARTY BUNTING,5,2011-01-10 09:11:00,4.65,12539.0
540550,84819,DANISH ROSE ROUND SEWING BOX,3,2011-01-10 09:11:00,4.25,12539.0
540550,22968,ROSE COTTAGE KEEPSAKE BOX,2,2011-01-10 09:11:00,9.95,12539.0
540550,22509,SEWING BOX RETROSPOT DESIGN,1,2011-01-10 09:11:00,16.95,12539.0
540550,22448,PIN CUSHION BABUSHKA RED,6,2011-01-10 09:11:00,3.35,12539.0
540550,22453,MEASURING TAPE BABUSHKA BLUE,6,2011-01-10 09:11:00,2.95,12539.0
540550,22452,MEASURING TAPE BABUSHKA PINK,6,2011-01-10 09:11:00,2.95,12539.0
540550,22077,6 RIBBONS RUSTIC CHARM,12,2011-01-10 09:11:00,1.65,12539.0
540550,22443,GROW YOUR OWN HERBS SET OF 3,2,2011-01-10 09:11:00,7.95,12539.0
540550,22271,FELTCRAFT DOLL ROSIE,6,2011-01-10 09:11:00,2.95,12539.0
540550,22743,MAKE YOUR OWN FLOWERPOWER CARD KIT,6,2011-01-10 09:11:00,2.95,12539.0
540550,22742,MAKE YOUR OWN PLAYTIME CARD KIT,6,2011-01-10 09:11:00,2.95,12539.0
540550,84509B,SET OF 4 FAIRY CAKE PLACEMATS,4,2011-01-10 09:11:00,3.75,12539.0
540550,84509A,SET OF 4 ENGLISH ROSE PLACEMATS,4,2011-01-10 09:11:00,3.75,12539.0
540550,21843,RED RETROSPOT CAKE STAND,1,2011-01-10 09:11:00,10.95,12539.0
540550,22184,CAKE STAND VICTORIAN FILIGREE LARGE,2,2011-01-10 09:11:00,8.5,12539.0
540550,22890,NOVELTY BISCUITS CAKE STAND 3 TIER,2,2011-01-10 09:11:00,9.95,12539.0
540550,22555,PLASTERS IN TIN STRONGMAN,12,2011-01-10 09:11:00,1.65,12539.0
540550,22557,PLASTERS IN TIN VINTAGE PAISLEY,12,2011-01-10 09:11:00,1.65,12539.0
540550,22554,PLASTERS IN TIN WOODLAND ANIMALS,12,2011-01-10 09:11:00,1.65,12539.0
540550,22209,WOOD STAMP SET HAPPY BIRTHDAY,12,2011-01-10 09:11:00,1.65,12539.0
540550,22208,WOOD STAMP SET THANK YOU,12,2011-01-10 09:11:00,1.65,12539.0
540550,21881,CUTE CATS TAPE,12,2011-01-10 09:11:00,0.65,12539.0
540550,21879,HEARTS GIFT TAPE,12,2011-01-10 09:11:00,0.65,12539.0
540550,21880,RED RETROSPOT TAPE,12,2011-01-10 09:11:00,0.65,12539.0
540550,22472,TV DINNER TRAY DOLLY GIRL,3,2011-01-10 09:11:00,4.95,12539.0
540550,22476,EMPIRE UNION JACK TV DINNER TRAY,3,2011-01-10 09:11:00,4.95,12539.0
540550,22312,OFFICE MUG WARMER POLKADOT,6,2011-01-10 09:11:00,2.95,12539.0
540550,22139,RETROSPOT TEA SET CERAMIC 11 PC,3,2011-01-10 09:11:00,4.95,12539.0
540550,22423,REGENCY CAKESTAND 3 TIER,14,2011-01-10 09:11:00,12.75,12539.0
540785,84997B,RED 3 PIECE RETROSPOT CUTLERY SET,144,2011-01-11 11:39:00,3.39,12557.0
540785,84997D,PINK 3 PIECE POLKADOT CUTLERY SET,360,2011-01-11 11:39:00,3.39,12557.0
540785,84997C,BLUE 3 PIECE POLKADOT CUTLERY SET,360,2011-01-11 11:39:00,3.39,12557.0
540785,84997A,GREEN 3 PIECE POLKADOT CUTLERY SET,144,2011-01-11 11:39:00,3.39,12557.0
540801,22077,6 RIBBONS RUSTIC CHARM,24,2011-01-11 12:25:00,1.65,12540.0
540801,22082,RIBBON REEL STRIPES DESIGN,10,2011-01-11 12:25:00,1.65,12540.0
540801,22078,RIBBON REEL LACE DESIGN,10,2011-01-11 12:25:00,2.1,12540.0
540801,85049G,CHOCOLATE BOX RIBBONS,12,2011-01-11 12:25:00,1.25,12540.0
540801,85049F,BABY BOOM RIBBONS,12,2011-01-11 12:25:00,1.25,12540.0
540801,84800L,LARGE WHITE/PINK ROSE ART FLOWER,24,2011-01-11 12:25:00,1.69,12540.0
540801,84879,ASSORTED COLOUR BIRD ORNAMENT,40,2011-01-11 12:25:00,1.69,12540.0
540801,21137,BLACK RECORD COVER FRAME,8,2011-01-11 12:25:00,3.75,12540.0
540801,82494L,WOODEN FRAME ANTIQUE WHITE,6,2011-01-11 12:25:00,2.95,12540.0
540801,22670,FRENCH WC SIGN BLUE METAL,12,2011-01-11 12:25:00,1.25,12540.0
540801,21218,RED SPOTTY BISCUIT TIN,12,2011-01-11 12:25:00,3.75,12540.0
540801,21212,PACK OF 72 RETROSPOT CAKE CASES,24,2011-01-11 12:25:00,0.55,12540.0
540801,84992,72 SWEETHEART FAIRY CAKE CASES,24,2011-01-11 12:25:00,0.55,12540.0
540801,22629,SPACEBOY LUNCH BOX,12,2011-01-11 12:25:00,1.95,12540.0
540801,21843,RED RETROSPOT CAKE STAND,8,2011-01-11 12:25:00,10.95,12540.0
540801,22423,REGENCY CAKESTAND 3 TIER,16,2011-01-11 12:25:00,10.95,12540.0
540801,21210,SET OF 72 RETROSPOT PAPER  DOILIES,12,2011-01-11 12:25:00,1.45,12540.0
540801,21844,RED RETROSPOT MUG,12,2011-01-11 12:25:00,2.95,12540.0
540801,21874,GIN AND TONIC MUG,12,2011-01-11 12:25:00,1.25,12540.0
540801,21877,HOME SWEET HOME MUG,12,2011-01-11 12:25:00,1.25,12540.0
540801,85019B,BLOSSOM  IMAGES NOTEBOOK SET,6,2011-01-11 12:25:00,4.25,12540.0
540801,85019C,CURIOUS  IMAGES NOTEBOOK SET,6,2011-01-11 12:25:00,4.25,12540.0
540801,21497,FANCY FONTS BIRTHDAY WRAP,25,2011-01-11 12:25:00,0.42,12540.0
540801,21498,RED RETROSPOT WRAP,25,2011-01-11 12:25:00,0.42,12540.0
540801,21499,BLUE POLKADOT WRAP,25,2011-01-11 12:25:00,0.42,12540.0
540801,84077,WORLD WAR 2 GLIDERS ASSTD DESIGNS,48,2011-01-11 12:25:00,0.29,12540.0
540801,21891,TRADITIONAL WOODEN SKIPPING ROPE,12,2011-01-11 12:25:00,1.25,12540.0
540801,22619,SET OF 6 SOLDIER SKITTLES,8,2011-01-11 12:25:00,3.75,12540.0
540801,22622,BOX OF VINTAGE ALPHABET BLOCKS,4,2011-01-11 12:25:00,9.95,12540.0
540801,21340,CLASSIC METAL BIRDCAGE PLANT HOLDER,8,2011-01-11 12:25:00,9.95,12540.0
540801,POST,POSTAGE,6,2011-01-11 12:25:00,28.0,12540.0
541491,22652,TRAVEL SEWING KIT,20,2011-01-18 14:04:00,1.65,12510.0
541491,22494,EMERGENCY FIRST AID TIN,12,2011-01-18 14:04:00,1.25,12510.0
541491,21137,BLACK RECORD COVER FRAME,8,2011-01-18 14:04:00,3.75,12510.0
541491,20750,RED RETROSPOT MINI CASES,12,2011-01-18 14:04:00,6.35,12510.0
541491,37370,RETRO COFFEE MUGS ASSORTED,24,2011-01-18 14:04:00,1.25,12510.0
541491,10002,INFLATABLE POLITICAL GLOBE,24,2011-01-18 14:04:00,0.85,12510.0
541491,22972,CHILDREN'S SPACEBOY MUG,12,2011-01-18 14:04:00,1.65,12510.0
541491,21914,BLUE HARMONICA IN BOX,12,2011-01-18 14:04:00,1.25,12510.0
541491,21915,RED  HARMONICA IN BOX,12,2011-01-18 14:04:00,1.25,12510.0
541491,20749,ASSORTED COLOUR MINI CASES,12,2011-01-18 14:04:00,6.35,12510.0
541491,22355,CHARLOTTE BAG SUKI DESIGN,10,2011-01-18 14:04:00,0.85,12510.0
541491,22661,CHARLOTTE BAG DOLLY GIRL DESIGN,10,2011-01-18 14:04:00,0.85,12510.0
541491,20719,WOODLAND CHARLOTTE BAG,10,2011-01-18 14:04:00,0.85,12510.0
541491,21935,SUKI  SHOULDER BAG,10,2011-01-18 14:04:00,1.65,12510.0
541491,22474,SPACEBOY TV DINNER TRAY,3,2011-01-18 14:04:00,4.95,12510.0
541491,79321,CHILLI LIGHTS,4,2011-01-18 14:04:00,4.95,12510.0
541491,21731,RED TOADSTOOL LED NIGHT LIGHT,12,2011-01-18 14:04:00,1.65,12510.0
541491,20717,STRAWBERRY SHOPPER BAG,10,2011-01-18 14:04:00,1.25,12510.0
541491,21481,FAWN BLUE HOT WATER BOTTLE,6,2011-01-18 14:04:00,2.95,12510.0
541491,22432,WATERING CAN PINK BUNNY,6,2011-01-18 14:04:00,1.95,12510.0
541491,20969,RED FLORAL FELTCRAFT SHOULDER BAG,4,2011-01-18 14:04:00,3.75,12510.0
541491,20967,GREY FLORAL FELTCRAFT SHOULDER BAG,4,2011-01-18 14:04:00,3.75,12510.0
541491,15044D,RED PAPER PARASOL,6,2011-01-18 14:04:00,2.95,12510.0
541491,15044B,BLUE PAPER PARASOL,6,2011-01-18 14:04:00,2.95,12510.0
541491,22904,CALENDAR PAPER CUT DESIGN,6,2011-01-18 14:04:00,2.95,12510.0
541491,21791,VINTAGE HEADS AND TAILS CARD GAME,12,2011-01-18 14:04:00,1.25,12510.0
541491,21892,TRADITIONAL WOODEN CATCH CUP GAME,12,2011-01-18 14:04:00,1.25,12510.0
541491,21889,WOODEN BOX OF DOMINOES,12,2011-01-18 14:04:00,1.25,12510.0
541491,POST,POSTAGE,3,2011-01-18 14:04:00,28.0,12510.0
541576,22483,RED GINGHAM TEDDY BEAR,2,2011-01-19 13:32:00,2.95,17097.0
541576,37501,TEA TIME TEA SET IN GIFT BOX,1,2011-01-19 13:32:00,6.95,17097.0
541576,21774,DECORATIVE CATS BATHROOM BOTTLE,2,2011-01-19 13:32:00,1.25,17097.0
541576,21135,VICTORIAN  METAL POSTCARD SPRING,8,2011-01-19 13:32:00,1.69,17097.0
541576,21279,VINTAGE KITCHEN PRINT FRUITS,2,2011-01-19 13:32:00,2.55,17097.0
541576,84818,DANISH ROSE PHOTO FRAME,1,2011-01-19 13:32:00,2.55,17097.0
541576,85040A,S/4 PINK FLOWER CANDLES IN BOWL,2,2011-01-19 13:32:00,1.65,17097.0
541576,22851,SET 20 NAPKINS FAIRY CAKES DESIGN,2,2011-01-19 13:32:00,0.85,17097.0
541576,85184C,S/4 VALENTINE DECOUPAGE HEART BOX,1,2011-01-19 13:32:00,2.95,17097.0
541576,22721,SET OF 3 CAKE TINS SKETCHBOOK,1,2011-01-19 13:32:00,4.95,17097.0
541576,22699,ROSES REGENCY TEACUP AND SAUCER,4,2011-01-19 13:32:00,2.95,17097.0
541576,22726,ALARM CLOCK BAKELIKE GREEN,1,2011-01-19 13:32:00,3.75,17097.0
541576,21879,HEARTS GIFT TAPE,4,2011-01-19 13:32:00,0.65,17097.0
