541576,21884,CAKES AND BOWS GIFT  TAPE,2,2011-01-19 13:32:00,0.65,17097.0
541576,22630,DOLLY GIRL LUNCH BOX,2,2011-01-19 13:32:00,1.95,17097.0
541576,22629,SPACEBOY LUNCH BOX,1,2011-01-19 13:32:00,1.95,17097.0
541576,22326,ROUND SNACK BOXES SET OF4 WOODLAND,2,2011-01-19 13:32:00,2.95,17097.0
541576,22896,PEG BAG APPLES DESIGN,2,2011-01-19 13:32:00,2.55,17097.0
541576,22897,OVEN MITT APPLES DESIGN,2,2011-01-19 13:32:00,1.45,17097.0
541576,22895,SET OF 2 TEA TOWELS APPLE AND PEARS,2,2011-01-19 13:32:00,2.95,17097.0
541576,22635,CHILDS BREAKFAST SET DOLLY GIRL,1,2011-01-19 13:32:00,9.95,17097.0
541576,22070,SMALL RED RETROSPOT MUG IN BOX,2,2011-01-19 13:32:00,3.75,17097.0
541576,21034,REX CASH+CARRY JUMBO SHOPPER,1,2011-01-19 13:32:00,0.95,17097.0
C541654,21843,RED RETROSPOT CAKE STAND,-6,2011-01-20 11:53:00,10.95,12540.0
541980,85206A,CREAM FELT EASTER EGG BASKET,6,2011-01-24 15:09:00,1.65,12421.0
541980,35922,EASTER BUNNY WREATH,5,2011-01-24 15:09:00,4.95,12421.0
541980,21733,RED HANGING HEART T-LIGHT HOLDER,6,2011-01-24 15:09:00,2.95,12421.0
541980,22806,SET OF 6 T-LIGHTS WEDDING CAKE,6,2011-01-24 15:09:00,2.95,12421.0
541980,21314,SMALL GLASS HEART TRINKET POT,8,2011-01-24 15:09:00,2.1,12421.0
541980,22066,LOVE HEART TRINKET POT,12,2011-01-24 15:09:00,1.45,12421.0
541980,22026,BANQUET BIRTHDAY  CARD,12,2011-01-24 15:09:00,0.42,12421.0
541980,21519,GIN & TONIC DIET GREETING CARD,12,2011-01-24 15:09:00,0.42,12421.0
541980,21520,BOOZE & WOMEN GREETING CARD,12,2011-01-24 15:09:00,0.42,12421.0
541980,22893,MINI CAKE STAND T-LIGHT HOLDER,24,2011-01-24 15:09:00,0.42,12421.0
541980,POST,POSTAGE,1,2011-01-24 15:09:00,28.0,12421.0
542303,85232D,SET/3 DECOUPAGE STACKING TINS,3,2011-01-27 11:05:00,4.95,12539.0
542303,85144,JARDIN ETCHED GLASS CHEESE DISH,2,2011-01-27 11:05:00,7.25,12539.0
542303,85132B,CHARLIE AND LOLA TABLE TINS,1,2011-01-27 11:05:00,9.95,12539.0
542303,84912B,GREEN ROSE WASHBAG,4,2011-01-27 11:05:00,3.75,12539.0
542303,84819,DANISH ROSE ROUND SEWING BOX,3,2011-01-27 11:05:00,4.25,12539.0
542303,84817,DANISH ROSE DECORATIVE PLATE,6,2011-01-27 11:05:00,2.1,12539.0
542303,84638,SMALL KITCHEN FLOWER POTS PLAQUE,2,2011-01-27 11:05:00,6.95,12539.0
542303,84637,KITCHEN FLOWER POTS WALL PLAQUE,3,2011-01-27 11:05:00,5.95,12539.0
542303,84631,FRUIT TREE AND BIRDS WALL PLAQUE,2,2011-01-27 11:05:00,7.95,12539.0
542303,84509B,SET OF 4 FAIRY CAKE PLACEMATS,4,2011-01-27 11:05:00,3.75,12539.0
542303,84509A,SET OF 4 ENGLISH ROSE PLACEMATS,4,2011-01-27 11:05:00,3.75,12539.0
542303,84050,PINK HEART SHAPE EGG FRYING PAN,6,2011-01-27 11:05:00,1.65,12539.0
542303,84032A,CHARLIE+LOLA PINK HOT WATER BOTTLE,6,2011-01-27 11:05:00,2.95,12539.0
542303,62094B,TURQ ICE CREAM BUM BAG,6,2011-01-27 11:05:00,2.55,12539.0
542303,47594B,SCOTTIES DESIGN WASHBAG,6,2011-01-27 11:05:00,1.95,12539.0
542303,47566,PARTY BUNTING,5,2011-01-27 11:05:00,4.65,12539.0
542303,37444C,PINK BREAKFAST CUP AND SAUCER,4,2011-01-27 11:05:00,2.95,12539.0
542303,35810A,ENAMEL PINK COFFEE CONTAINER,6,2011-01-27 11:05:00,2.1,12539.0
542303,35809A,ENAMEL PINK TEA CONTAINER,6,2011-01-27 11:05:00,2.1,12539.0
542303,35241,ENAMEL BLUE RIM BISCUIT BIN,3,2011-01-27 11:05:00,4.95,12539.0
542303,22968,ROSE COTTAGE KEEPSAKE BOX,2,2011-01-27 11:05:00,9.95,12539.0
542303,22962,JAM JAR WITH PINK LID,12,2011-01-27 11:05:00,0.85,12539.0
542303,22961,JAM MAKING SET PRINTED,12,2011-01-27 11:05:00,1.45,12539.0
542303,22960,JAM MAKING SET WITH JARS,6,2011-01-27 11:05:00,4.25,12539.0
542303,22956,36 FOIL HEART CAKE CASES,6,2011-01-27 11:05:00,2.1,12539.0
542303,22899,CHILDREN'S APRON DOLLY GIRL,6,2011-01-27 11:05:00,2.1,12539.0
542303,22890,NOVELTY BISCUITS CAKE STAND 3 TIER,2,2011-01-27 11:05:00,9.95,12539.0
542303,22849,BREAD BIN DINER STYLE MINT,1,2011-01-27 11:05:00,16.95,12539.0
542303,22847,BREAD BIN DINER STYLE IVORY,1,2011-01-27 11:05:00,16.95,12539.0
542303,22845,VINTAGE CREAM CAT FOOD CONTAINER,2,2011-01-27 11:05:00,6.35,12539.0
542303,21042,RED RETROSPOT APRON,3,2011-01-27 11:05:00,5.95,12539.0
542303,20914,SET/5 RED RETROSPOT LID GLASS BOWLS,6,2011-01-27 11:05:00,2.95,12539.0
542303,22844,VINTAGE CREAM DOG FOOD CONTAINER,2,2011-01-27 11:05:00,8.5,12539.0
542303,22838,3 TIER CAKE TIN RED AND CREAM,1,2011-01-27 11:05:00,14.95,12539.0
542303,22834,HAND WARMER BABUSHKA DESIGN,12,2011-01-27 11:05:00,2.1,12539.0
542303,22785,SQUARECUSHION COVER PINK UNION FLAG,2,2011-01-27 11:05:00,6.75,12539.0
542303,22743,MAKE YOUR OWN FLOWERPOWER CARD KIT,6,2011-01-27 11:05:00,2.95,12539.0
542303,22742,MAKE YOUR OWN PLAYTIME CARD KIT,6,2011-01-27 11:05:00,2.95,12539.0
542303,22720,SET OF 3 CAKE TINS PANTRY DESIGN,3,2011-01-27 11:05:00,4.95,12539.0
542303,22702,BLACK AND WHITE CAT BOWL,6,2011-01-27 11:05:00,2.1,12539.0
542303,22700,BLACK AND WHITE DOG BOWL,6,2011-01-27 11:05:00,2.95,12539.0
542303,22690,DOORMAT HOME SWEET HOME BLUE,2,2011-01-27 11:05:00,7.95,12539.0
542303,22675,FRENCH KITCHEN SIGN BLUE METAL,12,2011-01-27 11:05:00,1.25,12539.0
542303,22674,FRENCH TOILET SIGN BLUE METAL,12,2011-01-27 11:05:00,1.25,12539.0
542303,22670,FRENCH WC SIGN BLUE METAL,12,2011-01-27 11:05:00,1.25,12539.0
542303,22659,LUNCH BOX I LOVE LONDON,12,2011-01-27 11:05:00,1.95,12539.0
542303,22630,DOLLY GIRL LUNCH BOX,12,2011-01-27 11:05:00,1.95,12539.0
542303,22629,SPACEBOY LUNCH BOX,12,2011-01-27 11:05:00,1.95,12539.0
542303,22557,PLASTERS IN TIN VINTAGE PAISLEY,12,2011-01-27 11:05:00,1.65,12539.0
542303,22555,PLASTERS IN TIN STRONGMAN,12,2011-01-27 11:05:00,1.65,12539.0
542303,22554,PLASTERS IN TIN WOODLAND ANIMALS,12,2011-01-27 11:05:00,1.65,12539.0
542303,22511,RETROSPOT BABUSHKA DOORSTOP,4,2011-01-27 11:05:00,3.75,12539.0
542303,22509,SEWING BOX RETROSPOT DESIGN,1,2011-01-27 11:05:00,16.95,12539.0
542303,21881,CUTE CATS TAPE,12,2011-01-27 11:05:00,0.65,12539.0
542303,21880,RED RETROSPOT TAPE,12,2011-01-27 11:05:00,0.65,12539.0
542303,21879,HEARTS GIFT TAPE,12,2011-01-27 11:05:00,0.65,12539.0
542303,21843,RED RETROSPOT CAKE STAND,1,2011-01-27 11:05:00,10.95,12539.0
542303,21731,RED TOADSTOOL LED NIGHT LIGHT,12,2011-01-27 11:05:00,1.65,12539.0
542303,21710,FOLDING UMBRELLA PINKWHITE POLKADOT,4,2011-01-27 11:05:00,4.95,12539.0
542303,21657,MILK BOTTLE WITH GLASS STOPPER,3,2011-01-27 11:05:00,6.95,12539.0
542303,21625,VINTAGE UNION JACK APRON,3,2011-01-27 11:05:00,6.95,12539.0
542303,21622,VINTAGE UNION JACK CUSHION COVER,4,2011-01-27 11:05:00,4.95,12539.0
542303,21561,DINOSAUR LUNCH BOX WITH CUTLERY,6,2011-01-27 11:05:00,2.55,12539.0
542303,21559,STRAWBERRY LUNCH BOX WITH CUTLERY,6,2011-01-27 11:05:00,2.55,12539.0
542303,21547,CERAMIC BIRDHOUSE CRESTED TIT SMALL,6,2011-01-27 11:05:00,2.95,12539.0
542303,21530,DAIRY MAID TOASTRACK,6,2011-01-27 11:05:00,2.95,12539.0
542303,21126,SET OF 6 GIRLS CELEBRATION CANDLES,12,2011-01-27 11:05:00,1.25,12539.0
542303,21125,SET 6 FOOTBALL CELEBRATION CANDLES,12,2011-01-27 11:05:00,1.25,12539.0
542303,21123,SET/10 IVORY POLKADOT PARTY CANDLES,24,2011-01-27 11:05:00,1.25,12539.0
542303,21122,SET/10 PINK POLKADOT PARTY CANDLES,24,2011-01-27 11:05:00,1.25,12539.0
542303,21121,SET/10 RED POLKADOT PARTY CANDLES,24,2011-01-27 11:05:00,1.25,12539.0
542303,22453,MEASURING TAPE BABUSHKA BLUE,6,2011-01-27 11:05:00,2.95,12539.0
542303,22452,MEASURING TAPE BABUSHKA PINK,6,2011-01-27 11:05:00,2.95,12539.0
542303,22448,PIN CUSHION BABUSHKA RED,6,2011-01-27 11:05:00,3.35,12539.0
542303,22443,GROW YOUR OWN HERBS SET OF 3,2,2011-01-27 11:05:00,7.95,12539.0
542303,22430,ENAMEL WATERING CAN CREAM,4,2011-01-27 11:05:00,4.95,12539.0
542303,22423,REGENCY CAKESTAND 3 TIER,14,2011-01-27 11:05:00,12.75,12539.0
542303,22358,KINGS CHOICE TEA CADDY,6,2011-01-27 11:05:00,2.95,12539.0
542303,22357,KINGS CHOICE BISCUIT TIN,4,2011-01-27 11:05:00,4.25,12539.0
542303,22312,OFFICE MUG WARMER POLKADOT,6,2011-01-27 11:05:00,2.95,12539.0
542303,22271,FELTCRAFT DOLL ROSIE,6,2011-01-27 11:05:00,2.95,12539.0
542303,22209,WOOD STAMP SET HAPPY BIRTHDAY,12,2011-01-27 11:05:00,1.65,12539.0
542303,22208,WOOD STAMP SET THANK YOU,12,2011-01-27 11:05:00,1.65,12539.0
542303,22184,CAKE STAND VICTORIAN FILIGREE LARGE,2,2011-01-27 11:05:00,8.5,12539.0
542303,22139,RETROSPOT TEA SET CERAMIC 11 PC,3,2011-01-27 11:05:00,4.95,12539.0
542303,22111,SCOTTIE DOG HOT WATER BOTTLE,3,2011-01-27 11:05:00,4.95,12539.0
542303,22107,PIZZA PLATE IN BOX,4,2011-01-27 11:05:00,3.75,12539.0
542303,22077,6 RIBBONS RUSTIC CHARM,12,2011-01-27 11:05:00,1.65,12539.0
542303,21977,PACK OF 60 PINK PAISLEY CAKE CASES,24,2011-01-27 11:05:00,0.55,12539.0
542303,21944,KITTENS DESIGN FLANNEL,12,2011-01-27 11:05:00,0.85,12539.0
542303,22476,EMPIRE UNION JACK TV DINNER TRAY,3,2011-01-27 11:05:00,4.95,12539.0
542303,22472,TV DINNER TRAY DOLLY GIRL,3,2011-01-27 11:05:00,4.95,12539.0
542303,21929,JUMBO BAG PINK VINTAGE PAISLEY,10,2011-01-27 11:05:00,1.95,12539.0
C542348,M,Manual,-1,2011-01-27 12:09:00,1715.85,12539.0
