554139,23145,ZINC T-LIGHT HOLDER STAR LARGE,12,2011-05-23 10:34:00,0.95,14911.0
554139,84755,COLOUR GLASS T-LIGHT HOLDER HANGING,16,2011-05-23 10:34:00,0.65,14911.0
554139,85053,FRENCH ENAMEL CANDLEHOLDER,12,2011-05-23 10:34:00,2.1,14911.0
554139,84247G,"DECOUPAGE,GREETING CARD,",12,2011-05-23 10:34:00,0.42,14911.0
554139,22983,CARD BILLBOARD FONT,12,2011-05-23 10:34:00,0.42,14911.0
554139,21534,DAIRY MAID LARGE MILK JUG,3,2011-05-23 10:34:00,4.95,14911.0
554139,23174,REGENCY SUGAR BOWL GREEN,6,2011-05-23 10:34:00,4.15,14911.0
554139,23175,REGENCY MILK JUG PINK,4,2011-05-23 10:34:00,3.25,14911.0
554139,21535,RED RETROSPOT SMALL MILK JUG,6,2011-05-23 10:34:00,2.55,14911.0
554139,22423,REGENCY CAKESTAND 3 TIER,4,2011-05-23 10:34:00,12.75,14911.0
554139,21843,RED RETROSPOT CAKE STAND,3,2011-05-23 10:34:00,10.95,14911.0
554139,22180,RETROSPOT LAMP,4,2011-05-23 10:34:00,9.95,14911.0
554139,22487,WHITE WOOD GARDEN PLANT LADDER,4,2011-05-23 10:34:00,8.5,14911.0
554139,22430,ENAMEL WATERING CAN CREAM,4,2011-05-23 10:34:00,4.95,14911.0
554139,22425,ENAMEL COLANDER CREAM,3,2011-05-23 10:34:00,4.95,14911.0
554139,22426,ENAMEL WASH BOWL CREAM,4,2011-05-23 10:34:00,3.75,14911.0
554139,22427,ENAMEL FLOWER JUG CREAM,3,2011-05-23 10:34:00,5.95,14911.0
554139,85054,FRENCH ENAMEL POT W LID,6,2011-05-23 10:34:00,2.95,14911.0
554139,85059,FRENCH ENAMEL WATER BASIN,4,2011-05-23 10:34:00,3.75,14911.0
554139,22424,ENAMEL BREAD BIN CREAM,2,2011-05-23 10:34:00,12.75,14911.0
554139,21790,VINTAGE SNAP CARDS,12,2011-05-23 10:34:00,0.85,14911.0
554139,22619,SET OF 6 SOLDIER SKITTLES,4,2011-05-23 10:34:00,3.75,14911.0
554139,22801,ANTIQUE GLASS PEDESTAL BOWL,4,2011-05-23 10:34:00,3.75,14911.0
554139,84584,PINK GINGHAM CAT WITH SCARF,6,2011-05-23 10:34:00,2.55,14911.0
554139,22483,RED GINGHAM TEDDY BEAR,6,2011-05-23 10:34:00,2.95,14911.0
554139,35095A,BLUE VICTORIAN FABRIC OVAL BOX,24,2011-05-23 10:34:00,0.42,14911.0
554139,22698,PINK REGENCY TEACUP AND SAUCER,6,2011-05-23 10:34:00,2.95,14911.0
554139,22699,ROSES REGENCY TEACUP AND SAUCER,6,2011-05-23 10:34:00,2.95,14911.0
554139,22697,GREEN REGENCY TEACUP AND SAUCER,6,2011-05-23 10:34:00,2.95,14911.0
554139,22670,FRENCH WC SIGN BLUE METAL,12,2011-05-23 10:34:00,1.25,14911.0
554139,82486,WOOD S/3 CABINET ANT WHITE FINISH,2,2011-05-23 10:34:00,8.95,14911.0
554139,84536A,ENGLISH ROSE NOTEBOOK A7 SIZE,16,2011-05-23 10:34:00,0.42,14911.0
554139,21528,DAIRY MAID TRADITIONAL TEAPOT,2,2011-05-23 10:34:00,6.95,14911.0
554139,21706,FOLDING UMBRELLA RED/WHITE POLKADOT,4,2011-05-23 10:34:00,4.95,14911.0
554139,15060B,FAIRY CAKE DESIGN UMBRELLA,4,2011-05-23 10:34:00,3.75,14911.0
554139,15056BL,EDWARDIAN PARASOL BLACK,3,2011-05-23 10:34:00,5.95,14911.0
554139,85014A,BLACK/BLUE POLKADOT UMBRELLA,3,2011-05-23 10:34:00,5.95,14911.0
C554539,23111,PARISIENNE SEWING BOX,-1,2011-05-24 17:47:00,12.5,14911.0
C554539,85159B,"WHITE TEA,COFFEE,SUGAR JARS",-4,2011-05-24 17:47:00,1.95,14911.0
554770,84077,WORLD WAR 2 GLIDERS ASSTD DESIGNS,96,2011-05-26 11:40:00,0.29,14911.0
554770,22407,MONEY BOX FIRST ADE DESIGN,12,2011-05-26 11:40:00,1.25,14911.0
554770,22409,MONEY BOX BISCUITS DESIGN,12,2011-05-26 11:40:00,1.25,14911.0
554770,22405,MONEY BOX POCKET MONEY DESIGN,12,2011-05-26 11:40:00,1.25,14911.0
554770,23133,LARGE IVORY HEART WALL ORGANISER,2,2011-05-26 11:40:00,8.25,14911.0
554770,85123A,WHITE HANGING HEART T-LIGHT HOLDER,6,2011-05-26 11:40:00,2.95,14911.0
554770,22743,MAKE YOUR OWN FLOWERPOWER CARD KIT,6,2011-05-26 11:40:00,2.95,14911.0
554770,22749,FELTCRAFT PRINCESS CHARLOTTE DOLL,4,2011-05-26 11:40:00,3.75,14911.0
554770,22750,FELTCRAFT PRINCESS LOLA DOLL,4,2011-05-26 11:40:00,3.75,14911.0
554770,22550,HOLIDAY FUN LUDO,4,2011-05-26 11:40:00,3.75,14911.0
554770,22197,SMALL POPCORN HOLDER,24,2011-05-26 11:40:00,0.85,14911.0
554770,21913,VINTAGE SEASIDE JIGSAW PUZZLES,4,2011-05-26 11:40:00,3.75,14911.0
554770,20724,RED RETROSPOT CHARLOTTE BAG,10,2011-05-26 11:40:00,0.85,14911.0
554770,20723,STRAWBERRY CHARLOTTE BAG,10,2011-05-26 11:40:00,0.85,14911.0
554770,22384,LUNCH BAG PINK POLKADOT,10,2011-05-26 11:40:00,1.65,14911.0
554770,20728,LUNCH BAG CARS BLUE,10,2011-05-26 11:40:00,1.65,14911.0
554770,20725,LUNCH BAG RED RETROSPOT,10,2011-05-26 11:40:00,1.65,14911.0
554770,23209,LUNCH BAG DOILEY PATTERN,10,2011-05-26 11:40:00,1.65,14911.0
554770,21932,SCANDINAVIAN PAISLEY PICNIC BAG,10,2011-05-26 11:40:00,1.65,14911.0
554770,21937,STRAWBERRY   PICNIC BAG,10,2011-05-26 11:40:00,2.95,14911.0
554770,21936,RED RETROSPOT PICNIC BAG,10,2011-05-26 11:40:00,2.95,14911.0
554770,23168,CLASSIC CAFE SUGAR DISPENSER,12,2011-05-26 11:40:00,1.25,14911.0
554770,22625,RED KITCHEN SCALES,2,2011-05-26 11:40:00,8.5,14911.0
554770,22624,IVORY KITCHEN SCALES,2,2011-05-26 11:40:00,8.5,14911.0
554770,23165,LARGE CERAMIC TOP STORAGE JAR,12,2011-05-26 11:40:00,1.65,14911.0
554770,C2,CARRIAGE,1,2011-05-26 11:40:00,50.0,14911.0
554776,22961,JAM MAKING SET PRINTED,4,2011-05-26 11:43:00,1.45,14911.0
C554790,22961,JAM MAKING SET PRINTED,-4,2011-05-26 12:10:00,1.45,14911.0
554791,22961,JAM MAKING SET PRINTED,4,2011-05-26 12:12:00,1.45,14911.0
C555274,23112,PARISIENNE CURIO CABINET,-1,2011-06-01 16:34:00,7.5,14911.0
555650,22423,REGENCY CAKESTAND 3 TIER,3,2011-06-06 13:48:00,12.75,14156.0
555650,23096,PETIT TRAY CHIC,72,2011-06-06 13:48:00,1.45,14156.0
555650,22831,WHITE BROCANTE SOAP DISH,6,2011-06-06 13:48:00,2.95,14156.0
555650,23146,TRIPLE HOOK ANTIQUE IVORY ROSE,6,2011-06-06 13:48:00,3.29,14156.0
555650,23147,SINGLE ANTIQUE ROSE HOOK IVORY,12,2011-06-06 13:48:00,1.45,14156.0
555650,22863,SOAP DISH BROCANTE,8,2011-06-06 13:48:00,2.95,14156.0
555650,23075,DOUBLE CERAMIC PARLOUR HOOK,4,2011-06-06 13:48:00,4.15,14156.0
555650,22795,SWEETHEART RECIPE BOOK STAND,2,2011-06-06 13:48:00,6.75,14156.0
555650,22794,SWEETHEART WIRE MAGAZINE RACK,2,2011-06-06 13:48:00,7.95,14156.0
555650,84406B,CREAM CUPID HEARTS COAT HANGER,4,2011-06-06 13:48:00,4.15,14156.0
555650,22848,BREAD BIN DINER STYLE PINK,2,2011-06-06 13:48:00,16.95,14156.0
555650,22847,BREAD BIN DINER STYLE IVORY,2,2011-06-06 13:48:00,16.95,14156.0
555650,22846,BREAD BIN DINER STYLE RED,2,2011-06-06 13:48:00,16.95,14156.0
555650,22849,BREAD BIN DINER STYLE MINT,2,2011-06-06 13:48:00,16.95,14156.0
555650,22845,VINTAGE CREAM CAT FOOD CONTAINER,2,2011-06-06 13:48:00,6.35,14156.0
555650,22844,VINTAGE CREAM DOG FOOD CONTAINER,2,2011-06-06 13:48:00,8.5,14156.0
555650,22979,PANTRY WASHING UP BRUSH,12,2011-06-06 13:48:00,1.45,14156.0
555650,23299,FOOD COVER WITH BEADS SET 2,6,2011-06-06 13:48:00,3.75,14156.0
555650,22961,JAM MAKING SET PRINTED,12,2011-06-06 13:48:00,1.45,14156.0
555650,22980,PANTRY SCRUBBING BRUSH,12,2011-06-06 13:48:00,1.65,14156.0
555650,22804,CANDLEHOLDER PINK HANGING HEART,6,2011-06-06 13:48:00,2.95,14156.0
555650,22193,RED DINER WALL CLOCK,2,2011-06-06 13:48:00,8.5,14156.0
555650,22192,BLUE DINER WALL CLOCK,2,2011-06-06 13:48:00,8.5,14156.0
555650,22191,IVORY DINER WALL CLOCK,2,2011-06-06 13:48:00,8.5,14156.0
555650,23194,GYMKHANNA TREASURE BOOK BOX,8,2011-06-06 13:48:00,2.25,14156.0
555650,23176,ABC TREASURE BOOK BOX,8,2011-06-06 13:48:00,2.25,14156.0
555650,22561,WOODEN SCHOOL COLOURING SET,12,2011-06-06 13:48:00,1.65,14156.0
555650,15056BL,EDWARDIAN PARASOL BLACK,3,2011-06-06 13:48:00,5.95,14156.0
555650,15056P,EDWARDIAN PARASOL PINK,3,2011-06-06 13:48:00,5.95,14156.0
555650,15056N,EDWARDIAN PARASOL NATURAL,3,2011-06-06 13:48:00,5.95,14156.0
555650,23308,SET OF 60 VINTAGE LEAF CAKE CASES,24,2011-06-06 13:48:00,0.55,14156.0
555650,23182,TOILET SIGN OCCUPIED OR VACANT,24,2011-06-06 13:48:00,0.83,14156.0
555650,22674,FRENCH TOILET SIGN BLUE METAL,12,2011-06-06 13:48:00,1.25,14156.0
555650,21175,GIN + TONIC DIET METAL SIGN,6,2011-06-06 13:48:00,2.55,14156.0
555650,21166,COOK WITH WINE METAL SIGN,12,2011-06-06 13:48:00,2.08,14156.0
555650,21539,RED RETROSPOT BUTTER DISH,3,2011-06-06 13:48:00,4.95,14156.0
555650,21211,SET OF 72 SKULL PAPER  DOILIES,12,2011-06-06 13:48:00,1.45,14156.0
555650,21213,PACK OF 72 SKULL CAKE CASES,24,2011-06-06 13:48:00,0.55,14156.0
555650,22553,PLASTERS IN TIN SKULLS,12,2011-06-06 13:48:00,1.65,14156.0
555650,22139,RETROSPOT TEA SET CERAMIC 11 PC,3,2011-06-06 13:48:00,4.95,14156.0
555650,22967,SET 3 SONG BIRD PAPER EGGS ASSORTED,6,2011-06-06 13:48:00,2.95,14156.0
555650,22079,RIBBON REEL HEARTS DESIGN,10,2011-06-06 13:48:00,1.65,14156.0
555650,22082,RIBBON REEL STRIPES DESIGN,10,2011-06-06 13:48:00,1.65,14156.0
555650,85049E,SCANDINAVIAN REDS RIBBONS,12,2011-06-06 13:48:00,1.25,14156.0
555650,22077,6 RIBBONS RUSTIC CHARM,12,2011-06-06 13:48:00,1.65,14156.0
555858,21471,STRAWBERRY RAFFIA FOOD COVER,6,2011-06-07 14:12:00,3.75,14911.0
555858,22908,PACK OF 20 NAPKINS RED APPLES,12,2011-06-07 14:12:00,0.85,14911.0
555858,22851,SET 20 NAPKINS FAIRY CAKES DESIGN,12,2011-06-07 14:12:00,0.85,14911.0
555858,21122,SET/10 PINK POLKADOT PARTY CANDLES,24,2011-06-07 14:12:00,1.25,14911.0
555858,21124,SET/10 BLUE POLKADOT PARTY CANDLES,24,2011-06-07 14:12:00,1.25,14911.0
555858,22961,JAM MAKING SET PRINTED,12,2011-06-07 14:12:00,1.45,14911.0
555858,22138,BAKING SET 9 PIECE RETROSPOT,3,2011-06-07 14:12:00,4.95,14911.0
555858,85078,SCANDINAVIAN 3 HEARTS NAPKIN RING,24,2011-06-07 14:12:00,0.19,14911.0
555858,21212,PACK OF 72 RETROSPOT CAKE CASES,24,2011-06-07 14:12:00,0.55,14911.0
555858,21975,PACK OF 60 DINOSAUR CAKE CASES,24,2011-06-07 14:12:00,0.55,14911.0
555858,84992,72 SWEETHEART FAIRY CAKE CASES,24,2011-06-07 14:12:00,0.55,14911.0
555858,23104,IVORY CAFE HANGING LAMP,2,2011-06-07 14:12:00,12.5,14911.0
555858,C2,CARRIAGE,1,2011-06-07 14:12:00,50.0,14911.0
555947,37340,MULTICOLOUR SPRING FLOWER MUG,48,2011-06-08 10:45:00,0.39,14911.0
555947,37342,POLKADOT COFFEE CUP & SAUCER PINK,24,2011-06-08 10:45:00,0.79,14911.0
555947,47021G,SET/6 BEAD COASTERS GAUZE BAG GOLD,34,2011-06-08 10:45:00,0.39,14911.0
555947,47343A,FUSCHIA FLOWER PURSE WITH BEADS,12,2011-06-08 10:45:00,0.83,14911.0
555947,47518F,ICON PLACEMAT POP ART ELVIS,24,2011-06-08 10:45:00,0.12,14911.0
555947,47341A,FUSCHIA TABLE RUN FLOWER,10,2011-06-08 10:45:00,1.25,14911.0
555947,47593B,SCOTTIE DOGS BABY BIB,48,2011-06-08 10:45:00,0.39,14911.0
555947,71496A,A4 WALL TIDY BLUE OFFICE,48,2011-06-08 10:45:00,0.53,14911.0
555947,84857C,PINK MONTE CARLO HANDBAG,12,2011-06-08 10:45:00,1.95,14911.0
555947,85015,SET OF 12  VINTAGE POSTCARD SET,24,2011-06-08 10:45:00,0.65,14911.0
555947,85017B,ENVELOPE 50 BLOSSOM IMAGES,12,2011-06-08 10:45:00,0.42,14911.0
555947,85078,SCANDINAVIAN 3 HEARTS NAPKIN RING,24,2011-06-08 10:45:00,0.19,14911.0
555947,85116,BLACK CANDELABRA T-LIGHT HOLDER,24,2011-06-08 10:45:00,0.65,14911.0
555947,85132C,CHARLIE AND LOLA FIGURES TINS,12,2011-06-08 10:45:00,1.95,14911.0
555947,85183A,CHARLIE & LOLA WASTEPAPER BIN BLUE,12,2011-06-08 10:45:00,1.25,14911.0
555947,85183B,CHARLIE & LOLA WASTEPAPER BIN FLORA,12,2011-06-08 10:45:00,1.25,14911.0
555947,85132B,CHARLIE AND LOLA TABLE TINS,12,2011-06-08 10:45:00,1.95,14911.0
555947,85159B,"WHITE TEA,COFFEE,SUGAR JARS",12,2011-06-08 10:45:00,1.95,14911.0
555947,85123A,WHITE HANGING HEART T-LIGHT HOLDER,32,2011-06-08 10:45:00,2.55,14911.0
555947,22469,HEART OF WICKER SMALL,12,2011-06-08 10:45:00,1.65,14911.0
555947,22999,TRAVEL CARD WALLET RETRO PETALS,24,2011-06-08 10:45:00,0.42,14911.0
555947,22994,TRAVEL CARD WALLET RETROSPOT,24,2011-06-08 10:45:00,0.42,14911.0
555947,23004,TRAVEL CARD WALLET PANTRY,24,2011-06-08 10:45:00,0.42,14911.0
555947,15056N,EDWARDIAN PARASOL NATURAL,3,2011-06-08 10:45:00,5.95,14911.0
555947,22138,BAKING SET 9 PIECE RETROSPOT,24,2011-06-08 10:45:00,4.25,14911.0
555947,85227,SET OF 6 3D KIT CARDS FOR KIDS,120,2011-06-08 10:45:00,0.64,14911.0
555947,22534,MAGIC DRAWING SLATE SPACEBOY,192,2011-06-08 10:45:00,0.36,14911.0
555947,35968,FOLK ART METAL HEART T-LIGHT HOLDER,12,2011-06-08 10:45:00,0.38,14911.0
555947,21262,WHITE GOOSE FEATHER CHRISTMAS TREE,24,2011-06-08 10:45:00,2.95,14911.0
555947,84226,HEN HOUSE W FAMILY IN BARN & NEST,34,2011-06-08 10:45:00,0.64,14911.0
555947,35912B,WHITE/PINK CHICK DECORATION,72,2011-06-08 10:45:00,1.06,14911.0
555947,85187,S/12 MINI RABBIT EASTER,48,2011-06-08 10:45:00,1.45,14911.0
555947,35924,HANGING FAIRY CAKE DECORATION,72,2011-06-08 10:45:00,1.69,14911.0
555947,35923,CANDY HEART HANGING DECORATION,144,2011-06-08 10:45:00,1.06,14911.0
555947,85071B,RED CHARLIE+LOLA PERSONAL DOORSIGN,96,2011-06-08 10:45:00,0.38,14911.0
555947,22090,PAPER BUNTING RETROSPOT,40,2011-06-08 10:45:00,2.55,14911.0
555947,22089,PAPER BUNTING VINTAGE PAISLEY,40,2011-06-08 10:45:00,2.55,14911.0
555947,20719,WOODLAND CHARLOTTE BAG,100,2011-06-08 10:45:00,0.72,14911.0
555947,23204,CHARLOTTE BAG APPLES DESIGN,100,2011-06-08 10:45:00,0.72,14911.0
555947,35809A,ENAMEL PINK TEA CONTAINER,3,2011-06-08 10:45:00,0.83,14911.0
555947,82484,WOOD BLACK BOARD ANT WHITE FINISH,12,2011-06-08 10:45:00,6.75,14911.0
555947,22423,REGENCY CAKESTAND 3 TIER,6,2011-06-08 10:45:00,12.75,14911.0
555947,48188,DOORMAT WELCOME PUPPIES,2,2011-06-08 10:45:00,7.95,14911.0
555947,47566,PARTY BUNTING,50,2011-06-08 10:45:00,4.15,14911.0
555947,17012B,ORIGAMI JASMINE INCENSE/CANDLE SET,24,2011-06-08 10:45:00,0.85,14911.0
555947,17091J,VANILLA INCENSE IN TIN,36,2011-06-08 10:45:00,0.38,14911.0
555947,17136A,BLUE STONES ON WIRE FOR CANDLE,24,2011-06-08 10:45:00,0.08,14911.0
555947,20839,FRENCH PAISLEY CUSHION COVER,12,2011-06-08 10:45:00,0.85,14911.0
555947,20840,FRENCH FLORAL CUSHION COVER,12,2011-06-08 10:45:00,0.85,14911.0
555947,21287,SCENTED VELVET LOUNGE CANDLE,72,2011-06-08 10:45:00,0.38,14911.0
555947,21294,ETCHED GLASS COASTER,48,2011-06-08 10:45:00,0.39,14911.0
555947,21845,DAIRY MAID STRIPE MUG,36,2011-06-08 10:45:00,0.79,14911.0
555947,21932,SCANDINAVIAN PAISLEY PICNIC BAG,20,2011-06-08 10:45:00,1.65,14911.0
555947,21933,PINK VINTAGE PAISLEY PICNIC BAG,20,2011-06-08 10:45:00,1.65,14911.0
555947,35646,VINTAGE BEAD PINK EVENING BAG,24,2011-06-08 10:45:00,1.25,14911.0
555947,35810A,ENAMEL PINK COFFEE CONTAINER,24,2011-06-08 10:45:00,0.83,14911.0
555947,35965,FOLKART HEART NAPKIN RINGS,24,2011-06-08 10:45:00,0.79,14911.0
556060,22969,HOMEMADE JAM SCENTED CANDLES,84,2011-06-08 14:03:00,1.45,14911.0
556060,22960,JAM MAKING SET WITH JARS,48,2011-06-08 14:03:00,3.75,14911.0
556060,22907,PACK OF 20 NAPKINS PANTRY DESIGN,192,2011-06-08 14:03:00,0.72,14911.0
556060,22720,SET OF 3 CAKE TINS PANTRY DESIGN,48,2011-06-08 14:03:00,4.25,14911.0
556060,22666,RECIPE BOX PANTRY YELLOW DESIGN,72,2011-06-08 14:03:00,2.55,14911.0
556060,22430,ENAMEL WATERING CAN CREAM,16,2011-06-08 14:03:00,4.25,14911.0
556060,22426,ENAMEL WASH BOWL CREAM,16,2011-06-08 14:03:00,2.95,14911.0
556060,22424,ENAMEL BREAD BIN CREAM,16,2011-06-08 14:03:00,10.95,14911.0
556126,21577,SAVE THE PLANET COTTON TOTE BAG,6,2011-06-09 10:23:00,2.25,14911.0
556126,23202,JUMBO BAG VINTAGE LEAF,10,2011-06-09 10:23:00,2.08,14911.0
556126,22999,TRAVEL CARD WALLET RETRO PETALS,24,2011-06-09 10:23:00,0.42,14911.0
556126,23282,FOLDING BUTTERFLY MIRROR IVORY,12,2011-06-09 10:23:00,0.83,14911.0
556126,71053,WHITE METAL LANTERN,8,2011-06-09 10:23:00,3.75,14911.0
556126,71459,HANGING JAM JAR T-LIGHT HOLDER,12,2011-06-09 10:23:00,0.85,14911.0
556126,23145,ZINC T-LIGHT HOLDER STAR LARGE,12,2011-06-09 10:23:00,0.95,14911.0
556126,85053,FRENCH ENAMEL CANDLEHOLDER,6,2011-06-09 10:23:00,2.1,14911.0
556126,22027,TEA PARTY BIRTHDAY CARD,12,2011-06-09 10:23:00,0.42,14911.0
556126,21508,VINTAGE KID DOLLY CARD,12,2011-06-09 10:23:00,0.42,14911.0
556126,22037,ROBOT BIRTHDAY CARD,12,2011-06-09 10:23:00,0.42,14911.0
556126,22030,SWALLOWS GREETING CARD,12,2011-06-09 10:23:00,0.42,14911.0
556126,22927,GREEN GIANT GARDEN THERMOMETER,2,2011-06-09 10:23:00,5.95,14911.0
556126,22652,TRAVEL SEWING KIT,10,2011-06-09 10:23:00,1.65,14911.0
556126,22441,GROW YOUR OWN BASIL IN ENAMEL MUG,8,2011-06-09 10:23:00,2.1,14911.0
556126,22492,MINI PAINT SET VINTAGE,36,2011-06-09 10:23:00,0.65,14911.0
556126,23191,BUNDLE OF 3 RETRO NOTE BOOKS,12,2011-06-09 10:23:00,1.65,14911.0
556126,47480,HANGING PHOTO CLIP ROPE LADDER,12,2011-06-09 10:23:00,1.65,14911.0
556126,23283,DOORMAT VINTAGE LEAVES DESIGN,2,2011-06-09 10:23:00,7.95,14911.0
556126,21790,VINTAGE SNAP CARDS,12,2011-06-09 10:23:00,0.85,14911.0
556126,21915,RED  HARMONICA IN BOX,12,2011-06-09 10:23:00,1.25,14911.0
556126,C2,CARRIAGE,1,2011-06-09 10:23:00,50.0,14911.0
556206,84987,SET OF 36 TEATIME PAPER DOILIES,12,2011-06-09 13:46:00,1.45,14911.0
556206,23240,SET OF 4 KNICK KNACK TINS DOILEY,6,2011-06-09 13:46:00,4.15,14911.0
556206,23236,DOILEY BISCUIT TIN,6,2011-06-09 13:46:00,2.89,14911.0
556206,22624,IVORY KITCHEN SCALES,2,2011-06-09 13:46:00,8.5,14911.0
556206,22627,MINT KITCHEN SCALES,2,2011-06-09 13:46:00,8.5,14911.0
556206,22285,HANGING HEN ON NEST DECORATION,12,2011-06-09 13:46:00,1.65,14911.0
556206,22284,HEN HOUSE DECORATION,12,2011-06-09 13:46:00,1.65,14911.0
556206,23162,REGENCY TEA STRAINER,4,2011-06-09 13:46:00,3.75,14911.0
556206,23163,REGENCY SUGAR TONGS,12,2011-06-09 13:46:00,2.49,14911.0
556206,23160,REGENCY TEA SPOON,24,2011-06-09 13:46:00,1.25,14911.0
556206,23161,REGENCY CAKE FORK,24,2011-06-09 13:46:00,1.25,14911.0
556206,22699,ROSES REGENCY TEACUP AND SAUCER,24,2011-06-09 13:46:00,2.55,14911.0
556206,22423,REGENCY CAKESTAND 3 TIER,4,2011-06-09 13:46:00,12.75,14911.0
556206,21832,CHOCOLATE CALCULATOR,12,2011-06-09 13:46:00,1.65,14911.0
556206,22931,BAKING MOULD HEART WHITE CHOCOLATE,6,2011-06-09 13:46:00,2.55,14911.0
556206,22932,BAKING MOULD TOFFEE CUP CHOCOLATE,6,2011-06-09 13:46:00,2.55,14911.0
556206,20828,GLITTER BUTTERFLY CLIPS,12,2011-06-09 13:46:00,2.55,14911.0
556206,22756,LARGE YELLOW BABUSHKA NOTEBOOK,12,2011-06-09 13:46:00,1.25,14911.0
556206,22890,NOVELTY BISCUITS CAKE STAND 3 TIER,2,2011-06-09 13:46:00,9.95,14911.0
556206,22965,3 TRADITIONAl BISCUIT CUTTERS  SET,12,2011-06-09 13:46:00,2.1,14911.0
556206,22755,SMALL PURPLE BABUSHKA NOTEBOOK,12,2011-06-09 13:46:00,0.85,14911.0
556206,23306,SET OF 36 DOILIES PANTRY DESIGN,12,2011-06-09 13:46:00,1.45,14911.0
556206,22427,ENAMEL FLOWER JUG CREAM,3,2011-06-09 13:46:00,5.95,14911.0
556206,23245,SET OF 3 REGENCY CAKE TINS,4,2011-06-09 13:46:00,4.95,14911.0
556206,23170,REGENCY TEA PLATE ROSES,24,2011-06-09 13:46:00,1.65,14911.0
556206,C2,CARRIAGE,1,2011-06-09 13:46:00,50.0,14911.0
