549196,21448,12 DAISY PEGS IN WOOD BOX,12,2011-04-07 10:33:00,1.65,14911.0
549196,47599B,BLUE PARTY BAGS,6,2011-04-07 10:33:00,2.1,14911.0
549196,47599A,PINK PARTY BAGS,6,2011-04-07 10:33:00,2.1,14911.0
549196,47591D,PINK FAIRY CAKE CHILDRENS APRON,8,2011-04-07 10:33:00,1.95,14911.0
549196,21328,BALLOONS  WRITING SET,12,2011-04-07 10:33:00,1.65,14911.0
549196,20977,36 PENCILS TUBE WOODLAND,16,2011-04-07 10:33:00,1.25,14911.0
549196,22025,RING OF ROSES BIRTHDAY CARD,12,2011-04-07 10:33:00,0.42,14911.0
549196,22037,ROBOT BIRTHDAY CARD,12,2011-04-07 10:33:00,0.42,14911.0
549196,21498,RED RETROSPOT WRAP,50,2011-04-07 10:33:00,0.42,14911.0
549196,21519,GIN & TONIC DIET GREETING CARD,24,2011-04-07 10:33:00,0.42,14911.0
549196,21484,CHICK GREY HOT WATER BOTTLE,4,2011-04-07 10:33:00,3.45,14911.0
549196,21982,PACK OF 12 SUKI TISSUES,48,2011-04-07 10:33:00,0.29,14911.0
549196,85099C,JUMBO  BAG BAROQUE BLACK WHITE,10,2011-04-07 10:33:00,2.08,14911.0
549196,20828,GLITTER BUTTERFLY CLIPS,6,2011-04-07 10:33:00,2.55,14911.0
549196,21922,UNION STRIPE WITH FRINGE  HAMMOCK,2,2011-04-07 10:33:00,7.95,14911.0
549196,21936,RED RETROSPOT PICNIC BAG,5,2011-04-07 10:33:00,2.95,14911.0
549196,85099B,JUMBO BAG RED RETROSPOT,10,2011-04-07 10:33:00,2.08,14911.0
549196,22328,ROUND SNACK BOXES SET OF 4 FRUITS,6,2011-04-07 10:33:00,2.95,14911.0
549196,21175,GIN + TONIC DIET METAL SIGN,12,2011-04-07 10:33:00,2.55,14911.0
549196,18097C,WHITE TALL PORCELAIN T-LIGHT HOLDER,6,2011-04-07 10:33:00,2.55,14911.0
549196,48129,DOORMAT TOPIARY,2,2011-04-07 10:33:00,7.95,14911.0
549196,22607,WOODEN ROUNDERS GARDEN SET,2,2011-04-07 10:33:00,9.95,14911.0
549242,85053,FRENCH ENAMEL CANDLEHOLDER,12,2011-04-07 11:41:00,2.1,14911.0
549242,22430,ENAMEL WATERING CAN CREAM,4,2011-04-07 11:41:00,4.95,14911.0
549242,21090,SET/6 COLLAGE PAPER PLATES,12,2011-04-07 11:41:00,0.39,14911.0
549242,84279P,CHERRY BLOSSOM  DECORATIVE FLASK,4,2011-04-07 11:41:00,3.75,14911.0
549242,21071,VINTAGE BILLBOARD DRINK ME MUG,12,2011-04-07 11:41:00,1.25,14911.0
549242,22492,MINI PAINT SET VINTAGE,36,2011-04-07 11:41:00,0.65,14911.0
549242,21790,VINTAGE SNAP CARDS,12,2011-04-07 11:41:00,0.85,14911.0
549242,22992,REVOLVER WOODEN RULER,12,2011-04-07 11:41:00,1.95,14911.0
549242,22423,REGENCY CAKESTAND 3 TIER,2,2011-04-07 11:41:00,12.75,14911.0
549242,C2,CARRIAGE,1,2011-04-07 11:41:00,50.0,14911.0
549242,22178,VICTORIAN GLASS HANGING T-LIGHT,12,2011-04-07 11:41:00,1.25,14911.0
549667,22960,JAM MAKING SET WITH JARS,12,2011-04-11 12:20:00,3.75,14911.0
549667,22961,JAM MAKING SET PRINTED,8,2011-04-11 12:20:00,1.45,14911.0
549667,22978,PANTRY ROLLING PIN,6,2011-04-11 12:20:00,3.75,14911.0
549667,22907,PACK OF 20 NAPKINS PANTRY DESIGN,12,2011-04-11 12:20:00,0.85,14911.0
549667,22666,RECIPE BOX PANTRY YELLOW DESIGN,6,2011-04-11 12:20:00,2.95,14911.0
549667,22191,IVORY DINER WALL CLOCK,2,2011-04-11 12:20:00,8.5,14911.0
549667,22192,BLUE DINER WALL CLOCK,2,2011-04-11 12:20:00,8.5,14911.0
549667,22193,RED DINER WALL CLOCK,2,2011-04-11 12:20:00,8.5,14911.0
549667,82581,TOILET METAL SIGN,12,2011-04-11 12:20:00,0.55,14911.0
549667,82580,BATHROOM METAL SIGN,12,2011-04-11 12:20:00,0.55,14911.0
549667,22670,FRENCH WC SIGN BLUE METAL,12,2011-04-11 12:20:00,1.25,14911.0
549667,22672,FRENCH BATHROOM SIGN BLUE METAL,12,2011-04-11 12:20:00,1.65,14911.0
549667,82552,WASHROOM METAL SIGN,12,2011-04-11 12:20:00,1.45,14911.0
549667,21175,GIN + TONIC DIET METAL SIGN,6,2011-04-11 12:20:00,2.55,14911.0
549667,21154,RED RETROSPOT OVEN GLOVE,10,2011-04-11 12:20:00,1.25,14911.0
549667,21936,RED RETROSPOT PICNIC BAG,5,2011-04-11 12:20:00,2.95,14911.0
549667,21937,STRAWBERRY   PICNIC BAG,5,2011-04-11 12:20:00,2.95,14911.0
549667,21932,SCANDINAVIAN PAISLEY PICNIC BAG,5,2011-04-11 12:20:00,2.95,14911.0
549667,20725,LUNCH BAG RED RETROSPOT,10,2011-04-11 12:20:00,1.65,14911.0
549667,20728,LUNCH BAG CARS BLUE,10,2011-04-11 12:20:00,1.65,14911.0
549667,22384,LUNCH BAG PINK POLKADOT,10,2011-04-11 12:20:00,1.65,14911.0
549667,20723,STRAWBERRY CHARLOTTE BAG,10,2011-04-11 12:20:00,0.85,14911.0
549667,20724,RED RETROSPOT CHARLOTTE BAG,10,2011-04-11 12:20:00,0.85,14911.0
549667,21912,VINTAGE SNAKES & LADDERS,4,2011-04-11 12:20:00,3.75,14911.0
549667,21913,VINTAGE SEASIDE JIGSAW PUZZLES,4,2011-04-11 12:20:00,3.75,14911.0
549667,22197,SMALL POPCORN HOLDER,12,2011-04-11 12:20:00,0.85,14911.0
549667,22550,HOLIDAY FUN LUDO,4,2011-04-11 12:20:00,3.75,14911.0
549667,22750,FELTCRAFT PRINCESS LOLA DOLL,4,2011-04-11 12:20:00,3.75,14911.0
549667,22749,FELTCRAFT PRINCESS CHARLOTTE DOLL,4,2011-04-11 12:20:00,3.75,14911.0
549667,22273,FELTCRAFT DOLL MOLLY,6,2011-04-11 12:20:00,2.95,14911.0
549667,22271,FELTCRAFT DOLL ROSIE,6,2011-04-11 12:20:00,2.95,14911.0
549667,22743,MAKE YOUR OWN FLOWERPOWER CARD KIT,6,2011-04-11 12:20:00,2.95,14911.0
549667,48188,DOORMAT WELCOME PUPPIES,2,2011-04-11 12:20:00,7.95,14911.0
549667,85123A,WHITE HANGING HEART T-LIGHT HOLDER,6,2011-04-11 12:20:00,2.95,14911.0
549667,21986,PACK OF 12 PINK POLKADOT TISSUES,24,2011-04-11 12:20:00,0.29,14911.0
549667,21980,PACK OF 12 RED RETROSPOT TISSUES,24,2011-04-11 12:20:00,0.29,14911.0
549667,21983,PACK OF 12 BLUE PAISLEY TISSUES,24,2011-04-11 12:20:00,0.29,14911.0
549667,21981,PACK OF 12 WOODLAND TISSUES,24,2011-04-11 12:20:00,0.29,14911.0
549667,22405,MONEY BOX POCKET MONEY DESIGN,12,2011-04-11 12:20:00,1.25,14911.0
549667,22409,MONEY BOX BISCUITS DESIGN,12,2011-04-11 12:20:00,1.25,14911.0
549667,22407,MONEY BOX FIRST ADE DESIGN,12,2011-04-11 12:20:00,1.25,14911.0
549667,84077,WORLD WAR 2 GLIDERS ASSTD DESIGNS,48,2011-04-11 12:20:00,0.29,14911.0
549667,21715,GIRLS VINTAGE TIN SEASIDE BUCKET,8,2011-04-11 12:20:00,2.55,14911.0
549667,21718,RED METAL BEACH SPADE,12,2011-04-11 12:20:00,1.25,14911.0
549667,21041,RED RETROSPOT OVEN GLOVE DOUBLE,6,2011-04-11 12:20:00,2.95,14911.0
549667,47559B,TEA TIME OVEN GLOVE,10,2011-04-11 12:20:00,1.25,14911.0
549667,21218,RED SPOTTY BISCUIT TIN,6,2011-04-11 12:20:00,3.75,14911.0
549667,21042,RED RETROSPOT APRON,3,2011-04-11 12:20:00,5.95,14911.0
549667,47567B,TEA TIME KITCHEN APRON,3,2011-04-11 12:20:00,5.95,14911.0
549721,22139,RETROSPOT TEA SET CERAMIC 11 PC,3,2011-04-11 15:35:00,4.95,14911.0
549721,22138,BAKING SET 9 PIECE RETROSPOT,3,2011-04-11 15:35:00,4.95,14911.0
549721,22766,PHOTO FRAME CORNICE,8,2011-04-11 15:35:00,2.95,14911.0
549721,22771,CLEAR DRAWER KNOB ACRYLIC EDWARDIAN,12,2011-04-11 15:35:00,1.25,14911.0
549721,84978,HANGING HEART JAR T-LIGHT HOLDER,12,2011-04-11 15:35:00,1.25,14911.0
549721,21743,STAR PORTABLE TABLE LIGHT,6,2011-04-11 15:35:00,2.95,14911.0
549721,22780,LIGHT GARLAND BUTTERFILES PINK,4,2011-04-11 15:35:00,4.25,14911.0
549721,21398,RED POLKADOT COFFEE  MUG,48,2011-04-11 15:35:00,0.39,14911.0
549721,22180,RETROSPOT LAMP,4,2011-04-11 15:35:00,9.95,14911.0
549721,22102,MIRROR MOSAIC T-LIGHT HOLDER,6,2011-04-11 15:35:00,1.65,14911.0
549721,22274,FELTCRAFT DOLL EMILY,6,2011-04-11 15:35:00,2.95,14911.0
549721,C2,CARRIAGE,1,2011-04-11 15:35:00,50.0,14911.0
550302,23049,RECYCLED ACAPULCO MAT RED,2,2011-04-17 10:17:00,8.25,14156.0
550302,23176,ABC TREASURE BOOK BOX,8,2011-04-17 10:17:00,2.25,14156.0
550302,22854,CREAM SWEETHEART EGG HOLDER,4,2011-04-17 10:17:00,4.95,14156.0
550302,22283,6 EGG HOUSE PAINTED WOOD,4,2011-04-17 10:17:00,7.95,14156.0
550302,22183,CAKE STAND VICTORIAN FILIGREE MED,3,2011-04-17 10:17:00,6.75,14156.0
550302,47566B,TEA TIME PARTY BUNTING,4,2011-04-17 10:17:00,4.95,14156.0
550302,21469,POLKA DOT RAFFIA FOOD COVER,6,2011-04-17 10:17:00,3.75,14156.0
550302,22501,PICNIC BASKET WICKER LARGE,2,2011-04-17 10:17:00,9.95,14156.0
550302,21936,RED RETROSPOT PICNIC BAG,5,2011-04-17 10:17:00,2.95,14156.0
550302,23052,RECYCLED ACAPULCO MAT TURQUOISE,2,2011-04-17 10:17:00,8.25,14156.0
550302,21533,RETROSPOT LARGE MILK JUG,3,2011-04-17 10:17:00,4.95,14156.0
550302,21539,RED RETROSPOT BUTTER DISH,3,2011-04-17 10:17:00,4.95,14156.0
550302,21318,GLASS CHALICE BLUE SMALL,36,2011-04-17 10:17:00,0.39,14156.0
550302,22699,ROSES REGENCY TEACUP AND SAUCER,6,2011-04-17 10:17:00,2.95,14156.0
550302,21155,RED RETROSPOT PEG BAG,6,2011-04-17 10:17:00,2.55,14156.0
550302,22925,BLUE GIANT GARDEN THERMOMETER,2,2011-04-17 10:17:00,5.95,14156.0
550302,22927,GREEN GIANT GARDEN THERMOMETER,2,2011-04-17 10:17:00,5.95,14156.0
550302,21922,UNION STRIPE WITH FRINGE  HAMMOCK,2,2011-04-17 10:17:00,7.95,14156.0
550302,21340,CLASSIC METAL BIRDCAGE PLANT HOLDER,2,2011-04-17 10:17:00,12.75,14156.0
550302,22822,CREAM WALL PLANTER HEART SHAPED,2,2011-04-17 10:17:00,5.95,14156.0
550302,22520,CHILDS GARDEN TROWEL BLUE,12,2011-04-17 10:17:00,0.85,14156.0
550302,22521,CHILDS GARDEN TROWEL PINK,12,2011-04-17 10:17:00,0.85,14156.0
550302,20718,RED RETROSPOT SHOPPER BAG,10,2011-04-17 10:17:00,1.25,14156.0
550302,21704,BAG 250g SWIRLY MARBLES,12,2011-04-17 10:17:00,0.85,14156.0
550302,C2,CARRIAGE,1,2011-04-17 10:17:00,50.0,14156.0
550618,84880,WHITE WIRE EGG HOLDER,3,2011-04-19 13:09:00,7.5,14156.0
550618,22854,CREAM SWEETHEART EGG HOLDER,4,2011-04-19 13:09:00,4.95,14156.0
550618,20751,FUNKY WASHING UP GLOVES ASSORTED,12,2011-04-19 13:09:00,2.1,14156.0
550618,23199,JUMBO BAG APPLES,10,2011-04-19 13:09:00,2.08,14156.0
550618,23204,CHARLOTTE BAG APPLES DESIGN,10,2011-04-19 13:09:00,0.85,14156.0
550618,20717,STRAWBERRY SHOPPER BAG,10,2011-04-19 13:09:00,1.25,14156.0
550618,21981,PACK OF 12 WOODLAND TISSUES,24,2011-04-19 13:09:00,0.29,14156.0
550618,21986,PACK OF 12 PINK POLKADOT TISSUES,24,2011-04-19 13:09:00,0.29,14156.0
550618,23206,LUNCH BAG APPLE DESIGN,10,2011-04-19 13:09:00,1.65,14156.0
550618,23207,LUNCH BAG ALPHABET DESIGN,10,2011-04-19 13:09:00,1.65,14156.0
550618,22329,ROUND CONTAINER SET OF 5 RETROSPOT,12,2011-04-19 13:09:00,1.65,14156.0
550618,84380,SET OF 3 BUTTERFLY COOKIE CUTTERS,12,2011-04-19 13:09:00,1.25,14156.0
550618,21976,PACK OF 60 MUSHROOM CAKE CASES,24,2011-04-19 13:09:00,0.55,14156.0
550618,21977,PACK OF 60 PINK PAISLEY CAKE CASES,24,2011-04-19 13:09:00,0.55,14156.0
550618,22907,PACK OF 20 NAPKINS PANTRY DESIGN,12,2011-04-19 13:09:00,0.85,14156.0
550618,21430,SET/3 RED GINGHAM ROSE STORAGE BOX,4,2011-04-19 13:09:00,3.75,14156.0
550618,85184C,S/4 VALENTINE DECOUPAGE HEART BOX,6,2011-04-19 13:09:00,2.95,14156.0
550618,22286,DECORATION WOBBLY RABBIT METAL,12,2011-04-19 13:09:00,1.65,14156.0
550618,22957,SET 3 PAPER VINTAGE CHICK PAPER EGG,6,2011-04-19 13:09:00,2.95,14156.0
550618,47566,PARTY BUNTING,4,2011-04-19 13:09:00,4.95,14156.0
550618,C2,CARRIAGE,1,2011-04-19 13:09:00,50.0,14156.0
551187,C2,CARRIAGE,1,2011-04-27 10:02:00,50.0,14911.0
551187,71403,"\"PINK/WHITE \"\"KEEP CLEAN\"\" BULLET BIN\"",12,2011-04-27 10:02:00,2.95,14911.0
551187,22381,TOY TIDY PINK POLKADOT,50,2011-04-27 10:02:00,1.85,14911.0
551187,22380,TOY TIDY SPACEBOY,50,2011-04-27 10:02:00,1.85,14911.0
551187,22379,RECYCLING BAG RETROSPOT,50,2011-04-27 10:02:00,1.85,14911.0
551656,21080,SET/20 RED RETROSPOT PAPER NAPKINS,12,2011-05-03 12:10:00,0.85,14911.0
551656,21936,RED RETROSPOT PICNIC BAG,5,2011-05-03 12:10:00,2.95,14911.0
551656,22473,TV DINNER TRAY VINTAGE PAISLEY,3,2011-05-03 12:10:00,4.95,14911.0
551656,21937,STRAWBERRY   PICNIC BAG,5,2011-05-03 12:10:00,2.95,14911.0
551656,21507,"ELEPHANT, BIRTHDAY CARD,",12,2011-05-03 12:10:00,0.42,14911.0
551656,22475,SKULL DESIGN TV DINNER TRAY,3,2011-05-03 12:10:00,4.95,14911.0
551656,22138,BAKING SET 9 PIECE RETROSPOT,3,2011-05-03 12:10:00,4.95,14911.0
551656,22320,BIRDS MOBILE VINTAGE DESIGN,3,2011-05-03 12:10:00,5.95,14911.0
551656,22522,CHILDS GARDEN FORK BLUE,12,2011-05-03 12:10:00,0.85,14911.0
551656,22520,CHILDS GARDEN TROWEL BLUE,12,2011-05-03 12:10:00,0.85,14911.0
551656,22514,CHILDS GARDEN SPADE BLUE,6,2011-05-03 12:10:00,2.1,14911.0
551656,22524,CHILDRENS GARDEN GLOVES BLUE,10,2011-05-03 12:10:00,1.25,14911.0
551656,22516,CHILDS GARDEN RAKE BLUE,6,2011-05-03 12:10:00,2.1,14911.0
551656,22083,PAPER CHAIN KIT RETROSPOT,6,2011-05-03 12:10:00,2.95,14911.0
551656,84692,BOX OF 24 COCKTAIL PARASOLS,25,2011-05-03 12:10:00,0.42,14911.0
551656,22822,CREAM WALL PLANTER HEART SHAPED,4,2011-05-03 12:10:00,5.95,14911.0
551656,85123A,WHITE HANGING HEART T-LIGHT HOLDER,6,2011-05-03 12:10:00,2.95,14911.0
551656,16237,SLEEPING CAT ERASERS,30,2011-05-03 12:10:00,0.21,14911.0
551656,82484,WOOD BLACK BOARD ANT WHITE FINISH,6,2011-05-03 12:10:00,7.95,14911.0
551656,82482,WOODEN PICTURE FRAME WHITE FINISH,6,2011-05-03 12:10:00,2.55,14911.0
551656,84879,ASSORTED COLOUR BIRD ORNAMENT,16,2011-05-03 12:10:00,1.69,14911.0
551656,21781,MA CAMPAGNE CUTLERY BOX,2,2011-05-03 12:10:00,14.95,14911.0
551656,22605,WOODEN CROQUET GARDEN SET,2,2011-05-03 12:10:00,14.95,14911.0
551656,22607,WOODEN ROUNDERS GARDEN SET,2,2011-05-03 12:10:00,9.95,14911.0
551656,20685,DOORMAT RED RETROSPOT,2,2011-05-03 12:10:00,7.95,14911.0
551656,48187,DOORMAT NEW ENGLAND,2,2011-05-03 12:10:00,7.95,14911.0
551656,22807,SET OF 6 T-LIGHTS TOADSTOOLS,6,2011-05-03 12:10:00,2.95,14911.0
551656,72351A,SET/6 TURQUOISE BUTTERFLY T-LIGHTS,12,2011-05-03 12:10:00,2.1,14911.0
551656,71459,HANGING JAM JAR T-LIGHT HOLDER,12,2011-05-03 12:10:00,0.85,14911.0
551656,82600,NO SINGING METAL SIGN,12,2011-05-03 12:10:00,2.1,14911.0
551656,21181,PLEASE ONE PERSON METAL SIGN,12,2011-05-03 12:10:00,2.1,14911.0
551656,21238,RED RETROSPOT CUP,8,2011-05-03 12:10:00,0.85,14911.0
551656,21242,RED RETROSPOT PLATE,8,2011-05-03 12:10:00,1.69,14911.0
551656,20676,RED RETROSPOT BOWL,8,2011-05-03 12:10:00,1.25,14911.0
551656,22891,TEA FOR ONE POLKADOT,3,2011-05-03 12:10:00,4.25,14911.0
551656,21870,I CAN ONLY PLEASE ONE PERSON MUG,12,2011-05-03 12:10:00,1.25,14911.0
551656,21539,RED RETROSPOT BUTTER DISH,3,2011-05-03 12:10:00,4.95,14911.0
551657,22993,SET OF 4 PANTRY JELLY MOULDS,12,2011-05-03 12:12:00,1.25,14911.0
551657,21165,BEWARE OF THE CAT METAL SIGN,12,2011-05-03 12:12:00,1.69,14911.0
551657,82486,WOOD S/3 CABINET ANT WHITE FINISH,2,2011-05-03 12:12:00,8.95,14911.0
551657,22767,TRIPLE PHOTO FRAME CORNICE,2,2011-05-03 12:12:00,9.95,14911.0
551657,22768,FAMILY PHOTO FRAME CORNICE,2,2011-05-03 12:12:00,9.95,14911.0
551657,22776,SWEETHEART CAKESTAND 3 TIER,2,2011-05-03 12:12:00,9.95,14911.0
551657,22829,SWEETHEART WIRE WALL TIDY,2,2011-05-03 12:12:00,9.95,14911.0
551657,22604,SET OF 4 NAPKIN CHARMS CUTLERY,20,2011-05-03 12:12:00,2.55,14911.0
551657,22990,COTTON APRON PANTRY DESIGN,2,2011-05-03 12:12:00,4.95,14911.0
551657,22907,PACK OF 20 NAPKINS PANTRY DESIGN,12,2011-05-03 12:12:00,0.85,14911.0
551657,84380,SET OF 3 BUTTERFLY COOKIE CUTTERS,12,2011-05-03 12:12:00,1.25,14911.0
551657,21658,GLASS  BEURRE DISH,4,2011-05-03 12:12:00,3.95,14911.0
551657,22666,RECIPE BOX PANTRY YELLOW DESIGN,6,2011-05-03 12:12:00,2.95,14911.0
551657,22841,ROUND CAKE TIN VINTAGE GREEN,2,2011-05-03 12:12:00,7.95,14911.0
551657,22840,ROUND CAKE TIN VINTAGE RED,2,2011-05-03 12:12:00,7.95,14911.0
551657,22842,BISCUIT TIN VINTAGE RED,2,2011-05-03 12:12:00,6.75,14911.0
551657,22843,BISCUIT TIN VINTAGE GREEN,2,2011-05-03 12:12:00,6.75,14911.0
551657,22849,BREAD BIN DINER STYLE MINT,1,2011-05-03 12:12:00,16.95,14911.0
551657,22951,60 CAKE CASES DOLLY GIRL DESIGN,24,2011-05-03 12:12:00,0.55,14911.0
551657,22771,CLEAR DRAWER KNOB ACRYLIC EDWARDIAN,12,2011-05-03 12:12:00,1.25,14911.0
551657,22775,PURPLE DRAWERKNOB ACRYLIC EDWARDIAN,12,2011-05-03 12:12:00,1.25,14911.0
551657,22090,PAPER BUNTING RETROSPOT,6,2011-05-03 12:12:00,2.95,14911.0
551657,22558,CLOTHES PEGS RETROSPOT PACK 24,12,2011-05-03 12:12:00,1.49,14911.0
551657,21975,PACK OF 60 DINOSAUR CAKE CASES,24,2011-05-03 12:12:00,0.55,14911.0
551657,23207,LUNCH BAG ALPHABET DESIGN,10,2011-05-03 12:12:00,1.65,14911.0
551657,22662,LUNCH BAG DOLLY GIRL DESIGN,10,2011-05-03 12:12:00,1.65,14911.0
551657,23201,JUMBO BAG ALPHABET,10,2011-05-03 12:12:00,1.95,14911.0
551657,21430,SET/3 RED GINGHAM ROSE STORAGE BOX,4,2011-05-03 12:12:00,3.75,14911.0
551657,22501,PICNIC BASKET WICKER LARGE,2,2011-05-03 12:12:00,9.95,14911.0
551657,22699,ROSES REGENCY TEACUP AND SAUCER,6,2011-05-03 12:12:00,2.95,14911.0
551657,23164,REGENCY CAKE SLICE,4,2011-05-03 12:12:00,4.95,14911.0
551950,21749,LARGE RED RETROSPOT WINDMILL,6,2011-05-05 11:38:00,2.1,14911.0
551950,23283,DOORMAT VINTAGE LEAVES DESIGN,4,2011-05-05 11:38:00,7.95,14911.0
551950,22361,GLASS JAR DAISY FRESH COTTON WOOL,6,2011-05-05 11:38:00,2.95,14911.0
551950,84832,ZINC WILLIE WINKIE  CANDLE STICK,12,2011-05-05 11:38:00,0.85,14911.0
551950,85053,FRENCH ENAMEL CANDLEHOLDER,6,2011-05-05 11:38:00,2.1,14911.0
551950,71053,WHITE METAL LANTERN,4,2011-05-05 11:38:00,3.75,14911.0
551950,21790,VINTAGE SNAP CARDS,12,2011-05-05 11:38:00,0.85,14911.0
551950,22087,PAPER BUNTING WHITE LACE,6,2011-05-05 11:38:00,2.95,14911.0
551950,22088,PAPER BUNTING COLOURED LACE,6,2011-05-05 11:38:00,2.95,14911.0
551950,20754,RETROSPOT RED WASHING UP GLOVES,6,2011-05-05 11:38:00,2.1,14911.0
551950,20751,FUNKY WASHING UP GLOVES ASSORTED,12,2011-05-05 11:38:00,2.1,14911.0
551950,22897,OVEN MITT APPLES DESIGN,10,2011-05-05 11:38:00,1.45,14911.0
551950,22423,REGENCY CAKESTAND 3 TIER,2,2011-05-05 11:38:00,12.75,14911.0
551950,21658,GLASS  BEURRE DISH,4,2011-05-05 11:38:00,3.95,14911.0
551950,22027,TEA PARTY BIRTHDAY CARD,12,2011-05-05 11:38:00,0.42,14911.0
551950,21506,"FANCY FONT BIRTHDAY CARD,",12,2011-05-05 11:38:00,0.42,14911.0
551950,21704,BAG 250g SWIRLY MARBLES,12,2011-05-05 11:38:00,0.85,14911.0
551950,21915,RED  HARMONICA IN BOX,12,2011-05-05 11:38:00,1.25,14911.0
551950,22620,4 TRADITIONAL SPINNING TOPS,12,2011-05-05 11:38:00,1.45,14911.0
551950,C2,CARRIAGE,1,2011-05-05 11:38:00,50.0,14911.0
551950,22030,SWALLOWS GREETING CARD,12,2011-05-05 11:38:00,0.42,14911.0
551950,21506,"FANCY FONT BIRTHDAY CARD,",12,2011-05-05 11:38:00,0.42,14911.0
551950,22178,VICTORIAN GLASS HANGING T-LIGHT,12,2011-05-05 11:38:00,1.25,14911.0
C551999,22767,TRIPLE PHOTO FRAME CORNICE,-1,2011-05-05 15:53:00,9.95,14911.0
552038,20725,LUNCH BAG RED RETROSPOT,50,2011-05-06 08:08:00,1.65,14156.0
552038,20685,DOORMAT RED RETROSPOT,40,2011-05-06 08:08:00,6.75,14156.0
552038,84375,SET OF 20 KIDS COOKIE CUTTERS,48,2011-05-06 08:08:00,2.1,14156.0
552038,22863,SOAP DISH BROCANTE,48,2011-05-06 08:08:00,2.55,14156.0
552038,22843,BISCUIT TIN VINTAGE GREEN,24,2011-05-06 08:08:00,5.95,14156.0
552038,22842,BISCUIT TIN VINTAGE RED,24,2011-05-06 08:08:00,5.95,14156.0
552038,22839,3 TIER CAKE TIN GREEN AND CREAM,36,2011-05-06 08:08:00,12.75,14156.0
552038,22838,3 TIER CAKE TIN RED AND CREAM,48,2011-05-06 08:08:00,12.75,14156.0
552038,22502,PICNIC BASKET WICKER SMALL,48,2011-05-06 08:08:00,4.95,14156.0
552038,22489,PACK OF 12 TRADITIONAL CRAYONS,144,2011-05-06 08:08:00,0.36,14156.0
552038,21977,PACK OF 60 PINK PAISLEY CAKE CASES,240,2011-05-06 08:08:00,0.42,14156.0
552038,21790,VINTAGE SNAP CARDS,72,2011-05-06 08:08:00,0.72,14156.0
552038,21523,DOORMAT FANCY FONT HOME SWEET HOME,40,2011-05-06 08:08:00,6.75,14156.0
552038,21212,PACK OF 72 RETROSPOT CAKE CASES,240,2011-05-06 08:08:00,0.42,14156.0
552038,21169,YOU'RE CONFUSING ME METAL SIGN,144,2011-05-06 08:08:00,1.45,14156.0
552038,21166,COOK WITH WINE METAL SIGN,144,2011-05-06 08:08:00,1.85,14156.0
552038,21164,HOME SWEET HOME METAL SIGN,144,2011-05-06 08:08:00,2.55,14156.0
552038,21154,RED RETROSPOT OVEN GLOVE,48,2011-05-06 08:08:00,1.25,14156.0
552038,21041,RED RETROSPOT OVEN GLOVE DOUBLE,48,2011-05-06 08:08:00,2.95,14156.0
552038,20979,36 PENCILS TUBE RED RETROSPOT,64,2011-05-06 08:08:00,1.25,14156.0
552262,22435,SET OF 9 HEART SHAPED BALLOONS,12,2011-05-08 11:37:00,1.25,14911.0
552262,22440,BALLOON WATER BOMB PACK OF 35,20,2011-05-08 11:37:00,0.42,14911.0
552262,22804,CANDLEHOLDER PINK HANGING HEART,6,2011-05-08 11:37:00,2.95,14911.0
552262,90076,MONTANA DIAMOND CLUSTER EARRINGS,6,2011-05-08 11:37:00,2.55,14911.0
552262,90177D,DROP DIAMANTE EARRINGS PURPLE,6,2011-05-08 11:37:00,2.95,14911.0
552262,90018B,GOLD M.O.P ORBIT DROP EARRINGS,2,2011-05-08 11:37:00,4.25,14911.0
552262,21448,12 DAISY PEGS IN WOOD BOX,12,2011-05-08 11:37:00,1.65,14911.0
552262,20723,STRAWBERRY CHARLOTTE BAG,10,2011-05-08 11:37:00,0.85,14911.0
552262,22356,CHARLOTTE BAG PINK POLKADOT,10,2011-05-08 11:37:00,0.85,14911.0
552262,22991,GIRAFFE WOODEN RULER,12,2011-05-08 11:37:00,1.95,14911.0
552262,22992,REVOLVER WOODEN RULER,12,2011-05-08 11:37:00,1.95,14911.0
552262,23158,SET OF 5 LUCKY CAT MAGNETS,24,2011-05-08 11:37:00,2.08,14911.0
552262,23176,ABC TREASURE BOOK BOX,8,2011-05-08 11:37:00,2.25,14911.0
552262,23177,TREASURE ISLAND BOOK BOX,8,2011-05-08 11:37:00,2.25,14911.0
552262,22745,POPPY'S PLAYHOUSE BEDROOM,6,2011-05-08 11:37:00,2.1,14911.0
552262,22747,POPPY'S PLAYHOUSE BATHROOM,6,2011-05-08 11:37:00,2.1,14911.0
552262,22746,POPPY'S PLAYHOUSE LIVINGROOM,6,2011-05-08 11:37:00,2.1,14911.0
552262,21915,RED  HARMONICA IN BOX,12,2011-05-08 11:37:00,1.25,14911.0
552262,22559,SEASIDE FLYING DISC,12,2011-05-08 11:37:00,1.25,14911.0
552262,21914,BLUE HARMONICA IN BOX,12,2011-05-08 11:37:00,1.25,14911.0
552262,21556,CERAMIC STRAWBERRY MONEY BOX,6,2011-05-08 11:37:00,2.55,14911.0
552262,85123A,WHITE HANGING HEART T-LIGHT HOLDER,6,2011-05-08 11:37:00,2.95,14911.0
552262,23066,SMALL DECO JEWELLERY STAND,4,2011-05-08 11:37:00,8.25,14911.0
552262,23065,LARGE DECO JEWELLERY STAND,2,2011-05-08 11:37:00,12.5,14911.0
552262,23048,SET OF 10 LANTERNS FAIRY LIGHT STAR,4,2011-05-08 11:37:00,4.15,14911.0
552262,23073,GEORGIAN TRINKET BOX,3,2011-05-08 11:37:00,12.5,14911.0
552262,23071,MARIE ANTOINETTE TRINKET BOX GOLD,3,2011-05-08 11:37:00,12.5,14911.0
552262,23162,REGENCY TEA STRAINER,4,2011-05-08 11:37:00,3.75,14911.0
552262,23299,FOOD COVER WITH BEADS SET 2,6,2011-05-08 11:37:00,3.75,14911.0
552262,23070,EDWARDIAN HEART PHOTO FRAME,4,2011-05-08 11:37:00,4.15,14911.0
552262,23069,EDWARDIAN PHOTO FRAME,2,2011-05-08 11:37:00,6.25,14911.0
552262,23072,MARIE ANTOINETTE TRINKET BOX SILVER,3,2011-05-08 11:37:00,12.5,14911.0
552262,21469,POLKA DOT RAFFIA FOOD COVER,6,2011-05-08 11:37:00,3.75,14911.0
552262,23206,LUNCH BAG APPLE DESIGN,10,2011-05-08 11:37:00,1.65,14911.0
552262,23207,LUNCH BAG ALPHABET DESIGN,10,2011-05-08 11:37:00,1.65,14911.0
552262,20652,BLUE POLKADOT LUGGAGE TAG,12,2011-05-08 11:37:00,1.25,14911.0
552262,20655,QUEEN OF SKIES LUGGAGE TAG,12,2011-05-08 11:37:00,1.25,14911.0
552262,84912A,PINK ROSE WASHBAG,4,2011-05-08 11:37:00,3.75,14911.0
552262,84912B,GREEN ROSE WASHBAG,4,2011-05-08 11:37:00,3.75,14911.0
552262,22278,OVERNIGHT BAG VINTAGE ROSE PAISLEY,3,2011-05-08 11:37:00,4.95,14911.0
552262,22334,DINOSAUR PARTY BAG + STICKER SET,8,2011-05-08 11:37:00,1.65,14911.0
552262,22333,RETROSPOT PARTY BAG + STICKER SET,8,2011-05-08 11:37:00,1.65,14911.0
552262,21061,PARTY INVITES FOOTBALL,12,2011-05-08 11:37:00,0.85,14911.0
552262,21063,PARTY INVITES JAZZ HEARTS,12,2011-05-08 11:37:00,0.85,14911.0
552262,22821,GIFT BAG PSYCHEDELIC APPLES,12,2011-05-08 11:37:00,0.65,14911.0
552262,16052,TEATIME PUSH DOWN RUBBER,24,2011-05-08 11:37:00,0.42,14911.0
552262,16236,KITTY PENCIL ERASERS,28,2011-05-08 11:37:00,0.21,14911.0
552262,20977,36 PENCILS TUBE WOODLAND,16,2011-05-08 11:37:00,1.25,14911.0
552262,20978,36 PENCILS TUBE SKULLS,16,2011-05-08 11:37:00,1.25,14911.0
552539,21704,BAG 250g SWIRLY MARBLES,12,2011-05-10 10:17:00,0.85,""
552539,21889,WOODEN BOX OF DOMINOES,12,2011-05-10 10:17:00,1.25,""
552539,21891,TRADITIONAL WOODEN SKIPPING ROPE,12,2011-05-10 10:17:00,1.45,""
552539,22149,FELTCRAFT 6 FLOWER FRIENDS,6,2011-05-10 10:17:00,2.1,""
552539,22507,MEMO BOARD RETROSPOT  DESIGN,4,2011-05-10 10:17:00,4.95,""
552539,21080,SET/20 RED RETROSPOT PAPER NAPKINS,12,2011-05-10 10:17:00,0.85,""
552539,21094,SET/6 RED SPOTTY PAPER PLATES,12,2011-05-10 10:17:00,0.85,""
552539,21086,SET/6 RED SPOTTY PAPER CUPS,12,2011-05-10 10:17:00,0.65,""
552539,22090,PAPER BUNTING RETROSPOT,6,2011-05-10 10:17:00,2.95,""
552539,22961,JAM MAKING SET PRINTED,12,2011-05-10 10:17:00,1.45,""
552539,22722,SET OF 6 SPICE TINS PANTRY DESIGN,4,2011-05-10 10:17:00,3.95,""
552539,22423,REGENCY CAKESTAND 3 TIER,4,2011-05-10 10:17:00,12.75,""
552539,21658,GLASS  BEURRE DISH,4,2011-05-10 10:17:00,3.95,""
552539,21977,PACK OF 60 PINK PAISLEY CAKE CASES,24,2011-05-10 10:17:00,0.55,""
552539,21471,STRAWBERRY RAFFIA FOOD COVER,6,2011-05-10 10:17:00,3.75,""
552539,22665,RECIPE BOX BLUE SKETCHBOOK DESIGN,6,2011-05-10 10:17:00,2.95,""
552539,22666,RECIPE BOX PANTRY YELLOW DESIGN,6,2011-05-10 10:17:00,2.95,""
552539,22508,DOORSTOP RETROSPOT HEART,4,2011-05-10 10:17:00,3.75,""
552539,22728,ALARM CLOCK BAKELIKE PINK,4,2011-05-10 10:17:00,3.75,""
552539,21175,GIN + TONIC DIET METAL SIGN,12,2011-05-10 10:17:00,2.55,""
552539,84978,HANGING HEART JAR T-LIGHT HOLDER,36,2011-05-10 10:17:00,1.06,""
552539,22427,ENAMEL FLOWER JUG CREAM,3,2011-05-10 10:17:00,5.95,""
552539,22424,ENAMEL BREAD BIN CREAM,2,2011-05-10 10:17:00,12.75,""
552539,22849,BREAD BIN DINER STYLE MINT,4,2011-05-10 10:17:00,14.95,""
552539,84836,ZINC METAL HEART DECORATION,12,2011-05-10 10:17:00,1.25,""
552539,22796,PHOTO FRAME 3 CLASSIC HANGING,2,2011-05-10 10:17:00,9.95,""
552540,23136,IVORY WIRE SWEETHEART LETTER TRAY,4,2011-05-10 10:18:00,3.75,""
552540,23183,MOTHER'S KITCHEN SPOON REST,8,2011-05-10 10:18:00,3.75,""
552540,22907,PACK OF 20 NAPKINS PANTRY DESIGN,24,2011-05-10 10:18:00,0.85,""
552540,85123A,WHITE HANGING HEART T-LIGHT HOLDER,12,2011-05-10 10:18:00,2.95,""
552540,22722,SET OF 6 SPICE TINS PANTRY DESIGN,4,2011-05-10 10:18:00,3.95,""
552540,21871,SAVE THE PLANET MUG,12,2011-05-10 10:18:00,1.25,""
552540,22699,ROSES REGENCY TEACUP AND SAUCER,6,2011-05-10 10:18:00,2.95,""
552540,21181,PLEASE ONE PERSON METAL SIGN,12,2011-05-10 10:18:00,2.1,""
552540,84378,SET OF 3 HEART COOKIE CUTTERS,12,2011-05-10 10:18:00,1.25,""
552540,23179,CLOCK MAGNET MUM'S KITCHEN,6,2011-05-10 10:18:00,2.89,""
552541,22982,PANTRY PASTRY BRUSH,12,2011-05-10 10:19:00,1.25,""
552541,22847,BREAD BIN DINER STYLE IVORY,4,2011-05-10 10:19:00,14.95,""
553203,C2,CARRIAGE,1,2011-05-15 16:10:00,50.0,14911.0
553203,22798,ANTIQUE GLASS DRESSING TABLE POT,8,2011-05-15 16:10:00,2.95,14911.0
553203,21314,SMALL GLASS HEART TRINKET POT,8,2011-05-15 16:10:00,2.1,14911.0
