569556,23343,JUMBO BAG VINTAGE CHRISTMAS,10,2011-10-05 08:50:00,2.08,14936.0
569556,23144,ZINC T-LIGHT HOLDER STARS SMALL,24,2011-10-05 08:50:00,0.83,14936.0
569556,84970S,HANGING HEART ZINC T-LIGHT HOLDER,12,2011-10-05 08:50:00,0.85,14936.0
569556,23145,ZINC T-LIGHT HOLDER STAR LARGE,12,2011-10-05 08:50:00,0.95,14936.0
569556,23271,CHRISTMAS TABLE SILVER CANDLE SPIKE,32,2011-10-05 08:50:00,0.83,14936.0
569556,23344,JUMBO BAG 50'S CHRISTMAS,10,2011-10-05 08:50:00,2.08,14936.0
569556,23327,HANGING CLEAR MINI BOTTLE,48,2011-10-05 08:50:00,0.63,14936.0
569556,23397,FOOT STOOL HOME SWEET HOME,2,2011-10-05 08:50:00,9.95,14936.0
569556,23393,HOME SWEET HOME CUSHION COVER,4,2011-10-05 08:50:00,3.75,14936.0
569556,23395,BELLE JARDINIERE CUSHION COVER,4,2011-10-05 08:50:00,3.75,14936.0
569556,23396,LA JARDIN BOTANIQUE CUSHION COVER,4,2011-10-05 08:50:00,3.75,14936.0
569556,23026,DRAWER KNOB VINTAGE GLASS STAR,12,2011-10-05 08:50:00,2.08,14936.0
569556,23035,DRAWER KNOB CERAMIC IVORY,12,2011-10-05 08:50:00,1.45,14936.0
569556,21673,WHITE SPOT BLUE CERAMIC DRAWER KNOB,12,2011-10-05 08:50:00,1.45,14936.0
569556,21670,BLUE SPOT CERAMIC DRAWER KNOB,12,2011-10-05 08:50:00,1.45,14936.0
569556,22805,BLUE DRAWER KNOB ACRYLIC EDWARDIAN,12,2011-10-05 08:50:00,1.25,14936.0
569556,22771,CLEAR DRAWER KNOB ACRYLIC EDWARDIAN,12,2011-10-05 08:50:00,1.25,14936.0
569556,22774,RED DRAWER KNOB ACRYLIC EDWARDIAN,12,2011-10-05 08:50:00,1.25,14936.0
569556,22775,PURPLE DRAWERKNOB ACRYLIC EDWARDIAN,12,2011-10-05 08:50:00,1.25,14936.0
569556,21313,GLASS HEART T-LIGHT HOLDER,12,2011-10-05 08:50:00,0.85,14936.0
569556,22722,SET OF 6 SPICE TINS PANTRY DESIGN,4,2011-10-05 08:50:00,3.95,14936.0
569556,22966,GINGERBREAD MAN COOKIE CUTTER,12,2011-10-05 08:50:00,1.25,14936.0
569556,23307,SET OF 60 PANTRY DESIGN CAKE CASES,24,2011-10-05 08:50:00,0.55,14936.0
569556,23337,EGG FRYING PAN MINT,6,2011-10-05 08:50:00,2.08,14936.0
569556,23335,EGG FRYING PAN IVORY,6,2011-10-05 08:50:00,2.08,14936.0
569556,23336,EGG FRYING PAN PINK,6,2011-10-05 08:50:00,2.08,14936.0
569556,23370,SET 36 COLOURING PENCILS DOILY,16,2011-10-05 08:50:00,1.25,14936.0
569556,22728,ALARM CLOCK BAKELIKE PINK,4,2011-10-05 08:50:00,3.75,14936.0
569556,23341,PINK DINER WALL CLOCK,2,2011-10-05 08:50:00,8.5,14936.0
569556,22940,FELTCRAFT CHRISTMAS FAIRY,4,2011-10-05 08:50:00,4.25,14936.0
569556,22150,3 STRIPEY MICE FELTCRAFT,6,2011-10-05 08:50:00,1.95,14936.0
569556,23203,JUMBO BAG VINTAGE DOILY,10,2011-10-05 08:50:00,2.08,14936.0
569556,21929,JUMBO BAG PINK VINTAGE PAISLEY,10,2011-10-05 08:50:00,2.08,14936.0
569556,21928,JUMBO BAG SCANDINAVIAN BLUE PAISLEY,10,2011-10-05 08:50:00,2.08,14936.0
569556,23202,JUMBO BAG VINTAGE LEAF,10,2011-10-05 08:50:00,2.08,14936.0
569556,23201,JUMBO BAG ALPHABET,10,2011-10-05 08:50:00,2.08,14936.0
569556,23199,JUMBO BAG APPLES,10,2011-10-05 08:50:00,2.08,14936.0
569556,23200,JUMBO BAG PEARS,10,2011-10-05 08:50:00,2.08,14936.0
569556,23301,GARDENERS KNEELING PAD KEEP CALM,12,2011-10-05 08:50:00,1.65,14936.0
569556,23300,GARDENERS KNEELING PAD CUP OF TEA,12,2011-10-05 08:50:00,1.65,14936.0
569556,23326,HANGING MINI COLOURED BOTTLES,48,2011-10-05 08:50:00,0.63,14936.0
569556,71459,HANGING JAM JAR T-LIGHT HOLDERS,24,2011-10-05 08:50:00,0.85,14936.0
569556,22114,HOT WATER BOTTLE TEA AND SYMPATHY,4,2011-10-05 08:50:00,4.25,14936.0
569556,84030E,ENGLISH ROSE HOT WATER BOTTLE,4,2011-10-05 08:50:00,4.25,14936.0
569556,23356,LOVE HOT WATER BOTTLE,3,2011-10-05 08:50:00,5.95,14936.0
569556,22835,HOT WATER BOTTLE I AM SO POORLY,4,2011-10-05 08:50:00,4.95,14936.0
569556,22865,HAND WARMER OWL DESIGN,12,2011-10-05 08:50:00,2.1,14936.0
569556,22866,HAND WARMER SCOTTY DOG DESIGN,12,2011-10-05 08:50:00,2.1,14936.0
569556,23439,HAND WARMER RED LOVE HEART,12,2011-10-05 08:50:00,2.1,14936.0
569556,23526,DOG LICENCE WALL ART,4,2011-10-05 08:50:00,5.95,14936.0
569556,23284,DOORMAT KEEP CALM AND COME IN,2,2011-10-05 08:50:00,8.25,14936.0
569556,23283,DOORMAT VINTAGE LEAF,2,2011-10-05 08:50:00,8.25,14936.0
569556,22690,DOORMAT HOME SWEET HOME BLUE,2,2011-10-05 08:50:00,8.25,14936.0
569556,23535,BICYCLE SAFTEY WALL ART,4,2011-10-05 08:50:00,5.95,14936.0
569556,23536,VILLAGE SHOW WALL ART,4,2011-10-05 08:50:00,5.95,14936.0
569556,23534,STOP FOR TEA WALL ART,3,2011-10-05 08:50:00,5.95,14936.0
569556,23231,WRAP  VINTAGE DOILY,25,2011-10-05 08:50:00,0.42,14936.0
569556,22688,DOORMAT PEACE ON EARTH BLUE,2,2011-10-05 08:50:00,8.25,14936.0
569556,23545,WRAP RED VINTAGE DOILY,25,2011-10-05 08:50:00,0.42,14936.0
569556,23232,WRAP VINTAGE LEAF DESIGN,25,2011-10-05 08:50:00,0.42,14936.0
569556,23549,WRAP BIRD GARDEN,25,2011-10-05 08:50:00,0.42,14936.0
569556,23230,WRAP ALPHABET DESIGN,25,2011-10-05 08:50:00,0.42,14936.0
569557,48116,DOORMAT MULTICOLOUR STRIPE,4,2011-10-05 08:52:00,8.25,14936.0
569558,22086,PAPER CHAIN KIT 50'S CHRISTMAS,24,2011-10-05 08:53:00,2.95,14936.0
569558,22910,PAPER CHAIN KIT VINTAGE CHRISTMAS,12,2011-10-05 08:53:00,2.95,14936.0
569558,22945,CHRISTMAS METAL TAGS ASSORTED,48,2011-10-05 08:53:00,0.85,14936.0
569558,23131,MISELTOE HEART WREATH WHITE,12,2011-10-05 08:53:00,4.15,14936.0
569558,22941,CHRISTMAS LIGHTS 10 REINDEER,6,2011-10-05 08:53:00,8.5,14936.0
569558,23129,HEART SHAPED HOLLY WREATH,8,2011-10-05 08:53:00,4.15,14936.0
569558,23130,MISELTOE HEART WREATH,8,2011-10-05 08:53:00,4.15,14936.0
569558,22952,60 CAKE CASES VINTAGE CHRISTMAS,48,2011-10-05 08:53:00,0.55,14936.0
569558,23157,SET OF 6 NATIVITY MAGNETS,24,2011-10-05 08:53:00,2.08,14936.0
569558,22738,RIBBON REEL SNOWY VILLAGE,20,2011-10-05 08:53:00,1.65,14936.0
569558,22909,SET OF 20 VINTAGE CHRISTMAS NAPKINS,24,2011-10-05 08:53:00,0.85,14936.0
569558,23234,BISCUIT TIN VINTAGE CHRISTMAS,12,2011-10-05 08:53:00,2.89,14936.0
569558,22950,36 DOILIES VINTAGE CHRISTMAS,24,2011-10-05 08:53:00,1.45,14936.0
569558,22178,VICTORIAN GLASS HANGING T-LIGHT,24,2011-10-05 08:53:00,1.25,14936.0
569558,23273,HEART T-LIGHT HOLDER WILLIE WINKIE,12,2011-10-05 08:53:00,1.65,14936.0
569558,23274,STAR T-LIGHT HOLDER WILLIE WINKIE,12,2011-10-05 08:53:00,1.65,14936.0
569558,23221,REINDEER HEART DECORATION SILVER,24,2011-10-05 08:53:00,0.83,14936.0
569558,23225,CHERUB HEART DECORATION SILVER,24,2011-10-05 08:53:00,0.83,14936.0
571201,22940,FELTCRAFT CHRISTMAS FAIRY,12,2011-10-14 12:28:00,3.75,14937.0
571201,22147,FELTCRAFT BUTTERFLY HEARTS,12,2011-10-14 12:28:00,1.25,14937.0
571201,23128,FELTCRAFT BOY JEAN-PAUL KIT,12,2011-10-14 12:28:00,4.15,14937.0
571201,22142,CHRISTMAS CRAFT WHITE FAIRY,12,2011-10-14 12:28:00,1.25,14937.0
571201,22141,CHRISTMAS CRAFT TREE TOP ANGEL,12,2011-10-14 12:28:00,1.85,14937.0
571201,22144,CHRISTMAS CRAFT LITTLE FRIENDS,12,2011-10-14 12:28:00,1.85,14937.0
571201,22150,3 STRIPEY MICE FELTCRAFT,12,2011-10-14 12:28:00,1.65,14937.0
571201,20969,RED FLORAL FELTCRAFT SHOULDER BAG,12,2011-10-14 12:28:00,3.39,14937.0
571201,20970,PINK FLORAL FELTCRAFT SHOULDER BAG,12,2011-10-14 12:28:00,3.39,14937.0
571201,20972,PINK CREAM FELT CRAFT TRINKET BOX,12,2011-10-14 12:28:00,1.06,14937.0
571201,20971,PINK BLUE FELT CRAFT TRINKET BOX,12,2011-10-14 12:28:00,1.06,14937.0
571201,22751,FELTCRAFT PRINCESS OLIVIA DOLL,12,2011-10-14 12:28:00,3.39,14937.0
571201,22750,FELTCRAFT PRINCESS LOLA DOLL,12,2011-10-14 12:28:00,3.39,14937.0
571201,22749,FELTCRAFT PRINCESS CHARLOTTE DOLL,12,2011-10-14 12:28:00,3.39,14937.0
571201,23127,FELTCRAFT GIRL NICOLE KIT,12,2011-10-14 12:28:00,4.15,14937.0
571201,23126,FELTCRAFT GIRL AMELIE KIT,12,2011-10-14 12:28:00,4.15,14937.0
571201,22271,FELTCRAFT DOLL ROSIE,12,2011-10-14 12:28:00,2.55,14937.0
571201,22273,FELTCRAFT DOLL MOLLY,12,2011-10-14 12:28:00,2.55,14937.0
571201,22274,FELTCRAFT DOLL EMILY,12,2011-10-14 12:28:00,2.55,14937.0
571201,22568,FELTCRAFT CUSHION OWL,12,2011-10-14 12:28:00,3.39,14937.0
571202,85123A,WHITE HANGING HEART T-LIGHT HOLDER,72,2011-10-14 12:29:00,2.95,14937.0
574587,21210,SET OF 72 RETROSPOT PAPER  DOILIES,12,2011-11-06 10:29:00,1.45,14936.0
574587,21080,SET/20 RED RETROSPOT PAPER NAPKINS,12,2011-11-06 10:29:00,0.85,14936.0
574587,22557,PLASTERS IN TIN VINTAGE PAISLEY,12,2011-11-06 10:29:00,1.65,14936.0
574587,22555,PLASTERS IN TIN STRONGMAN,12,2011-11-06 10:29:00,1.65,14936.0
574587,22553,PLASTERS IN TIN SKULLS,12,2011-11-06 10:29:00,1.65,14936.0
574587,84836,ZINC METAL HEART DECORATION,12,2011-11-06 10:29:00,1.25,14936.0
574587,20828,GLITTER BUTTERFLY CLIPS,12,2011-11-06 10:29:00,2.55,14936.0
574587,85123A,WHITE HANGING HEART T-LIGHT HOLDER,12,2011-11-06 10:29:00,2.95,14936.0
574587,84978,HANGING HEART JAR T-LIGHT HOLDER,12,2011-11-06 10:29:00,1.25,14936.0
574587,22585,PACK OF 6 BIRDY GIFT TAGS,12,2011-11-06 10:29:00,1.25,14936.0
574587,22083,PAPER CHAIN KIT RETROSPOT,12,2011-11-06 10:29:00,2.95,14936.0
574587,85099F,JUMBO BAG STRAWBERRY,10,2011-11-06 10:29:00,2.08,14936.0
574587,85099C,JUMBO  BAG BAROQUE BLACK WHITE,10,2011-11-06 10:29:00,2.08,14936.0
574587,85099B,JUMBO BAG RED RETROSPOT,10,2011-11-06 10:29:00,2.08,14936.0
574587,21930,JUMBO STORAGE BAG SKULLS,10,2011-11-06 10:29:00,2.08,14936.0
574587,20713,JUMBO BAG OWLS,10,2011-11-06 10:29:00,2.08,14936.0
574587,23337,EGG FRYING PAN MINT,6,2011-11-06 10:29:00,2.08,14936.0
574587,23336,EGG FRYING PAN PINK,6,2011-11-06 10:29:00,2.08,14936.0
574587,23335,EGG FRYING PAN IVORY,6,2011-11-06 10:29:00,2.08,14936.0
574587,22956,36 FOIL HEART CAKE CASES,6,2011-11-06 10:29:00,2.1,14936.0
574587,20914,SET/5 RED RETROSPOT LID GLASS BOWLS,6,2011-11-06 10:29:00,2.95,14936.0
574587,21756,BATH BUILDING BLOCK WORD,6,2011-11-06 10:29:00,6.25,14936.0
574587,21755,LOVE BUILDING BLOCK WORD,6,2011-11-06 10:29:00,6.25,14936.0
574587,21754,HOME BUILDING BLOCK WORD,6,2011-11-06 10:29:00,6.25,14936.0
574587,23395,BELLE JARDINIERE CUSHION COVER,4,2011-11-06 10:29:00,3.75,14936.0
574587,23284,DOORMAT KEEP CALM AND COME IN,4,2011-11-06 10:29:00,8.25,14936.0
574587,20685,DOORMAT RED RETROSPOT,4,2011-11-06 10:29:00,8.25,14936.0
574587,23356,LOVE HOT WATER BOTTLE,4,2011-11-06 10:29:00,5.95,14936.0
574587,22114,HOT WATER BOTTLE TEA AND SYMPATHY,4,2011-11-06 10:29:00,4.25,14936.0
574587,23534,WALL ART STOP FOR TEA,3,2011-11-06 10:29:00,5.95,14936.0
574587,22607,WOODEN ROUNDERS GARDEN SET,2,2011-11-06 10:29:00,9.95,14936.0
574587,48194,DOORMAT HEARTS,2,2011-11-06 10:29:00,8.25,14936.0
574587,48188,DOORMAT WELCOME PUPPIES,2,2011-11-06 10:29:00,8.25,14936.0
574587,48187,DOORMAT NEW ENGLAND,2,2011-11-06 10:29:00,8.25,14936.0
574587,48185,DOORMAT FAIRY CAKE,2,2011-11-06 10:29:00,8.25,14936.0
574587,48184,DOORMAT ENGLISH ROSE,2,2011-11-06 10:29:00,8.25,14936.0
574587,23283,DOORMAT VINTAGE LEAF,2,2011-11-06 10:29:00,8.25,14936.0
574587,22627,MINT KITCHEN SCALES,2,2011-11-06 10:29:00,8.5,14936.0
574587,22625,RED KITCHEN SCALES,2,2011-11-06 10:29:00,8.5,14936.0
574587,22624,IVORY KITCHEN SCALES,2,2011-11-06 10:29:00,8.5,14936.0
574587,21524,DOORMAT SPOTTY HOME SWEET HOME,2,2011-11-06 10:29:00,8.25,14936.0
574587,21523,DOORMAT FANCY FONT HOME SWEET HOME,2,2011-11-06 10:29:00,8.25,14936.0
574587,21217,RED RETROSPOT ROUND CAKE TINS,2,2011-11-06 10:29:00,9.95,14936.0
574587,22846,BREAD BIN DINER STYLE RED,1,2011-11-06 10:29:00,16.95,14936.0
574587,22771,CLEAR DRAWER KNOB ACRYLIC EDWARDIAN,36,2011-11-06 10:29:00,1.25,14936.0
574587,84992,72 SWEETHEART FAIRY CAKE CASES,24,2011-11-06 10:29:00,0.55,14936.0
574587,84991,60 TEATIME FAIRY CAKE CASES,24,2011-11-06 10:29:00,0.55,14936.0
574587,22417,PACK OF 60 SPACEBOY CAKE CASES,24,2011-11-06 10:29:00,0.55,14936.0
574587,21975,PACK OF 60 DINOSAUR CAKE CASES,24,2011-11-06 10:29:00,0.55,14936.0
574587,21213,PACK OF 72 SKULL CAKE CASES,24,2011-11-06 10:29:00,0.55,14936.0
574587,21212,PACK OF 72 RETROSPOT CAKE CASES,24,2011-11-06 10:29:00,0.55,14936.0
574587,84971S,SMALL HEART FLOWERS HOOK,24,2011-11-06 10:29:00,0.85,14936.0
574587,22185,SLATE TILE NATURAL HANGING,24,2011-11-06 10:29:00,1.65,14936.0
574587,84970L,SINGLE HEART ZINC T-LIGHT HOLDER,24,2011-11-06 10:29:00,1.25,14936.0
574587,22561,WOODEN SCHOOL COLOURING SET,12,2011-11-06 10:29:00,1.65,14936.0
574587,84988,SET OF 72 PINK HEART PAPER DOILIES,12,2011-11-06 10:29:00,1.45,14936.0
574587,84987,SET OF 36 TEATIME PAPER DOILIES,12,2011-11-06 10:29:00,1.45,14936.0
574587,22962,JAM JAR WITH PINK LID,12,2011-11-06 10:29:00,0.85,14936.0
574587,22961,JAM MAKING SET PRINTED,12,2011-11-06 10:29:00,1.45,14936.0
574587,22416,SET OF 36 SPACEBOY PAPER DOILIES,12,2011-11-06 10:29:00,1.45,14936.0
574587,21972,SET OF 36 DINOSAUR PAPER DOILIES,12,2011-11-06 10:29:00,1.45,14936.0
574588,23486,ANTIQUE HEART SHELF UNIT,2,2011-11-06 10:30:00,16.65,14936.0
574588,23582,VINTAGE DOILY JUMBO BAG RED,10,2011-11-06 10:30:00,2.08,14936.0
574588,23581,JUMBO BAG PAISLEY PARK,10,2011-11-06 10:30:00,2.08,14936.0
