539050,84947,ANTIQUE SILVER TEA GLASS ENGRAVED,12,2010-12-15 16:21:00,1.25,12577.0
539050,84836,ZINC METAL HEART DECORATION,12,2010-12-15 16:21:00,1.25,12577.0
539050,21326,AGED GLASS SILVER T-LIGHT HOLDER,12,2010-12-15 16:21:00,0.65,12577.0
539050,20967,GREY FLORAL FELTCRAFT SHOULDER BAG,1,2010-12-15 16:21:00,3.75,12577.0
539050,22749,FELTCRAFT PRINCESS CHARLOTTE DOLL,1,2010-12-15 16:21:00,3.75,12577.0
539050,22940,FELTCRAFT CHRISTMAS FAIRY,1,2010-12-15 16:21:00,4.25,12577.0
539050,20972,PINK CREAM FELT CRAFT TRINKET BOX,1,2010-12-15 16:21:00,1.25,12577.0
539050,22785,SQUARECUSHION COVER PINK UNION FLAG,2,2010-12-15 16:21:00,6.75,12577.0
539050,21034,REX CASH+CARRY JUMBO SHOPPER,1,2010-12-15 16:21:00,0.95,12577.0
C539104,22662,LUNCH BAG DOLLY GIRL DESIGN,-3,2010-12-16 10:38:00,1.65,12494.0
539113,22662,LUNCH BAG DOLLY GIRL DESIGN,3,2010-12-16 11:24:00,1.65,12494.0
C539114,22667,RECIPE BOX RETROSPOT,-3,2010-12-16 11:24:00,2.95,12494.0
539407,22264,FELT FARM ANIMAL WHITE BUNNY,192,2010-12-17 12:56:00,0.19,12726.0
539407,22492,MINI PAINT SET VINTAGE,72,2010-12-17 12:56:00,0.65,12726.0
539407,22255,FELT TOADSTOOL  SMALL,48,2010-12-17 12:56:00,0.85,12726.0
539407,21914,BLUE HARMONICA IN BOX,12,2010-12-17 12:56:00,1.25,12726.0
539407,22333,RETROSPOT PARTY BAG + STICKER SET,8,2010-12-17 12:56:00,1.65,12726.0
539407,POST,POSTAGE,1,2010-12-17 12:56:00,18.0,12726.0
539435,21731,RED TOADSTOOL LED NIGHT LIGHT,36,2010-12-17 14:46:00,1.65,12691.0
539435,22326,ROUND SNACK BOXES SET OF4 WOODLAND,12,2010-12-17 14:46:00,2.95,12691.0
539435,20750,RED RETROSPOT MINI CASES,4,2010-12-17 14:46:00,7.95,12691.0
539435,21452,TOADSTOOL MONEY BOX,12,2010-12-17 14:46:00,2.95,12691.0
539435,POST,POSTAGE,1,2010-12-17 14:46:00,18.0,12691.0
539551,21731,RED TOADSTOOL LED NIGHT LIGHT,12,2010-12-20 11:38:00,1.65,12721.0
539551,22466,FAIRY TALE COTTAGE NIGHTLIGHT,24,2010-12-20 11:38:00,1.95,12721.0
539551,84051,ASS COLOUR GLOWING TIARAS,10,2010-12-20 11:38:00,0.85,12721.0
539551,84050,PINK HEART SHAPE EGG FRYING PAN,12,2010-12-20 11:38:00,1.65,12721.0
539551,21355,TOAST ITS - I LOVE YOU,12,2010-12-20 11:38:00,1.25,12721.0
539551,20726,LUNCH BAG WOODLAND,10,2010-12-20 11:38:00,1.65,12721.0
539551,22331,WOODLAND PARTY BAG + STICKER SET,8,2010-12-20 11:38:00,1.65,12721.0
539551,22333,RETROSPOT PARTY BAG + STICKER SET,8,2010-12-20 11:38:00,1.65,12721.0
539551,20682,RED RETROSPOT CHILDRENS UMBRELLA,6,2010-12-20 11:38:00,3.25,12721.0
539551,20681,PINK POLKADOT CHILDRENS UMBRELLA,6,2010-12-20 11:38:00,3.25,12721.0
539551,15056N,EDWARDIAN PARASOL NATURAL,3,2010-12-20 11:38:00,5.95,12721.0
539551,15056P,EDWARDIAN PARASOL PINK,3,2010-12-20 11:38:00,5.95,12721.0
539551,85135C,RED DRAGONFLY HELICOPTER,2,2010-12-20 11:38:00,7.95,12721.0
539551,22834,HAND WARMER BABUSHKA DESIGN,12,2010-12-20 11:38:00,2.1,12721.0
539551,POST,POSTAGE,1,2010-12-20 11:38:00,18.0,12721.0
539607,84997D,PINK 3 PIECE POLKADOT CUTLERY SET,6,2010-12-20 14:10:00,3.75,12681.0
539607,22895,SET OF 2 TEA TOWELS APPLE AND PEARS,6,2010-12-20 14:10:00,2.95,12681.0
539607,21731,RED TOADSTOOL LED NIGHT LIGHT,24,2010-12-20 14:10:00,1.65,12681.0
539607,22976,CIRCUS PARADE CHILDRENS EGG CUP,12,2010-12-20 14:10:00,1.25,12681.0
539607,22966,GINGERBREAD MAN COOKIE CUTTER,12,2010-12-20 14:10:00,1.25,12681.0
539607,22970,LONDON BUS COFFEE MUG,18,2010-12-20 14:10:00,2.55,12681.0
539607,22973,CHILDREN'S CIRCUS PARADE MUG,24,2010-12-20 14:10:00,1.65,12681.0
539607,21065,BOOM BOX SPEAKER GIRLS,4,2010-12-20 14:10:00,5.95,12681.0
539607,22504,CABIN BAG VINTAGE RETROSPOT,3,2010-12-20 14:10:00,12.75,12681.0
539607,21224,SET/4 SKULL BADGES,10,2010-12-20 14:10:00,1.25,12681.0
539607,22356,CHARLOTTE BAG PINK POLKADOT,10,2010-12-20 14:10:00,0.85,12681.0
539607,21137,BLACK RECORD COVER FRAME,4,2010-12-20 14:10:00,3.75,12681.0
539607,22041,"\"RECORD FRAME 7\"\" SINGLE SIZE \"",6,2010-12-20 14:10:00,2.55,12681.0
539607,22029,SPACEBOY BIRTHDAY CARD,12,2010-12-20 14:10:00,0.42,12681.0
539607,21506,"FANCY FONT BIRTHDAY CARD,",12,2010-12-20 14:10:00,0.42,12681.0
539607,22961,JAM MAKING SET PRINTED,12,2010-12-20 14:10:00,1.45,12681.0
539607,21240,BLUE POLKADOT CUP,8,2010-12-20 14:10:00,0.85,12681.0
539607,21086,SET/6 RED SPOTTY PAPER CUPS,12,2010-12-20 14:10:00,0.65,12681.0
539607,21987,PACK OF 6 SKULL PAPER CUPS,12,2010-12-20 14:10:00,0.65,12681.0
539607,48138,DOORMAT UNION FLAG,2,2010-12-20 14:10:00,7.95,12681.0
539607,22555,PLASTERS IN TIN STRONGMAN,12,2010-12-20 14:10:00,1.65,12681.0
539607,22556,PLASTERS IN TIN CIRCUS PARADE,24,2010-12-20 14:10:00,1.65,12681.0
539607,22554,PLASTERS IN TIN WOODLAND ANIMALS,24,2010-12-20 14:10:00,1.65,12681.0
539607,82600,NO SINGING METAL SIGN,12,2010-12-20 14:10:00,2.1,12681.0
539607,22413,METAL SIGN TAKE IT OR LEAVE IT,6,2010-12-20 14:10:00,2.95,12681.0
539607,22197,SMALL POPCORN HOLDER,24,2010-12-20 14:10:00,0.85,12681.0
539607,22198,LARGE POPCORN HOLDER,12,2010-12-20 14:10:00,1.65,12681.0
539607,20617,FIRST CLASS PASSPORT COVER,6,2010-12-20 14:10:00,2.1,12681.0
539607,21864,UNION JACK FLAG PASSPORT COVER,6,2010-12-20 14:10:00,2.1,12681.0
539607,21865,PINK UNION JACK  PASSPORT COVER,6,2010-12-20 14:10:00,2.1,12681.0
539607,22892,SET OF SALT AND PEPPER TOADSTOOLS,12,2010-12-20 14:10:00,1.25,12681.0
539607,21883,STARS GIFT TAPE,24,2010-12-20 14:10:00,0.19,12681.0
539607,22652,TRAVEL SEWING KIT,30,2010-12-20 14:10:00,1.65,12681.0
539607,21080,SET/20 RED RETROSPOT PAPER NAPKINS,24,2010-12-20 14:10:00,0.85,12681.0
539607,22352,LUNCH BOX WITH CUTLERY RETROSPOT,6,2010-12-20 14:10:00,2.55,12681.0
539607,21559,STRAWBERRY LUNCH BOX WITH CUTLERY,6,2010-12-20 14:10:00,2.55,12681.0
539607,21700,BIG DOUGHNUT FRIDGE MAGNETS,24,2010-12-20 14:10:00,0.85,12681.0
539607,22181,SNOWSTORM PHOTO FRAME FRIDGE MAGNET,12,2010-12-20 14:10:00,0.85,12681.0
539607,20750,RED RETROSPOT MINI CASES,4,2010-12-20 14:10:00,7.95,12681.0
539607,21213,PACK OF 72 SKULL CAKE CASES,24,2010-12-20 14:10:00,0.55,12681.0
539607,21976,PACK OF 60 MUSHROOM CAKE CASES,24,2010-12-20 14:10:00,0.55,12681.0
539607,22314,OFFICE MUG WARMER CHOC+BLUE,6,2010-12-20 14:10:00,2.95,12681.0
539607,22312,OFFICE MUG WARMER POLKADOT,12,2010-12-20 14:10:00,2.95,12681.0
539607,22302,COFFEE MUG PEARS  DESIGN,24,2010-12-20 14:10:00,2.55,12681.0
539607,22303,COFFEE MUG APPLES DESIGN,24,2010-12-20 14:10:00,2.55,12681.0
539607,22365,DOORMAT RESPECTABLE HOUSE,2,2010-12-20 14:10:00,7.95,12681.0
539607,POST,POSTAGE,5,2010-12-20 14:10:00,18.0,12681.0
539688,C2,CARRIAGE,1,2010-12-21 11:00:00,150.0,12678.0
539727,22933,BAKING MOULD EASTER EGG MILK CHOC,6,2010-12-21 14:26:00,2.95,12678.0
539727,22934,BAKING MOULD EASTER EGG WHITE CHOC,6,2010-12-21 14:26:00,2.95,12678.0
539727,22558,CLOTHES PEGS RETROSPOT PACK 24,12,2010-12-21 14:26:00,1.49,12678.0
539727,POST,POSTAGE,1,2010-12-21 14:26:00,18.0,12678.0
539829,82613D,METAL SIGN CUPCAKE SINGLE HOOK,20,2010-12-22 12:47:00,0.42,12734.0
539829,82613B,"METAL SIGN,CUPCAKE SINGLE HOOK",20,2010-12-22 12:47:00,0.42,12734.0
539829,22223,CAKE PLATE LOVEBIRD PINK,24,2010-12-22 12:47:00,1.95,12734.0
539829,22222,CAKE PLATE LOVEBIRD WHITE,24,2010-12-22 12:47:00,1.95,12734.0
C540151,21843,RED RETROSPOT CAKE STAND,-1,2011-01-05 11:13:00,10.95,12494.0
C540156,21843,RED RETROSPOT CAKE STAND,-1,2011-01-05 11:36:00,10.95,12683.0
540178,22966,GINGERBREAD MAN COOKIE CUTTER,12,2011-01-05 12:42:00,1.25,12681.0
540178,21881,CUTE CATS TAPE,24,2011-01-05 12:42:00,0.19,12681.0
540178,22504,CABIN BAG VINTAGE RETROSPOT,3,2011-01-05 12:42:00,12.75,12681.0
540178,20973,12 PENCIL SMALL TUBE WOODLAND,24,2011-01-05 12:42:00,0.65,12681.0
540178,20975,12 PENCILS SMALL TUBE RED RETROSPOT,24,2011-01-05 12:42:00,0.65,12681.0
540178,22895,SET OF 2 TEA TOWELS APPLE AND PEARS,6,2011-01-05 12:42:00,2.95,12681.0
540178,22348,TEA BAG PLATE RED RETROSPOT,24,2011-01-05 12:42:00,0.85,12681.0
540178,21989,PACK OF 20 SKULL PAPER NAPKINS,12,2011-01-05 12:42:00,0.85,12681.0
540178,22892,SET OF SALT AND PEPPER TOADSTOOLS,12,2011-01-05 12:42:00,1.25,12681.0
540178,22467,GUMBALL COAT RACK,6,2011-01-05 12:42:00,2.55,12681.0
540178,21708,FOLDING UMBRELLA CREAM POLKADOT,4,2011-01-05 12:42:00,4.95,12681.0
540178,20682,RED RETROSPOT CHILDRENS UMBRELLA,6,2011-01-05 12:42:00,3.25,12681.0
540178,20686,DOLLY MIXTURE CHILDREN'S UMBRELLA,6,2011-01-05 12:42:00,3.25,12681.0
540178,21706,FOLDING UMBRELLA RED/WHITE POLKADOT,4,2011-01-05 12:42:00,4.95,12681.0
540178,22554,PLASTERS IN TIN WOODLAND ANIMALS,12,2011-01-05 12:42:00,1.65,12681.0
540178,22556,PLASTERS IN TIN CIRCUS PARADE,12,2011-01-05 12:42:00,1.65,12681.0
540178,22894,TABLECLOTH RED APPLES DESIGN,2,2011-01-05 12:42:00,8.5,12681.0
540178,22365,DOORMAT RESPECTABLE HOUSE,2,2011-01-05 12:42:00,7.95,12681.0
540178,22313,OFFICE MUG WARMER PINK,6,2011-01-05 12:42:00,2.95,12681.0
540178,22314,OFFICE MUG WARMER CHOC+BLUE,6,2011-01-05 12:42:00,2.95,12681.0
540178,21212,PACK OF 72 RETROSPOT CAKE CASES,24,2011-01-05 12:42:00,0.55,12681.0
540178,22352,LUNCH BOX WITH CUTLERY RETROSPOT,6,2011-01-05 12:42:00,2.55,12681.0
540178,21086,SET/6 RED SPOTTY PAPER CUPS,12,2011-01-05 12:42:00,0.65,12681.0
540178,21238,RED RETROSPOT CUP,8,2011-01-05 12:42:00,0.85,12681.0
540178,21064,BOOM BOX SPEAKER BOYS,2,2011-01-05 12:42:00,5.95,12681.0
540178,22961,JAM MAKING SET PRINTED,12,2011-01-05 12:42:00,1.45,12681.0
540178,21786,POLKADOT RAIN HAT,24,2011-01-05 12:42:00,0.42,12681.0
540178,22027,TEA PARTY BIRTHDAY CARD,12,2011-01-05 12:42:00,0.42,12681.0
540178,22037,ROBOT BIRTHDAY CARD,12,2011-01-05 12:42:00,0.42,12681.0
540178,21224,SET/4 SKULL BADGES,10,2011-01-05 12:42:00,1.25,12681.0
540178,22904,CALENDAR PAPER CUT DESIGN,6,2011-01-05 12:42:00,2.95,12681.0
540178,21544,SKULLS  WATER TRANSFER TATTOOS,12,2011-01-05 12:42:00,0.85,12681.0
540178,22620,4 TRADITIONAL SPINNING TOPS,12,2011-01-05 12:42:00,1.25,12681.0
540178,POST,POSTAGE,3,2011-01-05 12:42:00,18.0,12681.0
540239,21977,PACK OF 60 PINK PAISLEY CAKE CASES,24,2011-01-05 14:48:00,0.55,12682.0
540239,21976,PACK OF 60 MUSHROOM CAKE CASES,24,2011-01-05 14:48:00,0.55,12682.0
540239,15056BL,EDWARDIAN PARASOL BLACK,9,2011-01-05 14:48:00,5.95,12682.0
540239,22451,SILK PURSE BABUSHKA RED,6,2011-01-05 14:48:00,3.35,12682.0
540239,20866,BLUE ROSE FABRIC MIRROR,12,2011-01-05 14:48:00,1.25,12682.0
540239,22331,WOODLAND PARTY BAG + STICKER SET,8,2011-01-05 14:48:00,1.65,12682.0
540239,22895,SET OF 2 TEA TOWELS APPLE AND PEARS,6,2011-01-05 14:48:00,2.95,12682.0
540239,84279P,CHERRY BLOSSOM  DECORATIVE FLASK,4,2011-01-05 14:48:00,3.75,12682.0
540239,22859,EASTER TIN BUNNY BOUQUET,12,2011-01-05 14:48:00,1.65,12682.0
540239,22558,CLOTHES PEGS RETROSPOT PACK 24,12,2011-01-05 14:48:00,1.49,12682.0
540239,22904,CALENDAR PAPER CUT DESIGN,6,2011-01-05 14:48:00,2.95,12682.0
540239,22435,SET OF 9 HEART SHAPED BALLOONS,12,2011-01-05 14:48:00,1.25,12682.0
540239,21791,VINTAGE HEADS AND TAILS CARD GAME,12,2011-01-05 14:48:00,1.25,12682.0
540239,22302,COFFEE MUG PEARS  DESIGN,6,2011-01-05 14:48:00,2.55,12682.0
540239,10002,INFLATABLE POLITICAL GLOBE,12,2011-01-05 14:48:00,0.85,12682.0
540239,22352,LUNCH BOX WITH CUTLERY RETROSPOT,6,2011-01-05 14:48:00,2.55,12682.0
540239,21559,STRAWBERRY LUNCH BOX WITH CUTLERY,6,2011-01-05 14:48:00,2.55,12682.0
540239,22915,ASSORTED BOTTLE TOP  MAGNETS,12,2011-01-05 14:48:00,0.42,12682.0
540239,22976,CIRCUS PARADE CHILDRENS EGG CUP,12,2011-01-05 14:48:00,1.25,12682.0
540239,22966,GINGERBREAD MAN COOKIE CUTTER,12,2011-01-05 14:48:00,1.25,12682.0
540239,22891,TEA FOR ONE POLKADOT,6,2011-01-05 14:48:00,4.25,12682.0
540239,22962,JAM JAR WITH PINK LID,12,2011-01-05 14:48:00,0.85,12682.0
540239,20749,ASSORTED COLOUR MINI CASES,6,2011-01-05 14:48:00,7.95,12682.0
540239,20750,RED RETROSPOT MINI CASES,4,2011-01-05 14:48:00,7.95,12682.0
540239,22961,JAM MAKING SET PRINTED,12,2011-01-05 14:48:00,1.45,12682.0
540239,22064,PINK DOUGHNUT TRINKET POT,12,2011-01-05 14:48:00,1.65,12682.0
540239,22551,PLASTERS IN TIN SPACEBOY,12,2011-01-05 14:48:00,1.65,12682.0
540239,22554,PLASTERS IN TIN WOODLAND ANIMALS,12,2011-01-05 14:48:00,1.65,12682.0
540239,22556,PLASTERS IN TIN CIRCUS PARADE,12,2011-01-05 14:48:00,1.65,12682.0
540239,22326,ROUND SNACK BOXES SET OF4 WOODLAND,6,2011-01-05 14:48:00,2.95,12682.0
540239,22328,ROUND SNACK BOXES SET OF 4 FRUITS,6,2011-01-05 14:48:00,2.95,12682.0
540239,22423,REGENCY CAKESTAND 3 TIER,3,2011-01-05 14:48:00,12.75,12682.0
540239,15056N,EDWARDIAN PARASOL NATURAL,3,2011-01-05 14:48:00,5.95,12682.0
540239,15056P,EDWARDIAN PARASOL PINK,3,2011-01-05 14:48:00,5.95,12682.0
540239,20679,EDWARDIAN PARASOL RED,9,2011-01-05 14:48:00,5.95,12682.0
540239,21915,RED  HARMONICA IN BOX,12,2011-01-05 14:48:00,1.25,12682.0
540239,22027,TEA PARTY BIRTHDAY CARD,12,2011-01-05 14:48:00,0.42,12682.0
540239,22090,PAPER BUNTING RETROSPOT,6,2011-01-05 14:48:00,2.95,12682.0
540239,22333,RETROSPOT PARTY BAG + STICKER SET,8,2011-01-05 14:48:00,1.65,12682.0
540239,POST,POSTAGE,4,2011-01-05 14:48:00,18.0,12682.0
540351,22645,CERAMIC HEART FAIRY CAKE MONEY BANK,12,2011-01-06 14:26:00,1.45,12735.0
540351,22644,CERAMIC CHERRY CAKE MONEY BANK,12,2011-01-06 14:26:00,1.45,12735.0
540351,22650,CERAMIC PIRATE CHEST MONEY BANK,12,2011-01-06 14:26:00,1.45,12735.0
540351,85032A,ROMANTIC IMAGES GIFT WRAP SET,6,2011-01-06 14:26:00,2.1,12735.0
540351,22209,WOOD STAMP SET HAPPY BIRTHDAY,12,2011-01-06 14:26:00,1.65,12735.0
540351,10125,MINI FUNKY DESIGN TAPES,20,2011-01-06 14:26:00,0.42,12735.0
540351,22557,PLASTERS IN TIN VINTAGE PAISLEY,12,2011-01-06 14:26:00,1.65,12735.0
540351,22551,PLASTERS IN TIN SPACEBOY,12,2011-01-06 14:26:00,1.65,12735.0
540351,21980,PACK OF 12 RED RETROSPOT TISSUES,24,2011-01-06 14:26:00,0.29,12735.0
540351,20725,LUNCH BAG RED RETROSPOT,10,2011-01-06 14:26:00,1.65,12735.0
540351,21212,PACK OF 72 RETROSPOT CAKE CASES,24,2011-01-06 14:26:00,0.55,12735.0
540351,21975,PACK OF 60 DINOSAUR CAKE CASES,24,2011-01-06 14:26:00,0.55,12735.0
540351,22951,60 CAKE CASES DOLLY GIRL DESIGN,24,2011-01-06 14:26:00,0.55,12735.0
540351,22606,WOODEN SKITTLES GARDEN SET,1,2011-01-06 14:26:00,15.95,12735.0
540351,22605,WOODEN CROQUET GARDEN SET,1,2011-01-06 14:26:00,14.95,12735.0
540351,21918,SET 12 KIDS COLOUR  CHALK STICKS,24,2011-01-06 14:26:00,0.42,12735.0
540351,21917,SET 12 KIDS  WHITE CHALK STICKS,24,2011-01-06 14:26:00,0.42,12735.0
540351,21055,TOOL BOX SOFT TOY,1,2011-01-06 14:26:00,8.95,12735.0
540351,21054,NURSE'S BAG SOFT TOY,1,2011-01-06 14:26:00,8.95,12735.0
540351,21056,DOCTOR'S BAG SOFT TOY,1,2011-01-06 14:26:00,8.95,12735.0
540351,22637,PIGGY BANK RETROSPOT,4,2011-01-06 14:26:00,2.55,12735.0
540351,POST,POSTAGE,2,2011-01-06 14:26:00,18.0,12735.0
540365,22748,POPPY'S PLAYHOUSE KITCHEN,6,2011-01-06 16:12:00,2.1,12413.0
540365,21055,TOOL BOX SOFT TOY,3,2011-01-06 16:12:00,8.95,12413.0
540365,21328,BALLOONS  WRITING SET,12,2011-01-06 16:12:00,1.65,12413.0
540365,22418,10 COLOUR SPACEBOY PEN,24,2011-01-06 16:12:00,0.85,12413.0
540365,21883,STARS GIFT TAPE,12,2011-01-06 16:12:00,0.65,12413.0
540365,22138,BAKING SET 9 PIECE RETROSPOT,6,2011-01-06 16:12:00,4.95,12413.0
540365,22617,BAKING SET SPACEBOY DESIGN,6,2011-01-06 16:12:00,4.95,12413.0
540365,22326,ROUND SNACK BOXES SET OF4 WOODLAND,6,2011-01-06 16:12:00,2.95,12413.0
540365,21094,SET/6 RED SPOTTY PAPER PLATES,12,2011-01-06 16:12:00,0.85,12413.0
540365,21086,SET/6 RED SPOTTY PAPER CUPS,12,2011-01-06 16:12:00,0.65,12413.0
540365,21080,SET/20 RED RETROSPOT PAPER NAPKINS,12,2011-01-06 16:12:00,0.85,12413.0
540365,21936,RED RETROSPOT PICNIC BAG,5,2011-01-06 16:12:00,2.95,12413.0
540365,22634,CHILDS BREAKFAST SET SPACEBOY,2,2011-01-06 16:12:00,9.95,12413.0
540365,22273,FELTCRAFT DOLL MOLLY,6,2011-01-06 16:12:00,2.95,12413.0
540365,22750,FELTCRAFT PRINCESS LOLA DOLL,4,2011-01-06 16:12:00,3.75,12413.0
540365,20679,EDWARDIAN PARASOL RED,3,2011-01-06 16:12:00,5.95,12413.0
540365,85014A,BLACK/BLUE POLKADOT UMBRELLA,3,2011-01-06 16:12:00,5.95,12413.0
540365,20750,RED RETROSPOT MINI CASES,6,2011-01-06 16:12:00,7.95,12413.0
540365,85099B,JUMBO BAG RED RETROSPOT,10,2011-01-06 16:12:00,1.95,12413.0
540365,21039,RED RETROSPOT SHOPPING BAG,6,2011-01-06 16:12:00,2.55,12413.0
540365,22356,CHARLOTTE BAG PINK POLKADOT,10,2011-01-06 16:12:00,0.85,12413.0
540365,20724,RED RETROSPOT CHARLOTTE BAG,10,2011-01-06 16:12:00,0.85,12413.0
540365,22504,CABIN BAG VINTAGE RETROSPOT,1,2011-01-06 16:12:00,29.95,12413.0
540365,POST,POSTAGE,3,2011-01-06 16:12:00,18.0,12413.0
C540367,POST,POSTAGE,-3,2011-01-06 16:17:00,18.0,12413.0
540455,21086,SET/6 RED SPOTTY PAPER CUPS,12,2011-01-07 12:07:00,0.65,12583.0
540455,21080,SET/20 RED RETROSPOT PAPER NAPKINS,12,2011-01-07 12:07:00,0.85,12583.0
540455,22726,ALARM CLOCK BAKELIKE GREEN,16,2011-01-07 12:07:00,3.75,12583.0
540455,22727,ALARM CLOCK BAKELIKE RED,12,2011-01-07 12:07:00,3.75,12583.0
540455,22728,ALARM CLOCK BAKELIKE PINK,12,2011-01-07 12:07:00,3.75,12583.0
540455,22729,ALARM CLOCK BAKELIKE ORANGE,12,2011-01-07 12:07:00,3.75,12583.0
540455,21121,SET/10 RED POLKADOT PARTY CANDLES,24,2011-01-07 12:07:00,1.25,12583.0
540455,22326,ROUND SNACK BOXES SET OF4 WOODLAND,18,2011-01-07 12:07:00,2.95,12583.0
540455,20750,RED RETROSPOT MINI CASES,4,2011-01-07 12:07:00,7.95,12583.0
540455,22551,PLASTERS IN TIN SPACEBOY,24,2011-01-07 12:07:00,1.65,12583.0
540455,22556,PLASTERS IN TIN CIRCUS PARADE,24,2011-01-07 12:07:00,1.65,12583.0
540455,22555,PLASTERS IN TIN STRONGMAN,24,2011-01-07 12:07:00,1.65,12583.0
540455,21731,RED TOADSTOOL LED NIGHT LIGHT,12,2011-01-07 12:07:00,1.65,12583.0
540455,22390,PAPERWEIGHT CHILDHOOD MEMORIES,60,2011-01-07 12:07:00,0.85,12583.0
540455,22333,RETROSPOT PARTY BAG + STICKER SET,16,2011-01-07 12:07:00,1.65,12583.0
540455,22331,WOODLAND PARTY BAG + STICKER SET,16,2011-01-07 12:07:00,1.65,12583.0
540455,20719,WOODLAND CHARLOTTE BAG,20,2011-01-07 12:07:00,0.85,12583.0
540455,21883,STARS GIFT TAPE,144,2011-01-07 12:07:00,0.19,12583.0
540455,21042,RED RETROSPOT APRON,6,2011-01-07 12:07:00,5.95,12583.0
540455,22367,CHILDRENS APRON SPACEBOY DESIGN,8,2011-01-07 12:07:00,1.95,12583.0
540455,21094,SET/6 RED SPOTTY PAPER PLATES,12,2011-01-07 12:07:00,0.85,12583.0
540455,POST,POSTAGE,3,2011-01-07 12:07:00,18.0,12583.0
540463,POST,POSTAGE,2,2011-01-07 13:13:00,18.0,12489.0
540463,22556,PLASTERS IN TIN CIRCUS PARADE,12,2011-01-07 13:13:00,1.65,12489.0
540463,84375,SET OF 20 KIDS COOKIE CUTTERS,12,2011-01-07 13:13:00,2.1,12489.0
540463,22138,BAKING SET 9 PIECE RETROSPOT,3,2011-01-07 13:13:00,4.95,12489.0
540463,22467,GUMBALL COAT RACK,12,2011-01-07 13:13:00,2.55,12489.0
540463,22090,PAPER BUNTING RETROSPOT,6,2011-01-07 13:13:00,2.95,12489.0
540463,22606,WOODEN SKITTLES GARDEN SET,2,2011-01-07 13:13:00,15.95,12489.0
540463,21578,WOODLAND DESIGN  COTTON TOTE BAG,6,2011-01-07 13:13:00,2.25,12489.0
540463,22449,SILK PURSE BABUSHKA PINK,6,2011-01-07 13:13:00,3.35,12489.0
540463,20750,RED RETROSPOT MINI CASES,2,2011-01-07 13:13:00,7.95,12489.0
540463,85206A,CREAM FELT EASTER EGG BASKET,6,2011-01-07 13:13:00,1.65,12489.0
540463,21843,RED RETROSPOT CAKE STAND,3,2011-01-07 13:13:00,10.95,12489.0
540463,22139,RETROSPOT TEA SET CERAMIC 11 PC,6,2011-01-07 13:13:00,4.95,12489.0
540463,21054,NURSE'S BAG SOFT TOY,3,2011-01-07 13:13:00,8.95,12489.0
540463,22027,TEA PARTY BIRTHDAY CARD,24,2011-01-07 13:13:00,0.42,12489.0
540521,21881,CUTE CATS TAPE,12,2011-01-09 12:46:00,0.65,12651.0
540521,21883,STARS GIFT TAPE,12,2011-01-09 12:46:00,0.65,12651.0
540521,79191B,RETRO PLASTIC POLKA TRAY,12,2011-01-09 12:46:00,0.85,12651.0
540521,22138,BAKING SET 9 PIECE RETROSPOT,3,2011-01-09 12:46:00,4.95,12651.0
540521,21080,SET/20 RED RETROSPOT PAPER NAPKINS,12,2011-01-09 12:46:00,0.85,12651.0
540521,22892,SET OF SALT AND PEPPER TOADSTOOLS,12,2011-01-09 12:46:00,1.25,12651.0
540521,21398,RED POLKADOT COFFEE  MUG,6,2011-01-09 12:46:00,2.1,12651.0
540521,21035,SET/2 RED RETROSPOT TEA TOWELS,6,2011-01-09 12:46:00,2.95,12651.0
540521,15056BL,EDWARDIAN PARASOL BLACK,3,2011-01-09 12:46:00,5.95,12651.0
540642,85169B,BLACK LOVE BIRD CANDLE,12,2011-01-10 13:22:00,1.25,12681.0
540642,21877,HOME SWEET HOME MUG,12,2011-01-10 13:22:00,1.25,12681.0
540642,22423,REGENCY CAKESTAND 3 TIER,1,2011-01-10 13:22:00,12.75,12681.0
540642,21428,SET3 BOOK BOX GREEN GINGHAM FLOWER,4,2011-01-10 13:22:00,4.25,12681.0
540642,21430,SET/3 RED GINGHAM ROSE STORAGE BOX,4,2011-01-10 13:22:00,3.75,12681.0
540642,22555,PLASTERS IN TIN STRONGMAN,12,2011-01-10 13:22:00,1.65,12681.0
540642,22385,JUMBO BAG SPACEBOY DESIGN,10,2011-01-10 13:22:00,1.95,12681.0
540642,85099B,JUMBO BAG RED RETROSPOT,10,2011-01-10 13:22:00,1.95,12681.0
540642,22432,WATERING CAN PINK BUNNY,6,2011-01-10 13:22:00,1.95,12681.0
540642,85049C,ROMANTIC PINKS RIBBONS,12,2011-01-10 13:22:00,1.25,12681.0
540642,85049D,BRIGHT BLUES RIBBONS,12,2011-01-10 13:22:00,1.25,12681.0
540642,85049G,CHOCOLATE BOX RIBBONS,12,2011-01-10 13:22:00,1.25,12681.0
540642,22725,ALARM CLOCK BAKELIKE CHOCOLATE,8,2011-01-10 13:22:00,3.75,12681.0
540642,22726,ALARM CLOCK BAKELIKE GREEN,8,2011-01-10 13:22:00,3.75,12681.0
540642,22727,ALARM CLOCK BAKELIKE RED,8,2011-01-10 13:22:00,3.75,12681.0
540642,22728,ALARM CLOCK BAKELIKE PINK,8,2011-01-10 13:22:00,3.75,12681.0
540642,22729,ALARM CLOCK BAKELIKE ORANGE,8,2011-01-10 13:22:00,3.75,12681.0
540642,22730,ALARM CLOCK BAKELIKE IVORY,8,2011-01-10 13:22:00,3.75,12681.0
540642,20750,RED RETROSPOT MINI CASES,2,2011-01-10 13:22:00,7.95,12681.0
540642,16236,KITTY PENCIL ERASERS,28,2011-01-10 13:22:00,0.21,12681.0
540642,16238,PARTY TIME PENCIL ERASERS,28,2011-01-10 13:22:00,0.21,12681.0
540642,16237,SLEEPING CAT ERASERS,30,2011-01-10 13:22:00,0.21,12681.0
540642,21675,BUTTERFLIES STICKERS,12,2011-01-10 13:22:00,0.85,12681.0
540642,21731,RED TOADSTOOL LED NIGHT LIGHT,12,2011-01-10 13:22:00,1.65,12681.0
540642,22466,FAIRY TALE COTTAGE NIGHTLIGHT,12,2011-01-10 13:22:00,1.95,12681.0
540642,22139,RETROSPOT TEA SET CERAMIC 11 PC,3,2011-01-10 13:22:00,4.95,12681.0
540642,21429,RED GINGHAM ROSE JEWELLERY BOX,8,2011-01-10 13:22:00,1.65,12681.0
540642,22781,GUMBALL MAGAZINE RACK,6,2011-01-10 13:22:00,7.65,12681.0
540642,22467,GUMBALL COAT RACK,12,2011-01-10 13:22:00,2.55,12681.0
540642,22551,PLASTERS IN TIN SPACEBOY,24,2011-01-10 13:22:00,1.65,12681.0
540642,22553,PLASTERS IN TIN SKULLS,12,2011-01-10 13:22:00,1.65,12681.0
540642,22554,PLASTERS IN TIN WOODLAND ANIMALS,24,2011-01-10 13:22:00,1.65,12681.0
540642,22556,PLASTERS IN TIN CIRCUS PARADE,12,2011-01-10 13:22:00,1.65,12681.0
540642,22988,SOLDIERS EGG CUP,24,2011-01-10 13:22:00,1.25,12681.0
540642,22972,CHILDREN'S SPACEBOY MUG,24,2011-01-10 13:22:00,1.65,12681.0
540642,22973,CHILDREN'S CIRCUS PARADE MUG,24,2011-01-10 13:22:00,1.65,12681.0
540642,22974,CHILDRENS DOLLY GIRL MUG,24,2011-01-10 13:22:00,1.65,12681.0
540642,22977,DOLLY GIRL CHILDRENS EGG CUP,24,2011-01-10 13:22:00,1.25,12681.0
540642,22976,CIRCUS PARADE CHILDRENS EGG CUP,24,2011-01-10 13:22:00,1.25,12681.0
540642,22975,SPACEBOY CHILDRENS EGG CUP,24,2011-01-10 13:22:00,1.25,12681.0
540642,22661,CHARLOTTE BAG DOLLY GIRL DESIGN,10,2011-01-10 13:22:00,0.85,12681.0
540642,47566,PARTY BUNTING,5,2011-01-10 13:22:00,4.65,12681.0
540642,22669,RED BABY BUNTING,5,2011-01-10 13:22:00,2.95,12681.0
540642,21559,STRAWBERRY LUNCH BOX WITH CUTLERY,6,2011-01-10 13:22:00,2.55,12681.0
540642,21561,DINOSAUR LUNCH BOX WITH CUTLERY,12,2011-01-10 13:22:00,2.55,12681.0
540642,22631,CIRCUS PARADE LUNCH BOX,12,2011-01-10 13:22:00,1.95,12681.0
540642,22629,SPACEBOY LUNCH BOX,24,2011-01-10 13:22:00,1.95,12681.0
540642,22138,BAKING SET 9 PIECE RETROSPOT,3,2011-01-10 13:22:00,4.95,12681.0
540642,22617,BAKING SET SPACEBOY DESIGN,3,2011-01-10 13:22:00,4.95,12681.0
540642,POST,POSTAGE,7,2011-01-10 13:22:00,18.0,12681.0
540688,POST,POSTAGE,5,2011-01-11 07:57:00,18.0,12736.0
540688,22223,CAKE PLATE LOVEBIRD PINK,24,2011-01-11 07:57:00,1.95,12736.0
540688,22222,CAKE PLATE LOVEBIRD WHITE,24,2011-01-11 07:57:00,1.95,12736.0
540688,21212,PACK OF 72 RETROSPOT CAKE CASES,120,2011-01-11 07:57:00,0.42,12736.0
540789,POST,POSTAGE,2,2011-01-11 11:48:00,18.0,12643.0
540789,21381,MINI WOODEN HAPPY BIRTHDAY GARLAND,576,2011-01-11 11:48:00,1.45,12643.0
540824,21108,FAIRY CAKE FLANNEL ASSORTED COLOUR,9,2011-01-11 13:31:00,2.55,12728.0
540824,21208,PASTEL COLOUR HONEYCOMB FAN,12,2011-01-11 13:31:00,1.65,12728.0
540824,21355,TOAST ITS - I LOVE YOU,12,2011-01-11 13:31:00,1.25,12728.0
540824,21731,RED TOADSTOOL LED NIGHT LIGHT,12,2011-01-11 13:31:00,1.65,12728.0
540824,22027,TEA PARTY BIRTHDAY CARD,12,2011-01-11 13:31:00,0.42,12728.0
540824,22311,OFFICE MUG WARMER BLACK+SILVER,6,2011-01-11 13:31:00,2.95,12728.0
540824,22423,REGENCY CAKESTAND 3 TIER,1,2011-01-11 13:31:00,12.75,12728.0
540824,22443,GROW YOUR OWN HERBS SET OF 3,2,2011-01-11 13:31:00,7.95,12728.0
540824,22556,PLASTERS IN TIN CIRCUS PARADE,24,2011-01-11 13:31:00,1.65,12728.0
540824,22746,POPPY'S PLAYHOUSE LIVINGROOM,6,2011-01-11 13:31:00,2.1,12728.0
540824,79191B,RETRO PLASTIC POLKA TRAY,12,2011-01-11 13:31:00,0.85,12728.0
540824,84375,SET OF 20 KIDS COOKIE CUTTERS,12,2011-01-11 13:31:00,2.1,12728.0
540824,POST,POSTAGE,2,2011-01-11 13:31:00,18.0,12728.0
540835,22355,CHARLOTTE BAG SUKI DESIGN,10,2011-01-11 15:00:00,0.85,12724.0
540835,22661,CHARLOTTE BAG DOLLY GIRL DESIGN,10,2011-01-11 15:00:00,0.85,12724.0
540835,20719,WOODLAND CHARLOTTE BAG,10,2011-01-11 15:00:00,0.85,12724.0
540835,20723,STRAWBERRY CHARLOTTE BAG,10,2011-01-11 15:00:00,0.85,12724.0
540835,20726,LUNCH BAG WOODLAND,10,2011-01-11 15:00:00,1.65,12724.0
540835,20725,LUNCH BAG RED RETROSPOT,10,2011-01-11 15:00:00,1.65,12724.0
540835,22662,LUNCH BAG DOLLY GIRL DESIGN,10,2011-01-11 15:00:00,1.65,12724.0
540835,22382,LUNCH BAG SPACEBOY DESIGN,10,2011-01-11 15:00:00,1.65,12724.0
540835,22383,LUNCH BAG SUKI  DESIGN,10,2011-01-11 15:00:00,1.65,12724.0
540835,22418,10 COLOUR SPACEBOY PEN,24,2011-01-11 15:00:00,0.85,12724.0
540835,POST,POSTAGE,1,2011-01-11 15:00:00,18.0,12724.0
540851,21361,LOVE LARGE WOOD LETTERS,1,2011-01-12 09:43:00,12.75,12523.0
540851,22222,CAKE PLATE LOVEBIRD WHITE,3,2011-01-12 09:43:00,4.95,12523.0
540851,21210,SET OF 72 RETROSPOT PAPER  DOILIES,12,2011-01-12 09:43:00,1.45,12523.0
