540851,22215,CAKE STAND WHITE TWO TIER LACE,2,2011-01-12 09:43:00,8.5,12523.0
540851,21843,RED RETROSPOT CAKE STAND,1,2011-01-12 09:43:00,10.95,12523.0
540851,21232,STRAWBERRY CERAMIC TRINKET BOX,12,2011-01-12 09:43:00,1.25,12523.0
540851,21231,SWEETHEART CERAMIC TRINKET BOX,12,2011-01-12 09:43:00,1.25,12523.0
C540853,22634,CHILDS BREAKFAST SET SPACEBOY,-1,2011-01-12 09:52:00,9.95,12413.0
540972,22236,CAKE STAND 3 TIER MAGIC GARDEN,12,2011-01-12 14:13:00,10.95,12437.0
540972,21988,PACK OF 6 SKULL PAPER PLATES,48,2011-01-12 14:13:00,0.85,12437.0
540972,21987,PACK OF 6 SKULL PAPER CUPS,36,2011-01-12 14:13:00,0.65,12437.0
540972,21122,SET/10 PINK POLKADOT PARTY CANDLES,24,2011-01-12 14:13:00,1.25,12437.0
540972,21843,RED RETROSPOT CAKE STAND,8,2011-01-12 14:13:00,10.95,12437.0
540972,POST,POSTAGE,3,2011-01-12 14:13:00,18.0,12437.0
540972,22215,CAKE STAND WHITE TWO TIER LACE,3,2011-01-12 14:13:00,8.5,12437.0
540976,22394,PAPERWEIGHT KINGS CHOICE,12,2011-01-12 15:00:00,0.85,12652.0
540976,21890,S/6 WOODEN SKITTLES IN COTTON BAG,6,2011-01-12 15:00:00,2.95,12652.0
540976,22915,ASSORTED BOTTLE TOP  MAGNETS,24,2011-01-12 15:00:00,0.42,12652.0
540976,22970,LONDON BUS COFFEE MUG,6,2011-01-12 15:00:00,2.55,12652.0
540976,21111,"SWISS ROLL TOWEL, CHOCOLATE  SPOTS",6,2011-01-12 15:00:00,2.95,12652.0
540976,84817,DANISH ROSE DECORATIVE PLATE,24,2011-01-12 15:00:00,0.42,12652.0
540976,85016,SET OF 6 VINTAGE NOTELETS KIT,6,2011-01-12 15:00:00,2.55,12652.0
540976,22659,LUNCH BOX I LOVE LONDON,12,2011-01-12 15:00:00,1.95,12652.0
540976,21622,VINTAGE UNION JACK CUSHION COVER,4,2011-01-12 15:00:00,4.95,12652.0
540976,22091,EMPIRE TISSUE BOX,12,2011-01-12 15:00:00,1.25,12652.0
540976,22951,60 CAKE CASES DOLLY GIRL DESIGN,24,2011-01-12 15:00:00,0.55,12652.0
540976,22554,PLASTERS IN TIN WOODLAND ANIMALS,12,2011-01-12 15:00:00,1.65,12652.0
540976,22605,WOODEN CROQUET GARDEN SET,2,2011-01-12 15:00:00,14.95,12652.0
540976,21955,DOORMAT UNION JACK GUNS AND ROSES,2,2011-01-12 15:00:00,7.95,12652.0
540976,22900,SET 2 TEA TOWELS I LOVE LONDON,6,2011-01-12 15:00:00,2.95,12652.0
540976,82582,AREA PATROLLED METAL SIGN,12,2011-01-12 15:00:00,2.1,12652.0
540976,22412,METAL SIGN NEIGHBOURHOOD WITCH,12,2011-01-12 15:00:00,2.1,12652.0
540976,22115,METAL SIGN EMPIRE TEA,6,2011-01-12 15:00:00,2.95,12652.0
540976,22413,METAL SIGN TAKE IT OR LEAVE IT,6,2011-01-12 15:00:00,2.95,12652.0
540976,21164,HOME SWEET HOME METAL SIGN,6,2011-01-12 15:00:00,2.95,12652.0
540976,48138,DOORMAT UNION FLAG,2,2011-01-12 15:00:00,7.95,12652.0
540976,22922,FRIDGE MAGNETS US DINER ASSORTED,12,2011-01-12 15:00:00,0.85,12652.0
540976,22399,MAGNETS PACK OF 4 CHILDHOOD MEMORY,12,2011-01-12 15:00:00,1.25,12652.0
540976,22398,MAGNETS PACK OF 4 SWALLOWS,12,2011-01-12 15:00:00,1.25,12652.0
540976,21917,SET 12 KIDS  WHITE CHALK STICKS,24,2011-01-12 15:00:00,0.42,12652.0
540976,22662,LUNCH BAG DOLLY GIRL DESIGN,10,2011-01-12 15:00:00,1.65,12652.0
540976,20719,WOODLAND CHARLOTTE BAG,10,2011-01-12 15:00:00,0.85,12652.0
540976,21452,TOADSTOOL MONEY BOX,6,2011-01-12 15:00:00,2.95,12652.0
540976,20724,RED RETROSPOT CHARLOTTE BAG,10,2011-01-12 15:00:00,0.85,12652.0
540976,20914,SET/5 RED RETROSPOT LID GLASS BOWLS,6,2011-01-12 15:00:00,2.95,12652.0
540976,22138,BAKING SET 9 PIECE RETROSPOT,3,2011-01-12 15:00:00,4.95,12652.0
540976,22139,RETROSPOT TEA SET CERAMIC 11 PC,3,2011-01-12 15:00:00,4.95,12652.0
540976,22856,ASSORTED EASTER DECORATIONS  BELLS,12,2011-01-12 15:00:00,1.25,12652.0
540976,22207,FRYING PAN UNION FLAG,4,2011-01-12 15:00:00,4.25,12652.0
540976,84029G,KNITTED UNION FLAG HOT WATER BOTTLE,4,2011-01-12 15:00:00,3.75,12652.0
540976,22551,PLASTERS IN TIN SPACEBOY,12,2011-01-12 15:00:00,1.65,12652.0
540976,22358,KINGS CHOICE TEA CADDY,6,2011-01-12 15:00:00,2.95,12652.0
540976,22557,PLASTERS IN TIN VINTAGE PAISLEY,12,2011-01-12 15:00:00,1.65,12652.0
540976,21212,PACK OF 72 RETROSPOT CAKE CASES,24,2011-01-12 15:00:00,0.55,12652.0
540976,21731,RED TOADSTOOL LED NIGHT LIGHT,12,2011-01-12 15:00:00,1.65,12652.0
540976,21875,KINGS CHOICE MUG,12,2011-01-12 15:00:00,1.25,12652.0
540976,21908,CHOCOLATE THIS WAY METAL SIGN,12,2011-01-12 15:00:00,2.1,12652.0
540976,21877,HOME SWEET HOME MUG,12,2011-01-12 15:00:00,1.25,12652.0
540976,22406,MONEY BOX KINGS CHOICE DESIGN,12,2011-01-12 15:00:00,1.25,12652.0
540976,85015,SET OF 12  VINTAGE POSTCARD SET,6,2011-01-12 15:00:00,2.55,12652.0
540976,84821,DANISH ROSE DELUXE COASTER,24,2011-01-12 15:00:00,0.21,12652.0
540976,21110,LARGE CAKE TOWEL PINK SPOTS,24,2011-01-12 15:00:00,1.95,12652.0
540976,POST,POSTAGE,7,2011-01-12 15:00:00,18.0,12652.0
541120,21195,PINK  HONEYCOMB PAPER BALL,48,2011-01-14 09:13:00,0.65,12490.0
541120,21880,RED RETROSPOT TAPE,24,2011-01-14 09:13:00,0.19,12490.0
541120,21881,CUTE CATS TAPE,24,2011-01-14 09:13:00,0.19,12490.0
541120,22377,BOTTLE BAG RETROSPOT,20,2011-01-14 09:13:00,0.85,12490.0
541120,84356,POMPOM CURTAIN,12,2011-01-14 09:13:00,1.95,12490.0
541120,22971,QUEENS GUARD COFFEE MUG,24,2011-01-14 09:13:00,2.55,12490.0
541120,22898,CHILDRENS APRON APPLES DESIGN,8,2011-01-14 09:13:00,1.95,12490.0
541120,22303,COFFEE MUG APPLES DESIGN,12,2011-01-14 09:13:00,2.55,12490.0
541120,22894,TABLECLOTH RED APPLES DESIGN,4,2011-01-14 09:13:00,8.5,12490.0
541120,22895,SET OF 2 TEA TOWELS APPLE AND PEARS,6,2011-01-14 09:13:00,2.95,12490.0
541120,22302,COFFEE MUG PEARS  DESIGN,6,2011-01-14 09:13:00,2.55,12490.0
541120,22908,PACK OF 20 NAPKINS RED APPLES,12,2011-01-14 09:13:00,0.85,12490.0
541120,22352,LUNCH BOX WITH CUTLERY RETROSPOT,6,2011-01-14 09:13:00,2.55,12490.0
541120,21976,PACK OF 60 MUSHROOM CAKE CASES,24,2011-01-14 09:13:00,0.55,12490.0
541120,22938,CUPCAKE LACE PAPER SET 6,12,2011-01-14 09:13:00,1.95,12490.0
541120,22970,LONDON BUS COFFEE MUG,6,2011-01-14 09:13:00,2.55,12490.0
541120,22988,SOLDIERS EGG CUP,12,2011-01-14 09:13:00,1.25,12490.0
541120,22976,CIRCUS PARADE CHILDRENS EGG CUP,12,2011-01-14 09:13:00,1.25,12490.0
541120,22659,LUNCH BOX I LOVE LONDON,12,2011-01-14 09:13:00,1.95,12490.0
541120,22966,GINGERBREAD MAN COOKIE CUTTER,12,2011-01-14 09:13:00,1.25,12490.0
541120,22964,3 PIECE SPACEBOY COOKIE CUTTER SET,6,2011-01-14 09:13:00,2.1,12490.0
541120,84378,SET OF 3 HEART COOKIE CUTTERS,12,2011-01-14 09:13:00,1.25,12490.0
541120,20975,12 PENCILS SMALL TUBE RED RETROSPOT,24,2011-01-14 09:13:00,0.65,12490.0
541120,20750,RED RETROSPOT MINI CASES,4,2011-01-14 09:13:00,7.95,12490.0
541120,22090,PAPER BUNTING RETROSPOT,12,2011-01-14 09:13:00,2.95,12490.0
541120,20724,RED RETROSPOT CHARLOTTE BAG,10,2011-01-14 09:13:00,0.85,12490.0
541120,22356,CHARLOTTE BAG PINK POLKADOT,10,2011-01-14 09:13:00,0.85,12490.0
541120,85099B,JUMBO BAG RED RETROSPOT,10,2011-01-14 09:13:00,1.95,12490.0
541120,21080,SET/20 RED RETROSPOT PAPER NAPKINS,12,2011-01-14 09:13:00,0.85,12490.0
541120,21238,RED RETROSPOT CUP,8,2011-01-14 09:13:00,0.85,12490.0
541120,20725,LUNCH BAG RED RETROSPOT,10,2011-01-14 09:13:00,1.65,12490.0
541120,22704,WRAP RED APPLES,25,2011-01-14 09:13:00,0.42,12490.0
541120,22585,PACK OF 6 BIRDY GIFT TAGS,12,2011-01-14 09:13:00,1.25,12490.0
541120,22619,SET OF 6 SOLDIER SKITTLES,4,2011-01-14 09:13:00,3.75,12490.0
541120,21915,RED  HARMONICA IN BOX,12,2011-01-14 09:13:00,1.25,12490.0
541120,22631,CIRCUS PARADE LUNCH BOX,12,2011-01-14 09:13:00,1.95,12490.0
541120,22556,PLASTERS IN TIN CIRCUS PARADE,12,2011-01-14 09:13:00,1.65,12490.0
541120,22551,PLASTERS IN TIN SPACEBOY,12,2011-01-14 09:13:00,1.65,12490.0
541120,21156,RETROSPOT CHILDRENS APRON,8,2011-01-14 09:13:00,1.95,12490.0
541120,21731,RED TOADSTOOL LED NIGHT LIGHT,12,2011-01-14 09:13:00,1.65,12490.0
541120,22385,JUMBO BAG SPACEBOY DESIGN,10,2011-01-14 09:13:00,1.95,12490.0
541120,20711,JUMBO BAG TOYS,10,2011-01-14 09:13:00,1.95,12490.0
541120,POST,POSTAGE,5,2011-01-14 09:13:00,18.0,12490.0
541121,85099B,JUMBO BAG RED RETROSPOT,10,2011-01-14 09:20:00,1.95,12672.0
541121,21039,RED RETROSPOT SHOPPING BAG,6,2011-01-14 09:20:00,2.55,12672.0
541121,20679,EDWARDIAN PARASOL RED,3,2011-01-14 09:20:00,5.95,12672.0
541121,21700,BIG DOUGHNUT FRIDGE MAGNETS,12,2011-01-14 09:20:00,0.85,12672.0
541121,22668,PINK BABY BUNTING,15,2011-01-14 09:20:00,2.95,12672.0
541121,22588,CARD HOLDER GINGHAM HEART,6,2011-01-14 09:20:00,2.55,12672.0
541121,20750,RED RETROSPOT MINI CASES,6,2011-01-14 09:20:00,7.95,12672.0
541121,20749,ASSORTED COLOUR MINI CASES,2,2011-01-14 09:20:00,7.95,12672.0
541121,21218,RED SPOTTY BISCUIT TIN,6,2011-01-14 09:20:00,3.75,12672.0
541121,22645,CERAMIC HEART FAIRY CAKE MONEY BANK,12,2011-01-14 09:20:00,1.45,12672.0
541138,20682,RED RETROSPOT CHILDRENS UMBRELLA,6,2011-01-14 10:42:00,3.25,12553.0
541138,22355,CHARLOTTE BAG SUKI DESIGN,20,2011-01-14 10:42:00,0.85,12553.0
541138,21931,JUMBO STORAGE BAG SUKI,10,2011-01-14 10:42:00,1.95,12553.0
541138,85099B,JUMBO BAG RED RETROSPOT,10,2011-01-14 10:42:00,1.95,12553.0
541138,22385,JUMBO BAG SPACEBOY DESIGN,10,2011-01-14 10:42:00,1.95,12553.0
541138,20712,JUMBO BAG WOODLAND ANIMALS,10,2011-01-14 10:42:00,1.95,12553.0
541138,20866,BLUE ROSE FABRIC MIRROR,12,2011-01-14 10:42:00,1.25,12553.0
541138,22742,MAKE YOUR OWN PLAYTIME CARD KIT,6,2011-01-14 10:42:00,2.95,12553.0
541138,20725,LUNCH BAG RED RETROSPOT,10,2011-01-14 10:42:00,1.65,12553.0
541138,79191C,RETRO PLASTIC ELEPHANT TRAY,12,2011-01-14 10:42:00,0.85,12553.0
541138,79190B,RETRO PLASTIC POLKA TRAY,15,2011-01-14 10:42:00,0.42,12553.0
541138,22554,PLASTERS IN TIN WOODLAND ANIMALS,12,2011-01-14 10:42:00,1.65,12553.0
541138,22556,PLASTERS IN TIN CIRCUS PARADE,12,2011-01-14 10:42:00,1.65,12553.0
541138,22553,PLASTERS IN TIN SKULLS,12,2011-01-14 10:42:00,1.65,12553.0
541138,22029,SPACEBOY BIRTHDAY CARD,12,2011-01-14 10:42:00,0.42,12553.0
541138,20973,12 PENCIL SMALL TUBE WOODLAND,24,2011-01-14 10:42:00,0.65,12553.0
541138,22418,10 COLOUR SPACEBOY PEN,24,2011-01-14 10:42:00,0.85,12553.0
541138,51014L,"FEATHER PEN,LIGHT PINK",12,2011-01-14 10:42:00,0.85,12553.0
541138,21880,RED RETROSPOT TAPE,12,2011-01-14 10:42:00,0.65,12553.0
541138,21429,RED GINGHAM ROSE JEWELLERY BOX,8,2011-01-14 10:42:00,1.65,12553.0
541138,22646,CERAMIC STRAWBERRY CAKE MONEY BANK,12,2011-01-14 10:42:00,1.45,12553.0
541138,22747,POPPY'S PLAYHOUSE BATHROOM,6,2011-01-14 10:42:00,2.1,12553.0
541138,22748,POPPY'S PLAYHOUSE KITCHEN,6,2011-01-14 10:42:00,2.1,12553.0
541138,22745,POPPY'S PLAYHOUSE BEDROOM,6,2011-01-14 10:42:00,2.1,12553.0
541138,22569,FELTCRAFT CUSHION BUTTERFLY,4,2011-01-14 10:42:00,3.75,12553.0
541138,20972,PINK CREAM FELT CRAFT TRINKET BOX,12,2011-01-14 10:42:00,1.25,12553.0
541138,22750,FELTCRAFT PRINCESS LOLA DOLL,4,2011-01-14 10:42:00,3.75,12553.0
541138,22274,FELTCRAFT DOLL EMILY,6,2011-01-14 10:42:00,2.95,12553.0
541138,22492,MINI PAINT SET VINTAGE,36,2011-01-14 10:42:00,0.65,12553.0
541138,22138,BAKING SET 9 PIECE RETROSPOT,3,2011-01-14 10:42:00,4.95,12553.0
541138,84997D,PINK 3 PIECE POLKADOT CUTLERY SET,6,2011-01-14 10:42:00,3.75,12553.0
541138,84997C,BLUE 3 PIECE POLKADOT CUTLERY SET,6,2011-01-14 10:42:00,3.75,12553.0
541138,84077,WORLD WAR 2 GLIDERS ASSTD DESIGNS,48,2011-01-14 10:42:00,0.29,12553.0
541138,21731,RED TOADSTOOL LED NIGHT LIGHT,12,2011-01-14 10:42:00,1.65,12553.0
541138,22565,FELTCRAFT HAIRBANDS PINK AND WHITE,12,2011-01-14 10:42:00,0.85,12553.0
541138,21365,MIRRORED WALL ART STARS,6,2011-01-14 10:42:00,2.95,12553.0
541138,21249,WOODLAND  HEIGHT CHART STICKERS,6,2011-01-14 10:42:00,2.95,12553.0
541138,POST,POSTAGE,6,2011-01-14 10:42:00,18.0,12553.0
541405,22636,CHILDS BREAKFAST SET CIRCUS PARADE,8,2011-01-17 15:17:00,7.65,12683.0
541405,84375,SET OF 20 KIDS COOKIE CUTTERS,12,2011-01-17 15:17:00,2.1,12683.0
541405,22897,OVEN MITT APPLES DESIGN,10,2011-01-17 15:17:00,1.45,12683.0
541405,21035,SET/2 RED RETROSPOT TEA TOWELS,6,2011-01-17 15:17:00,2.95,12683.0
541405,22895,SET OF 2 TEA TOWELS APPLE AND PEARS,12,2011-01-17 15:17:00,2.95,12683.0
541405,84692,BOX OF 24 COCKTAIL PARASOLS,25,2011-01-17 15:17:00,0.42,12683.0
541405,22629,SPACEBOY LUNCH BOX,12,2011-01-17 15:17:00,1.95,12683.0
541405,22704,WRAP RED APPLES,25,2011-01-17 15:17:00,0.42,12683.0
541405,22302,COFFEE MUG PEARS  DESIGN,12,2011-01-17 15:17:00,2.55,12683.0
541405,22303,COFFEE MUG APPLES DESIGN,12,2011-01-17 15:17:00,2.55,12683.0
541405,20963,APPLE BATH SPONGE,10,2011-01-17 15:17:00,1.25,12683.0
541405,22705,WRAP GREEN PEARS,25,2011-01-17 15:17:00,0.42,12683.0
541405,22631,CIRCUS PARADE LUNCH BOX,12,2011-01-17 15:17:00,1.95,12683.0
541405,20966,SANDWICH BATH SPONGE,10,2011-01-17 15:17:00,1.25,12683.0
541405,22037,ROBOT BIRTHDAY CARD,12,2011-01-17 15:17:00,0.42,12683.0
541405,21058,PARTY INVITES WOODLAND,12,2011-01-17 15:17:00,0.85,12683.0
541405,21721,CANDY SHOP  STICKER SHEET,12,2011-01-17 15:17:00,0.85,12683.0
541405,22423,REGENCY CAKESTAND 3 TIER,16,2011-01-17 15:17:00,10.95,12683.0
541405,21843,RED RETROSPOT CAKE STAND,8,2011-01-17 15:17:00,10.95,12683.0
541405,POST,POSTAGE,5,2011-01-17 15:17:00,18.0,12683.0
541405,22328,ROUND SNACK BOXES SET OF 4 FRUITS,12,2011-01-17 15:17:00,2.95,12683.0
541567,22435,SET OF 9 HEART SHAPED BALLOONS,12,2011-01-19 11:51:00,1.25,12681.0
541567,22437,SET OF 9 BLACK SKULL BALLOONS,20,2011-01-19 11:51:00,0.85,12681.0
541567,20724,RED RETROSPOT CHARLOTTE BAG,10,2011-01-19 11:51:00,0.85,12681.0
541567,20719,WOODLAND CHARLOTTE BAG,10,2011-01-19 11:51:00,0.85,12681.0
541567,22356,CHARLOTTE BAG PINK POLKADOT,20,2011-01-19 11:51:00,0.85,12681.0
541567,21137,BLACK RECORD COVER FRAME,4,2011-01-19 11:51:00,3.75,12681.0
541567,22904,CALENDAR PAPER CUT DESIGN,18,2011-01-19 11:51:00,2.95,12681.0
541567,22024,RAINY LADIES BIRTHDAY CARD,12,2011-01-19 11:51:00,0.42,12681.0
541567,21238,RED RETROSPOT CUP,8,2011-01-19 11:51:00,0.85,12681.0
541567,22191,IVORY DINER WALL CLOCK,2,2011-01-19 11:51:00,8.5,12681.0
541567,22616,PACK OF 12 LONDON TISSUES,24,2011-01-19 11:51:00,0.29,12681.0
541567,22659,LUNCH BOX I LOVE LONDON,12,2011-01-19 11:51:00,1.95,12681.0
541567,22314,OFFICE MUG WARMER CHOC+BLUE,6,2011-01-19 11:51:00,2.95,12681.0
541567,22312,OFFICE MUG WARMER POLKADOT,18,2011-01-19 11:51:00,2.95,12681.0
541567,22313,OFFICE MUG WARMER PINK,24,2011-01-19 11:51:00,2.95,12681.0
541567,22300,COFFEE MUG DOG + BALL DESIGN,6,2011-01-19 11:51:00,2.55,12681.0
541567,22301,COFFEE MUG CAT + BIRD DESIGN,12,2011-01-19 11:51:00,2.55,12681.0
541567,22894,TABLECLOTH RED APPLES DESIGN,4,2011-01-19 11:51:00,8.5,12681.0
541567,22555,PLASTERS IN TIN STRONGMAN,24,2011-01-19 11:51:00,1.65,12681.0
541567,21706,FOLDING UMBRELLA RED/WHITE POLKADOT,4,2011-01-19 11:51:00,4.95,12681.0
541567,85014B,RED RETROSPOT UMBRELLA,3,2011-01-19 11:51:00,5.95,12681.0
541567,21578,WOODLAND DESIGN  COTTON TOTE BAG,6,2011-01-19 11:51:00,2.25,12681.0
541567,21864,UNION JACK FLAG PASSPORT COVER,12,2011-01-19 11:51:00,2.1,12681.0
541567,22908,PACK OF 20 NAPKINS RED APPLES,24,2011-01-19 11:51:00,0.85,12681.0
541567,22348,TEA BAG PLATE RED RETROSPOT,24,2011-01-19 11:51:00,0.85,12681.0
541567,21719,LOVELY BONBON STICKER SHEET,12,2011-01-19 11:51:00,0.85,12681.0
541567,21544,SKULLS  WATER TRANSFER TATTOOS,12,2011-01-19 11:51:00,0.85,12681.0
541567,22895,SET OF 2 TEA TOWELS APPLE AND PEARS,12,2011-01-19 11:51:00,2.95,12681.0
541567,21731,RED TOADSTOOL LED NIGHT LIGHT,24,2011-01-19 11:51:00,1.65,12681.0
541567,20750,RED RETROSPOT MINI CASES,4,2011-01-19 11:51:00,7.95,12681.0
541567,POST,POSTAGE,3,2011-01-19 11:51:00,18.0,12681.0
541631,22973,CHILDREN'S CIRCUS PARADE MUG,12,2011-01-20 10:47:00,1.65,12637.0
541631,21068,VINTAGE BILLBOARD LOVE/HATE MUG,12,2011-01-20 10:47:00,1.25,12637.0
541631,22303,COFFEE MUG APPLES DESIGN,6,2011-01-20 10:47:00,2.55,12637.0
541631,22974,CHILDRENS DOLLY GIRL MUG,12,2011-01-20 10:47:00,1.65,12637.0
541631,84592,CROCHET ROSE PURSE WITH SUEDE BACK,6,2011-01-20 10:47:00,2.95,12637.0
541631,22362,GLASS JAR PEACOCK BATH SALTS,6,2011-01-20 10:47:00,2.95,12637.0
541631,21121,SET/10 RED POLKADOT PARTY CANDLES,24,2011-01-20 10:47:00,1.25,12637.0
541631,21524,DOORMAT SPOTTY HOME SWEET HOME,2,2011-01-20 10:47:00,7.95,12637.0
541631,48184,DOORMAT ENGLISH ROSE,2,2011-01-20 10:47:00,7.95,12637.0
541631,20685,DOORMAT RED RETROSPOT,2,2011-01-20 10:47:00,7.95,12637.0
541631,22749,FELTCRAFT PRINCESS CHARLOTTE DOLL,4,2011-01-20 10:47:00,3.75,12637.0
541631,22750,FELTCRAFT PRINCESS LOLA DOLL,8,2011-01-20 10:47:00,3.75,12637.0
541631,22751,FELTCRAFT PRINCESS OLIVIA DOLL,4,2011-01-20 10:47:00,3.75,12637.0
541631,22725,ALARM CLOCK BAKELIKE CHOCOLATE,4,2011-01-20 10:47:00,3.75,12637.0
541631,22726,ALARM CLOCK BAKELIKE GREEN,8,2011-01-20 10:47:00,3.75,12637.0
541631,22727,ALARM CLOCK BAKELIKE RED,8,2011-01-20 10:47:00,3.75,12637.0
541631,22728,ALARM CLOCK BAKELIKE PINK,8,2011-01-20 10:47:00,3.75,12637.0
541631,22729,ALARM CLOCK BAKELIKE ORANGE,8,2011-01-20 10:47:00,3.75,12637.0
541631,22242,5 HOOK HANGER MAGIC TOADSTOOL,12,2011-01-20 10:47:00,1.65,12637.0
541631,22244,3 HOOK HANGER MAGIC GARDEN,12,2011-01-20 10:47:00,1.95,12637.0
541631,84927D,LA PALMIERA TILE HOOK,6,2011-01-20 10:47:00,2.1,12637.0
541631,84927E,FLOWERS TILE HOOK,6,2011-01-20 10:47:00,2.1,12637.0
541631,84927F,PSYCHEDELIC TILE HOOK,6,2011-01-20 10:47:00,2.1,12637.0
541631,21195,PINK  HONEYCOMB PAPER BALL,12,2011-01-20 10:47:00,2.1,12637.0
541631,22174,PHOTO CUBE,12,2011-01-20 10:47:00,1.65,12637.0
541631,21756,BATH BUILDING BLOCK WORD,3,2011-01-20 10:47:00,5.95,12637.0
541631,22120,WELCOME  WOODEN BLOCK LETTERS,6,2011-01-20 10:47:00,9.95,12637.0
541631,21754,HOME BUILDING BLOCK WORD,3,2011-01-20 10:48:00,5.95,12637.0
541631,22116,METAL SIGN HIS DINNER IS SERVED,6,2011-01-20 10:48:00,2.95,12637.0
541631,21164,HOME SWEET HOME METAL SIGN,6,2011-01-20 10:48:00,2.95,12637.0
541631,22367,CHILDRENS APRON SPACEBOY DESIGN,8,2011-01-20 10:48:00,1.95,12637.0
541631,21559,STRAWBERRY LUNCH BOX WITH CUTLERY,6,2011-01-20 10:48:00,2.55,12637.0
541631,21558,SKULL LUNCH BOX WITH CUTLERY,6,2011-01-20 10:48:00,2.55,12637.0
541631,22326,ROUND SNACK BOXES SET OF4 WOODLAND,6,2011-01-20 10:48:00,2.95,12637.0
541631,22327,ROUND SNACK BOXES SET OF 4 SKULLS,6,2011-01-20 10:48:00,2.95,12637.0
541631,22352,LUNCH BOX WITH CUTLERY RETROSPOT,6,2011-01-20 10:48:00,2.55,12637.0
541631,22630,DOLLY GIRL LUNCH BOX,12,2011-01-20 10:48:00,1.95,12637.0
541631,22629,SPACEBOY LUNCH BOX,12,2011-01-20 10:48:00,1.95,12637.0
541631,22382,LUNCH BAG SPACEBOY DESIGN,10,2011-01-20 10:48:00,1.65,12637.0
541631,22383,LUNCH BAG SUKI  DESIGN,10,2011-01-20 10:48:00,1.65,12637.0
541631,20726,LUNCH BAG WOODLAND,10,2011-01-20 10:48:00,1.65,12637.0
541631,21987,PACK OF 6 SKULL PAPER CUPS,12,2011-01-20 10:48:00,0.65,12637.0
541631,21086,SET/6 RED SPOTTY PAPER CUPS,12,2011-01-20 10:48:00,0.65,12637.0
541631,22613,PACK OF 20 SPACEBOY NAPKINS,12,2011-01-20 10:48:00,0.85,12637.0
541631,21989,PACK OF 20 SKULL PAPER NAPKINS,12,2011-01-20 10:48:00,0.85,12637.0
541631,21988,PACK OF 6 SKULL PAPER PLATES,12,2011-01-20 10:48:00,0.85,12637.0
541631,21094,SET/6 RED SPOTTY PAPER PLATES,12,2011-01-20 10:48:00,0.85,12637.0
541631,84988,SET OF 72 PINK HEART PAPER DOILIES,12,2011-01-20 10:48:00,1.45,12637.0
541631,22634,CHILDS BREAKFAST SET SPACEBOY,4,2011-01-20 10:48:00,9.95,12637.0
541631,22636,CHILDS BREAKFAST SET CIRCUS PARADE,4,2011-01-20 10:48:00,8.5,12637.0
541631,22468,BABUSHKA LIGHTS STRING OF 10,6,2011-01-20 10:48:00,6.75,12637.0
541631,10002,INFLATABLE POLITICAL GLOBE,12,2011-01-20 10:48:00,0.85,12637.0
541631,22551,PLASTERS IN TIN SPACEBOY,12,2011-01-20 10:48:00,1.65,12637.0
541631,22554,PLASTERS IN TIN WOODLAND ANIMALS,12,2011-01-20 10:48:00,1.65,12637.0
541631,22556,PLASTERS IN TIN CIRCUS PARADE,12,2011-01-20 10:48:00,1.65,12637.0
541631,22555,PLASTERS IN TIN STRONGMAN,12,2011-01-20 10:48:00,1.65,12637.0
541631,21509,COWBOYS AND INDIANS BIRTHDAY CARD,12,2011-01-20 10:48:00,0.42,12637.0
541631,21507,"ELEPHANT, BIRTHDAY CARD,",12,2011-01-20 10:48:00,0.42,12637.0
541631,22029,SPACEBOY BIRTHDAY CARD,12,2011-01-20 10:48:00,0.42,12637.0
541631,22437,SET OF 9 BLACK SKULL BALLOONS,20,2011-01-20 10:48:00,0.85,12637.0
541631,21829,DINOSAUR KEYRINGS ASSORTED,36,2011-01-20 10:48:00,0.21,12637.0
541631,21791,VINTAGE HEADS AND TAILS CARD GAME,24,2011-01-20 10:48:00,1.25,12637.0
541631,21915,RED  HARMONICA IN BOX,24,2011-01-20 10:48:00,1.25,12637.0
541631,22549,PICTURE DOMINOES,24,2011-01-20 10:48:00,1.45,12637.0
541631,22550,HOLIDAY FUN LUDO,4,2011-01-20 10:48:00,3.75,12637.0
541631,22355,CHARLOTTE BAG SUKI DESIGN,10,2011-01-20 10:48:00,0.85,12637.0
541631,22271,FELTCRAFT DOLL ROSIE,12,2011-01-20 10:48:00,2.95,12637.0
541631,22272,FELTCRAFT DOLL MARIA,12,2011-01-20 10:48:00,2.95,12637.0
541631,22274,FELTCRAFT DOLL EMILY,12,2011-01-20 10:48:00,2.95,12637.0
541631,20682,RED RETROSPOT CHILDRENS UMBRELLA,6,2011-01-20 10:48:00,3.25,12637.0
541631,20684,STRAWBERRY DREAM CHILDS UMBRELLA,6,2011-01-20 10:48:00,3.25,12637.0
541631,POST,POSTAGE,6,2011-01-20 10:48:00,18.0,12637.0
C541688,22423,REGENCY CAKESTAND 3 TIER,-4,2011-01-20 16:15:00,10.95,12683.0
C541825,21877,HOME SWEET HOME MUG,-1,2011-01-21 17:01:00,1.25,12652.0
C541825,21875,KINGS CHOICE MUG,-1,2011-01-21 17:01:00,1.25,12652.0
C541825,20914,SET/5 RED RETROSPOT LID GLASS BOWLS,-1,2011-01-21 17:01:00,2.95,12652.0
541857,21195,PINK  HONEYCOMB PAPER BALL,12,2011-01-23 15:17:00,2.1,12727.0
541857,21208,PASTEL COLOUR HONEYCOMB FAN,12,2011-01-23 15:17:00,1.65,12727.0
541857,82484,WOOD BLACK BOARD ANT WHITE FINISH,3,2011-01-23 15:17:00,6.45,12727.0
541857,84988,SET OF 72 PINK HEART PAPER DOILIES,12,2011-01-23 15:17:00,1.45,12727.0
541857,72760B,VINTAGE CREAM 3 BASKET CAKE STAND,6,2011-01-23 15:17:00,9.95,12727.0
541857,22851,SET 20 NAPKINS FAIRY CAKES DESIGN,24,2011-01-23 15:17:00,0.85,12727.0
541857,72799E,IVORY PILLAR CANDLE SILVER FLOCK,6,2011-01-23 15:17:00,2.95,12727.0
541857,72800C,4 PINK DINNER CANDLE SILVER FLOCK,6,2011-01-23 15:17:00,2.55,12727.0
541857,15056N,EDWARDIAN PARASOL NATURAL,3,2011-01-23 15:17:00,5.95,12727.0
541857,22907,PACK OF 20 NAPKINS PANTRY DESIGN,12,2011-01-23 15:17:00,0.85,12727.0
541857,22215,CAKE STAND WHITE TWO TIER LACE,24,2011-01-23 15:17:00,7.65,12727.0
541857,POST,POSTAGE,6,2011-01-23 15:17:00,18.0,12727.0
541981,21094,SET/6 RED SPOTTY PAPER PLATES,12,2011-01-24 15:32:00,0.85,12691.0
541981,21086,SET/6 RED SPOTTY PAPER CUPS,12,2011-01-24 15:32:00,0.65,12691.0
541981,20750,RED RETROSPOT MINI CASES,12,2011-01-24 15:32:00,6.35,12691.0
541981,22352,LUNCH BOX WITH CUTLERY RETROSPOT,6,2011-01-24 15:32:00,2.55,12691.0
541981,22859,EASTER TIN BUNNY BOUQUET,6,2011-01-24 15:32:00,1.65,12691.0
541981,22333,RETROSPOT PARTY BAG + STICKER SET,16,2011-01-24 15:32:00,1.65,12691.0
541981,21578,WOODLAND DESIGN  COTTON TOTE BAG,6,2011-01-24 15:32:00,2.25,12691.0
541981,22083,PAPER CHAIN KIT RETROSPOT,6,2011-01-24 15:32:00,2.95,12691.0
541981,22331,WOODLAND PARTY BAG + STICKER SET,8,2011-01-24 15:32:00,1.65,12691.0
C542088,22556,PLASTERS IN TIN CIRCUS PARADE,-12,2011-01-25 12:36:00,1.65,12553.0
C542089,22301,COFFEE MUG CAT + BIRD DESIGN,-3,2011-01-25 12:39:00,2.55,12681.0
C542089,22300,COFFEE MUG DOG + BALL DESIGN,-2,2011-01-25 12:39:00,2.55,12681.0
542132,POST,POSTAGE,2,2011-01-25 15:59:00,18.0,12691.0
C542271,84927E,FLOWERS TILE HOOK,-2,2011-01-27 09:40:00,2.1,12637.0
C542271,84927D,LA PALMIERA TILE HOOK,-2,2011-01-27 09:40:00,2.1,12637.0
C542271,21068,VINTAGE BILLBOARD LOVE/HATE MUG,-5,2011-01-27 09:40:00,1.25,12637.0
