549325,23156,SET OF 5 MINI GROCERY MAGNETS,12,2011-04-08 10:32:00,2.08,12717.0
549325,23154,SET OF 4 JAM JAR MAGNETS,12,2011-04-08 10:32:00,2.08,12717.0
549325,23155,KNICKERBOCKERGLORY MAGNET ASSORTED,12,2011-04-08 10:32:00,0.83,12717.0
549325,23159,SET OF 5 PANCAKE DAY MAGNETS,12,2011-04-08 10:32:00,2.08,12717.0
549325,22969,HOMEMADE JAM SCENTED CANDLES,12,2011-04-08 10:32:00,1.45,12717.0
549325,22803,IVORY EMBROIDERED QUILT,1,2011-04-08 10:32:00,39.95,12717.0
549325,21670,BLUE SPOT CERAMIC DRAWER KNOB,12,2011-04-08 10:32:00,1.25,12717.0
549325,21669,BLUE STRIPE CERAMIC DRAWER KNOB,12,2011-04-08 10:32:00,1.25,12717.0
549325,22771,CLEAR DRAWER KNOB ACRYLIC EDWARDIAN,12,2011-04-08 10:32:00,1.25,12717.0
549325,22169,FAMILY ALBUM WHITE PICTURE FRAME,2,2011-04-08 10:32:00,8.5,12717.0
549325,22766,PHOTO FRAME CORNICE,8,2011-04-08 10:32:00,2.95,12717.0
549325,22317,FIVE CATS HANGING DECORATION,6,2011-04-08 10:32:00,2.95,12717.0
549325,21391,FRENCH LAVENDER SCENT HEART,6,2011-04-08 10:32:00,2.1,12717.0
549325,21114,LAVENDER SCENTED FABRIC HEART,10,2011-04-08 10:32:00,1.25,12717.0
549325,22730,ALARM CLOCK BAKELIKE IVORY,4,2011-04-08 10:32:00,3.75,12717.0
549325,22727,ALARM CLOCK BAKELIKE RED,4,2011-04-08 10:32:00,3.75,12717.0
549325,21700,BIG DOUGHNUT FRIDGE MAGNETS,12,2011-04-08 10:32:00,0.85,12717.0
549325,22922,FRIDGE MAGNETS US DINER ASSORTED,12,2011-04-08 10:32:00,0.85,12717.0
549325,21107,CREAM SLICE FLANNEL PINK SPOT,6,2011-04-08 10:32:00,2.95,12717.0
549325,84836,ZINC METAL HEART DECORATION,12,2011-04-08 10:32:00,1.25,12717.0
549325,21673,WHITE SPOT BLUE CERAMIC DRAWER KNOB,12,2011-04-08 10:32:00,1.25,12717.0
549325,22773,GREEN DRAWER KNOB ACRYLIC EDWARDIAN,12,2011-04-08 10:32:00,1.25,12717.0
549325,22831,WHITE BROCANTE SOAP DISH,6,2011-04-08 10:32:00,2.95,12717.0
549325,21110,LARGE CAKE TOWEL PINK SPOTS,2,2011-04-08 10:32:00,6.75,12717.0
549325,22410,MONEY BOX HOUSEKEEPING DESIGN,12,2011-04-08 10:32:00,1.25,12717.0
549325,22409,MONEY BOX BISCUITS DESIGN,12,2011-04-08 10:32:00,1.25,12717.0
549325,85053,FRENCH ENAMEL CANDLEHOLDER,6,2011-04-08 10:32:00,2.1,12717.0
549325,22427,ENAMEL FLOWER JUG CREAM,3,2011-04-08 10:32:00,5.95,12717.0
549325,22644,CERAMIC CHERRY CAKE MONEY BANK,12,2011-04-08 10:32:00,1.45,12717.0
549325,22497,SET OF 2 TINS VINTAGE BATHROOM,4,2011-04-08 10:32:00,4.25,12717.0
549325,POST,POSTAGE,2,2011-04-08 10:32:00,50.0,12717.0
