544495,23231,WRAP DOILEY DESIGN,25,2011-02-21 11:42:00,0.42,12766.0
544495,22637,PIGGY BANK RETROSPOT,8,2011-02-21 11:42:00,2.55,12766.0
544495,22139,RETROSPOT TEA SET CERAMIC 11 PC,3,2011-02-21 11:42:00,4.95,12766.0
544495,21498,RED RETROSPOT WRAP,25,2011-02-21 11:42:00,0.42,12766.0
544495,22937,BAKING MOULD CHOCOLATE CUPCAKES,6,2011-02-21 11:42:00,2.55,12766.0
544495,22646,CERAMIC STRAWBERRY CAKE MONEY BANK,12,2011-02-21 11:42:00,1.45,12766.0
544495,21914,BLUE HARMONICA IN BOX,12,2011-02-21 11:42:00,1.25,12766.0
544495,21500,PINK POLKADOT WRAP,25,2011-02-21 11:42:00,0.42,12766.0
544495,21915,RED  HARMONICA IN BOX,12,2011-02-21 11:42:00,1.25,12766.0
544495,21527,RED RETROSPOT TRADITIONAL TEAPOT,6,2011-02-21 11:42:00,7.95,12766.0
544495,21125,SET 6 FOOTBALL CELEBRATION CANDLES,12,2011-02-21 11:42:00,1.25,12766.0
544495,21980,PACK OF 12 RED RETROSPOT TISSUES,24,2011-02-21 11:42:00,0.29,12766.0
544495,22550,HOLIDAY FUN LUDO,4,2011-02-21 11:42:00,3.75,12766.0
544495,22457,NATURAL SLATE HEART CHALKBOARD,12,2011-02-21 11:42:00,2.95,12766.0
544495,20750,RED RETROSPOT MINI CASES,2,2011-02-21 11:42:00,7.95,12766.0
544495,21122,SET/10 PINK POLKADOT PARTY CANDLES,24,2011-02-21 11:42:00,1.25,12766.0
544495,21124,SET/10 BLUE POLKADOT PARTY CANDLES,24,2011-02-21 11:42:00,1.25,12766.0
544495,21121,SET/10 RED POLKADOT PARTY CANDLES,24,2011-02-21 11:42:00,1.25,12766.0
544495,21984,PACK OF 12 PINK PAISLEY TISSUES,24,2011-02-21 11:42:00,0.29,12766.0
544495,48184,DOORMAT ENGLISH ROSE,2,2011-02-21 11:42:00,7.95,12766.0
544495,84987,SET OF 36 TEATIME PAPER DOILIES,12,2011-02-21 11:42:00,1.45,12766.0
544495,84520B,PACK 20 ENGLISH ROSE PAPER NAPKINS,12,2011-02-21 11:42:00,0.85,12766.0
544495,21354,TOAST ITS - BEST MUM,12,2011-02-21 11:42:00,1.25,12766.0
544495,22073,RED RETROSPOT STORAGE JAR,4,2011-02-21 11:42:00,3.75,12766.0
544495,21218,RED SPOTTY BISCUIT TIN,6,2011-02-21 11:42:00,3.75,12766.0
544495,22138,BAKING SET 9 PIECE RETROSPOT,6,2011-02-21 11:42:00,4.95,12766.0
544495,22662,LUNCH BAG DOLLY GIRL DESIGN,10,2011-02-21 11:42:00,1.65,12766.0
544495,22366,DOORMAT AIRMAIL,2,2011-02-21 11:42:00,7.95,12766.0
544495,22851,SET 20 NAPKINS FAIRY CAKES DESIGN,12,2011-02-21 11:42:00,0.85,12766.0
544495,20685,DOORMAT RED RETROSPOT,2,2011-02-21 11:42:00,7.95,12766.0
544495,22666,RECIPE BOX PANTRY YELLOW DESIGN,12,2011-02-21 11:42:00,2.95,12766.0
544495,21531,RED RETROSPOT SUGAR JAM BOWL,6,2011-02-21 11:42:00,2.55,12766.0
544495,22472,TV DINNER TRAY DOLLY GIRL,3,2011-02-21 11:42:00,4.95,12766.0
544495,21844,RED RETROSPOT MUG,6,2011-02-21 11:42:00,2.95,12766.0
544495,22667,RECIPE BOX RETROSPOT,12,2011-02-21 11:42:00,2.95,12766.0
544495,21906,PHARMACIE FIRST AID TIN,4,2011-02-21 11:42:00,6.75,12766.0
544495,22649,STRAWBERRY FAIRY CAKE TEAPOT,8,2011-02-21 11:42:00,4.95,12766.0
544495,37448,CERAMIC CAKE DESIGN SPOTTED MUG,12,2011-02-21 11:42:00,1.49,12766.0
544495,84509A,SET OF 4 ENGLISH ROSE PLACEMATS,4,2011-02-21 11:42:00,3.75,12766.0
544495,48129,DOORMAT TOPIARY,2,2011-02-21 11:42:00,7.95,12766.0
544495,22473,TV DINNER TRAY VINTAGE PAISLEY,3,2011-02-21 11:42:00,4.95,12766.0
544495,21080,SET/20 RED RETROSPOT PAPER NAPKINS,12,2011-02-21 11:42:00,0.85,12766.0
544495,POST,POSTAGE,6,2011-02-21 11:42:00,28.0,12766.0
545191,20725,LUNCH BAG RED RETROSPOT,10,2011-02-28 15:39:00,1.65,12811.0
545191,22662,LUNCH BAG DOLLY GIRL DESIGN,10,2011-02-28 15:39:00,1.65,12811.0
545191,22859,EASTER TIN BUNNY BOUQUET,6,2011-02-28 15:39:00,1.65,12811.0
545191,22858,EASTER TIN KEEPSAKE,6,2011-02-28 15:39:00,1.65,12811.0
545191,22957,SET 3 PAPER VINTAGE CHICK PAPER EGG,6,2011-02-28 15:39:00,2.95,12811.0
545191,22663,JUMBO BAG DOLLY GIRL DESIGN,10,2011-02-28 15:39:00,1.95,12811.0
545191,21929,JUMBO BAG PINK VINTAGE PAISLEY,10,2011-02-28 15:39:00,1.95,12811.0
545191,85099B,JUMBO BAG RED RETROSPOT,10,2011-02-28 15:39:00,1.95,12811.0
545191,21928,JUMBO BAG SCANDINAVIAN BLUE PAISLEY,10,2011-02-28 15:39:00,1.95,12811.0
545191,22411,JUMBO SHOPPER VINTAGE RED PAISLEY,10,2011-02-28 15:39:00,1.95,12811.0
545191,21932,SCANDINAVIAN PAISLEY PICNIC BAG,5,2011-02-28 15:39:00,2.95,12811.0
545191,21933,PINK VINTAGE PAISLEY PICNIC BAG,5,2011-02-28 15:39:00,2.95,12811.0
545191,21936,RED RETROSPOT PICNIC BAG,5,2011-02-28 15:39:00,2.95,12811.0
545191,POST,POSTAGE,1,2011-02-28 15:39:00,28.0,12811.0
545937,84879,ASSORTED COLOUR BIRD ORNAMENT,24,2011-03-08 12:05:00,1.69,12758.0
545937,22740,POLKADOT PEN,48,2011-03-08 12:05:00,0.85,12758.0
545937,20750,RED RETROSPOT MINI CASES,6,2011-03-08 12:05:00,7.95,12758.0
545937,21218,RED SPOTTY BISCUIT TIN,6,2011-03-08 12:05:00,3.75,12758.0
545937,21165,BEWARE OF THE CAT METAL SIGN,12,2011-03-08 12:05:00,1.69,12758.0
545937,82600,NO SINGING METAL SIGN,12,2011-03-08 12:05:00,2.1,12758.0
545937,22276,WASH BAG VINTAGE ROSE PAISLEY,24,2011-03-08 12:05:00,2.55,12758.0
545937,20725,LUNCH BAG RED RETROSPOT,30,2011-03-08 12:05:00,1.65,12758.0
545937,22667,RECIPE BOX RETROSPOT,6,2011-03-08 12:05:00,2.95,12758.0
545937,85099B,JUMBO BAG RED RETROSPOT,20,2011-03-08 12:05:00,1.95,12758.0
545937,85150,LADIES & GENTLEMEN METAL SIGN,12,2011-03-08 12:05:00,2.55,12758.0
545937,22492,MINI PAINT SET VINTAGE,72,2011-03-08 12:05:00,0.65,12758.0
545937,22630,DOLLY GIRL LUNCH BOX,12,2011-03-08 12:05:00,1.95,12758.0
545937,22383,LUNCH BAG SUKI DESIGN,40,2011-03-08 12:05:00,1.65,12758.0
545937,22384,LUNCH BAG PINK POLKADOT,20,2011-03-08 12:05:00,1.65,12758.0
545937,22662,LUNCH BAG DOLLY GIRL DESIGN,20,2011-03-08 12:05:00,1.65,12758.0
545937,21181,PLEASE ONE PERSON METAL SIGN,12,2011-03-08 12:05:00,2.1,12758.0
545937,22923,FRIDGE MAGNETS LES ENFANTS ASSORTED,12,2011-03-08 12:05:00,0.85,12758.0
545937,21928,JUMBO BAG SCANDINAVIAN BLUE PAISLEY,30,2011-03-08 12:05:00,1.95,12758.0
545937,21929,JUMBO BAG PINK VINTAGE PAISLEY,30,2011-03-08 12:05:00,1.95,12758.0
545937,21931,JUMBO STORAGE BAG SUKI,30,2011-03-08 12:05:00,1.95,12758.0
545937,22385,JUMBO BAG SPACEBOY DESIGN,10,2011-03-08 12:05:00,1.95,12758.0
545937,22386,JUMBO BAG PINK POLKADOT,20,2011-03-08 12:05:00,1.95,12758.0
545937,22411,JUMBO SHOPPER VINTAGE RED PAISLEY,30,2011-03-08 12:05:00,1.95,12758.0
545937,22663,JUMBO BAG DOLLY GIRL DESIGN,20,2011-03-08 12:05:00,1.95,12758.0
545937,85099C,JUMBO  BAG BAROQUE BLACK WHITE,20,2011-03-08 12:05:00,1.95,12758.0
545937,22277,COSMETIC BAG VINTAGE ROSE PAISLEY,6,2011-03-08 12:05:00,2.1,12758.0
545937,22355,CHARLOTTE BAG SUKI DESIGN,20,2011-03-08 12:05:00,0.85,12758.0
545937,22661,CHARLOTTE BAG DOLLY GIRL DESIGN,20,2011-03-08 12:05:00,0.85,12758.0
545937,20724,RED RETROSPOT CHARLOTTE BAG,20,2011-03-08 12:05:00,0.85,12758.0
545937,20728,LUNCH BAG CARS BLUE,20,2011-03-08 12:05:00,1.65,12758.0
545937,22974,CHILDRENS DOLLY GIRL MUG,12,2011-03-08 12:05:00,1.65,12758.0
545937,21506,"FANCY FONT BIRTHDAY CARD,",24,2011-03-08 12:05:00,0.42,12758.0
545937,22994,TRAVEL CARD WALLET RETROSPOT,48,2011-03-08 12:05:00,0.42,12758.0
545937,22995,TRAVEL CARD WALLET SUKI,48,2011-03-08 12:05:00,0.42,12758.0
545937,22996,TRAVEL CARD WALLET VINTAGE TICKET,48,2011-03-08 12:05:00,0.42,12758.0
545937,23000,TRAVEL CARD WALLET TRANSPORT,48,2011-03-08 12:05:00,0.42,12758.0
545937,23006,TRAVEL CARD WALLET FLOWER MEADOW,48,2011-03-08 12:05:00,0.42,12758.0
545937,21210,SET OF 72 RETROSPOT PAPER  DOILIES,12,2011-03-08 12:05:00,1.45,12758.0
545937,22967,SET 3 SONG BIRD PAPER EGGS ASSORTED,6,2011-03-08 12:05:00,2.95,12758.0
545937,22957,SET 3 PAPER VINTAGE CHICK PAPER EGG,12,2011-03-08 12:05:00,2.95,12758.0
545937,23179,CLOCK MAGNET MUM'S KITCHEN,6,2011-03-08 12:05:00,2.89,12758.0
545937,23176,ABC TREASURE BOOK BOX,24,2011-03-08 12:05:00,2.25,12758.0
545937,23178,JAM CLOCK MAGNET,6,2011-03-08 12:05:00,2.89,12758.0
545937,23187,FRENCH STYLE STORAGE JAR BONBONS,12,2011-03-08 12:05:00,1.25,12758.0
545937,22983,CARD BILLBOARD FONT,12,2011-03-08 12:05:00,0.42,12758.0
545937,20749,ASSORTED COLOUR MINI CASES,2,2011-03-08 12:05:00,7.95,12758.0
545937,20658,RED RETROSPOT LUGGAGE TAG,12,2011-03-08 12:05:00,1.25,12758.0
545937,20652,BLUE POLKADOT LUGGAGE TAG,12,2011-03-08 12:05:00,1.25,12758.0
545937,21745,GAOLERS KEYS DECORATIVE GARDEN,4,2011-03-08 12:05:00,3.75,12758.0
545937,22357,KINGS CHOICE BISCUIT TIN,4,2011-03-08 12:05:00,4.25,12758.0
545937,22402,MAGNETS PACK OF 4 VINTAGE COLLAGE,12,2011-03-08 12:05:00,1.25,12758.0
545937,22399,MAGNETS PACK OF 4 CHILDHOOD MEMORY,12,2011-03-08 12:05:00,1.25,12758.0
545937,82583,HOT BATHS METAL SIGN,12,2011-03-08 12:05:00,2.1,12758.0
545937,22899,CHILDREN'S APRON DOLLY GIRL,6,2011-03-08 12:05:00,2.1,12758.0
545937,22472,TV DINNER TRAY DOLLY GIRL,3,2011-03-08 12:05:00,4.95,12758.0
547444,84279B,CHERRY BLOSSOM DECORATIVE FLASK,4,2011-03-23 10:55:00,3.75,12811.0
547444,84279P,CHERRY BLOSSOM  DECORATIVE FLASK,4,2011-03-23 10:55:00,3.75,12811.0
547444,21164,HOME SWEET HOME METAL SIGN,6,2011-03-23 10:55:00,2.95,12811.0
547444,22745,POPPY'S PLAYHOUSE BEDROOM,6,2011-03-23 10:55:00,2.1,12811.0
547444,22747,POPPY'S PLAYHOUSE BATHROOM,6,2011-03-23 10:55:00,2.1,12811.0
547444,22746,POPPY'S PLAYHOUSE LIVINGROOM,6,2011-03-23 10:55:00,2.1,12811.0
547444,22748,POPPY'S PLAYHOUSE KITCHEN,6,2011-03-23 10:55:00,2.1,12811.0
547444,85227,SET OF 6 3D KIT CARDS FOR KIDS,12,2011-03-23 10:55:00,0.85,12811.0
547444,23176,ABC TREASURE BOOK BOX,8,2011-03-23 10:55:00,2.25,12811.0
547444,23177,TREASURE ISLAND BOOK BOX,8,2011-03-23 10:55:00,2.25,12811.0
547444,22492,MINI PAINT SET VINTAGE,36,2011-03-23 10:55:00,0.65,12811.0
547444,22968,ROSE COTTAGE KEEPSAKE BOX,2,2011-03-23 10:55:00,9.95,12811.0
547444,21932,SCANDINAVIAN PAISLEY PICNIC BAG,10,2011-03-23 10:55:00,2.95,12811.0
547444,21933,PINK VINTAGE PAISLEY PICNIC BAG,5,2011-03-23 10:55:00,2.95,12811.0
547444,21937,STRAWBERRY   PICNIC BAG,5,2011-03-23 10:55:00,2.95,12811.0
547444,POST,POSTAGE,1,2011-03-23 10:55:00,1.0,12811.0
547566,POST,POSTAGE,1,2011-03-24 09:42:00,27.0,12811.0
547897,22567,20 DOLLY PEGS RETROSPOT,12,2011-03-28 11:36:00,1.25,12792.0
547897,22667,RECIPE BOX RETROSPOT,6,2011-03-28 11:36:00,2.95,12792.0
547897,21210,SET OF 72 RETROSPOT PAPER  DOILIES,12,2011-03-28 11:36:00,1.45,12792.0
547897,22582,PACK OF 6 SWEETIE GIFT BOXES,6,2011-03-28 11:36:00,2.55,12792.0
547897,22750,FELTCRAFT PRINCESS LOLA DOLL,4,2011-03-28 11:36:00,3.75,12792.0
547897,22751,FELTCRAFT PRINCESS OLIVIA DOLL,4,2011-03-28 11:36:00,3.75,12792.0
547897,21912,VINTAGE SNAKES & LADDERS,4,2011-03-28 11:36:00,3.75,12792.0
547897,22605,WOODEN CROQUET GARDEN SET,1,2011-03-28 11:36:00,14.95,12792.0
547897,21888,BINGO SET,4,2011-03-28 11:36:00,3.75,12792.0
547897,22857,ASSORTED EASTER GIFT TAGS,12,2011-03-28 11:36:00,0.85,12792.0
547897,22859,EASTER TIN BUNNY BOUQUET,6,2011-03-28 11:36:00,1.65,12792.0
547897,22858,EASTER TIN KEEPSAKE,6,2011-03-28 11:36:00,1.65,12792.0
547897,22957,SET 3 PAPER VINTAGE CHICK PAPER EGG,6,2011-03-28 11:36:00,2.95,12792.0
547897,22285,HANGING HEN ON NEST DECORATION,12,2011-03-28 11:36:00,1.65,12792.0
547897,22269,EGG CUP NATURAL CHICKEN,8,2011-03-28 11:36:00,1.25,12792.0
547897,21577,SAVE THE PLANET COTTON TOTE BAG,6,2011-03-28 11:36:00,2.25,12792.0
547897,22548,HEADS AND TAILS SPORTING FUN,12,2011-03-28 11:36:00,1.25,12792.0
547897,21791,VINTAGE HEADS AND TAILS CARD GAME,12,2011-03-28 11:36:00,1.25,12792.0
547897,22708,WRAP DOLLY GIRL,25,2011-03-28 11:36:00,0.42,12792.0
547897,22027,TEA PARTY BIRTHDAY CARD,12,2011-03-28 11:36:00,0.42,12792.0
547897,22969,HOMEMADE JAM SCENTED CANDLES,12,2011-03-28 11:36:00,1.45,12792.0
547897,22961,JAM MAKING SET PRINTED,12,2011-03-28 11:36:00,1.45,12792.0
547897,22296,HEART IVORY TRELLIS LARGE,12,2011-03-28 11:36:00,1.65,12792.0
547897,72741,GRAND CHOCOLATECANDLE,9,2011-03-28 11:36:00,1.45,12792.0
547897,POST,POSTAGE,2,2011-03-28 11:36:00,28.0,12792.0
548470,84879,ASSORTED COLOUR BIRD ORNAMENT,8,2011-03-31 12:36:00,1.69,12782.0
548470,22139,RETROSPOT TEA SET CERAMIC 11 PC,12,2011-03-31 12:36:00,4.95,12782.0
548470,22967,SET 3 SONG BIRD PAPER EGGS ASSORTED,12,2011-03-31 12:36:00,2.95,12782.0
548470,22957,SET 3 PAPER VINTAGE CHICK PAPER EGG,12,2011-03-31 12:36:00,2.95,12782.0
548470,22620,4 TRADITIONAL SPINNING TOPS,12,2011-03-31 12:36:00,1.25,12782.0
548470,47591D,PINK FAIRY CAKE CHILDRENS APRON,16,2011-03-31 12:36:00,1.95,12782.0
548470,22276,WASH BAG VINTAGE ROSE PAISLEY,6,2011-03-31 12:36:00,2.55,12782.0
548470,21935,SUKI  SHOULDER BAG,20,2011-03-31 12:36:00,1.65,12782.0
548470,21914,BLUE HARMONICA IN BOX,12,2011-03-31 12:36:00,1.25,12782.0
548470,85123A,WHITE HANGING HEART T-LIGHT HOLDER,12,2011-03-31 12:36:00,2.95,12782.0
548470,22321,BIRD DECORATION RED RETROSPOT,24,2011-03-31 12:36:00,0.85,12782.0
548470,84581,DOG TOY WITH PINK CROCHET SKIRT,4,2011-03-31 12:36:00,3.75,12782.0
548470,POST,POSTAGE,2,2011-03-31 12:36:00,28.0,12782.0
548470,22355,CHARLOTTE BAG SUKI DESIGN,10,2011-03-31 12:36:00,0.85,12782.0
548470,21580,RABBIT  DESIGN  COTTON TOTE BAG,6,2011-03-31 12:36:00,2.25,12782.0
548470,21578,WOODLAND DESIGN  COTTON TOTE BAG,6,2011-03-31 12:36:00,2.25,12782.0
